Produk,Harga,Sold,Nama Toko
"Jam jadwal sholat TV. JWS TV. Jam masjid TV, Versi 2 - Paket 1",Rp1.800.000Rp2.000.000,100+ terjual,Bamboo nanda art galleryTangerang Selatan
JAM DIGITAL JADWAL SHOLAT TYPE JWS P5 RGB 3X6 HL.,Rp9.500.000,,Bamboo nanda art galleryTangerang Selatan
Kontroller Jws Khalifah Jadwal Sholat Jam Masjid P10 SINGLE - 1 BARIS,Rp185.000,250+ terjual,CV. MEDIA DIGITAL TECHNOLOGYSukabumi
Jam Masjid Jadwal Waktu Sholat Jws Tinggal Pasang P10 RGB - 1 BARIS,Rp810.000,24 terjual,CV. MEDIA DIGITAL TECHNOLOGYSukabumi
JAM DIGITAL JADWAL SHOLAT MASJID. JWS K,Rp1.390.000,70+ terjual,Bamboo nanda art galleryTangerang Selatan
Kontroller Jws Khalifah Jadwal Sholat Jam Masjid P10 SINGLE - 1 BARIS,Rp185.000,4.9250+ terjual,CV. MEDIA DIGITAL TECHNOLOGYSukabumi
Jam waktu Sholat Masjid TV LED - Jadwal waktu Sholat digital - Jasma murah,Rp2.400.000,5.025 terjual,Jasma DigitalKab. Sleman
Jadwal Sholat Digital Jam Masjid Digital Bisa Ganti Nama Masjid,Rp950.000,4.9500+ terjual,Jam Masjid Digital RTCBandung
"Jam jadwal sholat TV. JWS TV. Jam masjid TV, Versi 2",Rp1.800.000Rp2.000.000,5.0100+ terjual,Bamboo nanda art galleryTangerang Selatan
JWS TV Android - Display Jadwal Sholat Digital,Rp259.000,4.522 terjual,Karya-Tronika TeknologiKab. Tabanan
JAM DIGITAL JADWAL SHOLAT MASJID TYPE P10 2P KH,Rp792.000Rp990.000,60+ terjual,Bamboo nanda art galleryTangerang Selatan
Controller Jws Khalifah Jadwal Sholat Jam Masjid P10 SINGLE - 2 BARIS,Rp319.000,80+ terjual,CV. MEDIA DIGITAL TECHNOLOGYSukabumi
JWS TV Android - Display Jadwal Sholat Digital,Rp259.000,22 terjual,Karya-Tronika TeknologiKab. Tabanan
"Jadwal Sholat Digital Running Text Indoor Uk. 20X100 - Merah, Non Tartil",Rp700.000,30+ terjual,VanledKab. Tegal
MauQuta TV Plus Jadwal Sholat Digital TV - MQ TV Plus Pro,Rp3.450.000,1 terjual,Mauquta BarokahKab. Sidoarjo
JAM ADZAN DIGITAL LED OTOMATIS TNT2019. JADWAL SHOLAT,Rp585.000,4.9750+ terjual,DIGITAL GROSIRJakarta Pusat
Controller Jws Khalifah Jadwal Sholat Jam Masjid P5 RGB - 1 BARIS,Rp250.000,5.0100+ terjual,CV. MEDIA DIGITAL TECHNOLOGYSukabumi
Kontroller Jws Khalifah Jadwal Waktu Sholat Masjid P5 RGB - 2 BARIS,Rp420.000,5.060+ terjual,CV. MEDIA DIGITAL TECHNOLOGYSukabumi
KALENDER BULANAN TERBARU- dengan memo dan jadwal sholat,Rp5.350,4.8100+ terjual,ChingyenJakarta Barat
Jam Adzan Digital LCD Jadwal Sholat Otomatis - 8 Pilihan Suara Adzan,Rp460.000,5.0100+ terjual,DIGITAL GROSIRJakarta Pusat
[ Al-Ashr ] JWSSTM / Jadwal Sholat / Jam Masjid / Modul JWS (server),Rp148.000,5.0500+ terjual,Cakrawala Elektronika SurabayaSurabaya
[ Al-Ashr ] JWSSTM P10RGB / Jadwal Sholat / Jam Masjid / Modul JWS,Rp149.500,4.980+ terjual,Cakrawala Elektronika SurabayaSurabaya
Jam Digital LED Jadwal Sholat Mushola Masjid Adzan Otomatis,Rp585.000,4.9100+ terjual,Frekuensi AmanJakarta Barat
Jam Digital Jadwal Sholat Masjid - Jam Masjid 20x100 cm JWS,Rp700.000,4.911 terjual,3 Serangkai TeknikKab. Tangerang
Jam Jadwal sholat Masjid Running text/ tulisan berjalan,Rp1.791.000Rp1.990.000,4.940+ terjual,Bamboo nanda art galleryTangerang Selatan
Jadwal Sholat Digital Android TV,Rp550.000,60+ terjual,Karya-Tronika TeknologiKab. Tabanan
mauQuta MQ-KBH Jam Jadwal Sholat Adzan Murottal - MQ 03 KBH,Rp825.000,80+ terjual,Mauquta BarokahKab. Sidoarjo
Jam Digital Jadwal Waktu Sholat Jws Lapadz Tinggal Pasang P5 - 2 BARIS,Rp2.348.500,13 terjual,CV. MEDIA DIGITAL TECHNOLOGYSukabumi
"JAM DIGITAL JADWAL SHOLAT MASJID ADA LAPORAN SALDO, TYPE JWS P10 3P KH",Rp967.500Rp1.290.000,100+ terjual,Bamboo nanda art galleryTangerang Selatan
Jadwal Sholat Digital Jam masjid Tipe B Imsak Klasik Ukuran 80 cm x 40 cm Bisa Custom Nama Dan Gambar - Tanpa Wifi,Rp1.979.998,,Toko Jam Digital Masjid LEDBalikpapan
Kontroller Jadwal Sholat WIFI Simple dan Ekonomis - 4 panel T1,Rp200.000,5.03rb+ terjual,EteknoLABKab. Lampung Tengah
Controller Jws Khalifah Jadwal Sholat Jam Masjid P10 SINGLE - 2 BARIS,Rp319.000,5.080+ terjual,CV. MEDIA DIGITAL TECHNOLOGYSukabumi
Jadwal Sholat Digital Jam Digital Sholat Ukuran 70 cm x 30 cm,Rp800.000,4.9100+ terjual,Jam Masjid Digital RTCBandung
Jam Masjid Digital Jadwal Waktu Sholat Jws Tinggal Pasang P5 - 1 BARIS,Rp1.010.000,5.0100+ terjual,CV. MEDIA DIGITAL TECHNOLOGYSukabumi
Kontroller Jws Khalifah Jadwal Sholat Jam Masjid P10 RGB - 1 BARIS,Rp198.500,5.090+ terjual,CV. MEDIA DIGITAL TECHNOLOGYSukabumi
Jasma Versi Spesial Edition Jam Jadwal waktu Sholat Masjid TV LED,Rp3.749.000,5.0100+ terjual,Jasma Digital JakartaDepok
TS - Jam Digital Jadwal Sholat Masjid - Jam Masjid 20x100 cm JWS,Rp735.000,4.814 terjual,3 Serangkai ToolsKab. Tangerang
kalender 2025 lengkap jadwal salat weton jawa tanggalan Dinding Bulanan Lengkap Komplit Beserta Weton Jawa Jowo Waktu Shalat Solat Salat Angka Besar Jelas,Rp13.999,5.028 terjual,samiajishopSemarang
Kontroler JWS Jadwal Sholat Wifi P10 1Warna,Rp146.000,5.070+ terjual,FAN LED ReklameBandung
"JAM DIGITAL JADWAL SHOLAT MASJID ADA LAPORAN SALDO, TYPE JWS P10 3P KH",Rp967.500Rp1.290.000,5.0100+ terjual,Bamboo nanda art galleryTangerang Selatan
"Kontroller Jws Khalifah Jadwal Sholat Jam Masjid P10 RGB - 1 BARIS - 1X1 1PANEL, Kontroller Only",Rp198.500,90+ terjual,CV. MEDIA DIGITAL TECHNOLOGYSukabumi
Jam Masjid Jadwal Sholat Digital Ukuran 80 cm x 30 cm Tipe A Imsak Klasik Bisa Custom Nama Masjid Dan Gambar - Tanpa Wifi,Rp1.649.998,,Toko Jam Digital Masjid LEDBalikpapan
RUNNING TEXT JWS JADWAL SHOLAT JAM WAKTU SHOLAT JAM SHOLAT P5 RGB FULL COLOR 20X100CM 32x192pixel,Rp1.265.000,5 terjual,ANUGRAH LED KLATENKab. Klaten
"Jam Masjid Jadwal Sholat Digital Ukuran 70 cm x 40 cm Tipe B Minimalis Bisa Custom Nama Masjid Dan Gambar - Tombol, Gold",Rp1.209.998,,Toko Jam Digital Masjid LEDBalikpapan
JAM DIGITAL MASJID JAM JADWAL SHOLAT FULL COLOR JWS P5 5P KH RGB - Non Mp3+Adzan,Rp2.691.000Rp2.990.000,25 terjual,Bamboo nanda art galleryTangerang Selatan
Source Code Aplikasi Web Display Informasi Masjid Jadwal Sholat,Rp105.000,4.960+ terjual,IT Shop PurwokertoKab. Banyumas
JAM DIGITAL MASJID JAM JADWAL SHOLAT FULL COLOR JWS P5 5P KH RGB,Rp2.691.000Rp2.990.000,5.025 terjual,Bamboo nanda art galleryTangerang Selatan
Modul Kit Jadwal Sholat Seven 7 Segment Mini,Rp595.000,5.07 terjual,RivalledJakarta Utara
Kontroller Jws Khalifah Jadwal Waktu Sholat Masjid P10 RGB - 2 BARIS,Rp550.000,5.030+ terjual,CV. MEDIA DIGITAL TECHNOLOGYSukabumi
"Panel Jadwal Sholat P4,75/P5/P10",Rp60.000,4.930+ terjual,KontritechKab. Bantul
JAM MASJID jadwal sholat wifi 70x20cm,Rp600.000,5.040+ terjual,RD-LEDKab. Ponorogo
Jam Digital Adzan Jadwal Sholat Otomatis Suara Adzan & Iqomah AZ 2515,Rp400.000,5.090+ terjual,DIGITAL GROSIRJakarta Pusat
Jadwal Sholat Jumat || jadwal adzan sholat,Rp450.000,5.03 terjual,Apien MotorKab. Lebak
jadwal solat anak check list solat,Rp7.500,5.060+ terjual,Bismillah PrintingSurabaya
Jadwal Sholat Digital Display TV Murottal dan Tarhim Otomatis,Rp400.000,5.014 terjual,Karya-Tronika TeknologiKab. Tabanan
Jam Adzan Digital Jadwal Sholat Otomatis TNT 2019,Rp585.000,5.0250+ terjual,Digital EltroJakarta Pusat
PAPAN JADWAL SHOLAT MANUAL,Rp25.000,4.940+ terjual,toko ar'rasyidTangerang
Jadwal Sholat TV Android,Rp950.000,5.023 terjual,syifamartKab. Serang
"Running text jadwal sholat, jam digital masjid 100cm x 20cm",Rp708.000,4.960+ terjual,multiguna elektronikKab. Malang
Jam Adzan Digital Jadwal Sholat Otomatis & Suara Iqomah AZ 2012,Rp305.000,4.9250+ terjual,DIGITAL GROSIRJakarta Pusat
Controller JWS Murottal Quad Multi Panel Wifi MP3 Jam Jadwal Sholat,Rp239.000,4.9100+ terjual,Elektron MartTangerang
Promo Software TVP Display Informasi Video Teks Jadwal Sholat,Rp95.000,4.950+ terjual,Jual bibit murahKab. Purworejo
kalender kerja Arab/jadwal sholat,Rp7.500,4.630+ terjual,"Bintangjayatoy,sJakarta Utara"
Jam Adzan Digital Jadwal Sholat Otomatis Suara Iqomah AZ 2012,Rp280.250,3.930+ terjual,Glodok SupermarketJakarta Barat
Kontroller JWS Jadwal Waktu Sholat 2 Baris P10,Rp155.000,4.9100+ terjual,Apik MediaKab. Blora
Kontroler JWS Jadwal Sholat WIFI P2.5 RGB,Rp370.000,5.05 terjual,FAN LED ReklameBandung
Jam Masjid Jadwal Waktu Sholat Jws Tinggal Pasang P10 RGB - 1 BARIS,Rp810.000,4.924 terjual,CV. MEDIA DIGITAL TECHNOLOGYSukabumi
JAM DIGITAL WIFI (JADWAL WAKTU SHOLAT) 20X70CM SLIM 3.5cm,Rp600.000,5.040+ terjual,RD-LEDKab. Ponorogo
Kontroller Jadwal Sholat Digital RGB Full Color - non Tartil,Rp280.000,5.01rb+ terjual,EteknoLABKab. Lampung Tengah
Jam masjid Jadwal sholat LED running text 200cm x 20cm merah mesjid,Rp1.500.000,4.840+ terjual,BonafidJakarta Timur
Jadwal sholat Papan Jadwal Shalat Manual Lengkap,Rp35.000,5.090+ terjual,latanza wakidahJakarta Utara
JADWAL PETUGAS SHOLAT CUSTOME #NMM07,Rp420.000,5.01 terjual,PC KaligrafiKab. Tangerang
Jam Digital Jadwal Sholat Masjid 30 cmx110cm,Rp967.500Rp1.290.000,5.0250+ terjual,Bamboo nanda art galleryTangerang Selatan
"REMOTE KIT JADWAL SHOLAT (JSB, JSK, JSE)",Rp52.000,5.0250+ terjual,sinar ledDepok
Murotal Timer Otomatis Auto Tartil JWS jadwal sholat tarhim masjid mp3,Rp900.000,4.925 terjual,VisayanMakassar
Jam masjid Jadwal sholat LED running text 130cm x 20cm merah mesjid,Rp1.250.000,4.990+ terjual,BonafidJakarta Timur
Jadwal Sholat Digital TV Versi Terbaru,Rp550.000,5.08 terjual,Karya-Tronika TeknologiKab. Tabanan
Set tv box android B860H set aplikasi jadwal sholat,Rp260.000,1 terjual,Dewek store.Kab. Bekasi
Jam Dinding Jadwal Sholat Shalat Solat Islami Muslim Minimalis Kayu,Rp37.900Rp60.000,4.8500+ terjual,Jam Karakter BandungKab. Bandung Barat
JWS TV WAKTIHA - Jam digital jadwal sholat dan papan informasi masjid,Rp550.000,,tokojamdigitalSurakarta
Jadwal Sholat Digital Jam Masjid Tipe A Klasik Ukuran 70 cm x 30 cm Bisa Custom Nama Masjid Dan Gambar - Tanpa Wifi,Rp1.429.998,,Toko Jam Digital Masjid LEDBalikpapan
DZIKROUND PREMIUM M4 Jam Digital Jadwal sholat Otomatis + Running Text,Rp1.500.000,3 terjual,DZIKROUNDKab. Sidoarjo
Jam masjid Jadwal Sholat Digital Tipe B Klasik Ukuran 70 cm x 40 cm Bisa Custom Nama Masjid Dan Gambar - Tanpa Wifi,Rp1.704.998,,Toko Jam Digital Masjid LEDBalikpapan
"Jam Digital Jadwal Sholat Masjid , runing text - MERAH EMAS",Rp494.100Rp549.000,80+ terjual,Bamboo nanda art galleryTangerang Selatan
Jam Digital Masjid Jadwal Sholat 80cm x 30cm. Tipe A Imsak/Syuruq - Tanpa Wifi,Rp1.483.898,4 terjual,Toko Jam Digital Masjid LEDBalikpapan
Lampu led jadwal sholat 100x60cm,Rp4.000.000,,elektrik dan elektronikJakarta Barat
Jam Masjid Running Text Jadwal Sholat P10 Warna Merah dan Hijau Ukuran 104 cm x 24 cm - Merah,Rp2.035.000,,Toko Jam Digital Masjid LEDBalikpapan
"Jam Jadwal sholat, type jws p5 2p full color.suara tarhim,azan&murotal",Rp1.850.000,2 terjual,Bamboo nanda art galleryTangerang Selatan
Jam Masjid Jadwal Waktu Sholat Tipe B Minimalis Uk 70x40 Cm - Hanya Tombol,Rp1.485.000,1 terjual,Toko Jam Digital Masjid LEDBalikpapan
"JAM SHOLAT MASJID, JAM DIGITAL JADWAL SHOLAT, TYPE P10 RGB 4P KH - TAMPILAN 1",Rp1.791.000Rp1.990.000,9 terjual,Bamboo nanda art galleryTangerang Selatan
Jam Adzan Digital LCD Jadwal Sholat Otomatis Al-Fatiha Faj-106,Rp260.000,5.017 terjual,digitalgrosirJakarta Pusat
JADWAL SHOLAT DAN PUASA ANAK-ANAK TABEL RAMADHAN,Rp6.000,5.06 terjual,JDM ProjectKab. Mojokerto
jam musholla jam Iqomah jadwal sholat digital digital player,Rp50.000,5.06 terjual,ATJ LED IndonesiaKab. Bekasi
KONTROLLER JADWAL SHOLAT MULTI PANEL P10 CONTROLLER JWS AUTO TARTIL,Rp160.000Rp180.000,4.916 terjual,Warna parabolaKab. Ponorogo
Jam Digital LED Jadwal Sholat 5 waktu Muusholla Masjid dan Cocok untuk hiasan Rumah,Rp480.000Rp580.000,4.415 terjual,yahfi storeJakarta Barat
Jam Digital Jadwal Sholat 80 cm x 30 cm. Tipe A Imsak Klasik Adzan - Pakai Wifi,Rp2.034.998,1 terjual,Toko Jam Digital Masjid LEDBalikpapan
"jadwal waktu sholat, jam masjid digital waktu shalat GPS +timer iqomah",Rp1.200.000,,prima electronicJakarta Barat
Tipe A Minimalis. Jam Masjid Jadwal Sholat Digital Ukuran 70cm x 30cm - Tanpa Wifi,Rp1.209.996,27 terjual,Toko Jam Digital Masjid LEDBalikpapan
jam masjid jadwal waktu sholat digital + timer iqomah + runing text,Rp1.200.000,8 terjual,prima electronicJakarta Barat
Jadwal Sholat Digital Jam Masjid Digital Ukuran 96X32 P5 Full Color,Rp4.300.000,,LED JeparaKab. Jepara
Controller Jadwal Sholat (JWSDS SE),Rp230.000,5.0100+ terjual,Ledstore OfficialJakarta Barat
Aplikasi Jam digital jadwal sholat dan papan informasi masjid,Rp550.000,1 terjual,tokojamdigitalSurakarta
"Jam Digita Jadwal Sholat Kaligrafi, Murotal, Tarhim dan Suara Azan",Rp841.500Rp990.000,5.010 terjual,Bamboo nanda art galleryTangerang Selatan
PCB JADWAL SHOLAT SEVENT 7 SEGMENT 1 INCH ANODE,Rp125.000,5.015 terjual,RivalledJakarta Utara
JWS AL-AMIN 2 Lite (kontroller jadwal sholat include mp3 tartil &,Rp262.000,,bimbim_oBogor
jam jadwal sholat digital jam sholat masjid / Musholla 1 Panel,Rp400.000Rp650.000,5.08 terjual,Warna parabolaKab. Ponorogo
Jam Adzan Digital LCD Jadwal Sholat Otomatis Al-Fatiha Faj-106,Rp260.000,5.020 terjual,DIGITAL GROSIRJakarta Pusat
"Jam Digital Jadwal Sholat Runing Text RGB Full Color , JWS P5 2x3PKH",Rp3.051.000Rp3.390.000,5.03 terjual,Bamboo nanda art galleryTangerang Selatan
"Alat otomatis On Off Amplifier untuk Jadwal Sholat Digital ""Voice""",Rp400.000,5.01 terjual,Arrival Media ShopSurabaya
PCB Jadwal Waktu Sholat JWS Running Text RTC DS3231 HC 05,Rp10.000,4.8100+ terjual,Cetak PCBKab. Jember
JAM DIGITAL JADWAL SHOLAT TYPE P10 3P RGB KH - Non Murotal.,Rp1.192.500Rp1.590.000,3 terjual,Bamboo nanda art galleryTangerang Selatan
controller Jadwal sholat JWS onbon wi fi,Rp650.000,,elektrik dan elektronikJakarta Barat
jam jadwal waktu sholat sholat digital + alarm + timer jeda iqomah,Rp1.400.000,1 terjual,prima electronicJakarta Barat
JAM DIGITAL JADWAL SHOLAT MASJID FULL COLOR RGB BESAR 46 CMX206CM - tampa murotal,Rp4.810.700Rp6.590.000,9 terjual,Bamboo nanda art galleryTangerang Selatan
"jam jadwal waktu sholat digital, jeda adzan iqomah, led running text",Rp3.000.000,3 terjual,prima electronicJakarta Barat
Remote jadwal sholat digital jam masjid remot khusus,Rp90.000,5.016 terjual,ATJ LED IndonesiaKab. Bekasi
READY !!! JWS TV Android - Display Jadwal Sholat Digital,Rp574.000,,RipicloeSurabaya
Kalender kerja medium jadwal sholat ukuran [ 42 × 48cm ],Rp7.500,5.04 terjual,"Bintangjayatoy,sJakarta Utara"
Jam jadwal waktu sholat (jws) digital led wifi android 1panel,Rp400.000,4.829 terjual,RD-LEDKab. Ponorogo
Jadwal Sholat Digital Imsyak Jam Masjid Digital Imsyak,Rp1.125.000,4.9100+ terjual,Jam Masjid Digital RTCBandung
running text jadwal sholat jws wifi RGB full warna berbagai ukuran,Rp10.000,,Mifa Autonik OfficialKab. Tangerang
Kontroller Jadwal Waktu Sholat Wifi esp8266 Support UNTUK 1000 MASJID,Rp155.000,5.01rb+ terjual,Apik MediaKab. Blora
Controller Jadwal Sholat Digital P10 WIFI Android,Rp200.000,5.02rb+ terjual,EteknoLABKab. Lampung Tengah
Modul Panel LED P5 Indoor SMD RGB Full Color bisa untuk Jadwal Sholat,Rp146.000,5.04rb+ terjual,FAN LED ReklameBandung
Kontroller Jadwal Sholat WIFI Simple dan Ekonomis,Rp195.000,5.0100+ terjual,Arin-TechKab. Lampung Tengah
JADWAL SHOLAT DIGITAL RUNNING TEXT JWS P10 RGB FULL COLOR 20X100 CM - JWS ONLY,Rp1.050.000,5 terjual,MCD LED SPAREPARTJakarta Timur
Jam Digital Jadwal Sholat Masjid - Tampa Nama,Rp1.092.500Rp1.150.000,30+ terjual,Bamboo nanda art galleryTangerang Selatan
"Kontroller Jws Khalifah Jadwal Waktu Sholat Masjid P10 RGB - 2 BARIS - 2X4 8PANEL, +MP3 +RELAY",Rp550.000,30+ terjual,CV. MEDIA DIGITAL TECHNOLOGYSukabumi
Jam Jadwal sholat Masjid warna warni/Full color. - Tampa Mp3+Adzan,Rp792.100Rp890.000,13 terjual,Bamboo nanda art galleryTangerang Selatan
mauQuta MQ-KFL Jam Jadwal Sholat Runningtext - Mekah - Emas,Rp3.600.000,6 terjual,Mauquta BarokahKab. Sidoarjo
controler jadwal sholat running text,Rp280.000,2 terjual,ledsystemKab. Bekasi
"JAM DIGITAL JADWAL SHOLAT/ JAM MASJID, LAPORAN PETUGAS JUM'AT, SALDO,",Rp1.691.500Rp1.990.000,5.018 terjual,Bamboo nanda art galleryTangerang Selatan
running text jam/ jadwal waktu sholat 200x 20cm,Rp1.700.000,5.01 terjual,led-kebumen89Kab. Kebumen
Kontroller Jam Sholat TV - Jadwal Sholat TV - JWS TV - JWS Raspberry,Rp1.800.000,5.060+ terjual,EteknoLABKab. Lampung Tengah
kit modul jadwal sholat digital otomatis wifi android hanya display jam 1.5 inch dan kalender 0.56 inch tanpa jadwal,Rp400.000,5.02 terjual,dacxtronikYogyakarta
Jam jadwal waktu sholat,Rp30.000,4.8250+ terjual,NafahaatKab. Bogor
Jam Adzan Digital Otomatis Mini Jadwal Sholat Jam Dinding Jam meja Al-Fatiha,Rp285.000Rp335.000,5.09 terjual,yahfi storeJakarta Barat
Jadwal Sholat Digital Android TV,Rp550.000,4.660+ terjual,Karya-Tronika TeknologiKab. Tabanan
Jadwal Waktu Sholat 1 Panel Frame,Rp45.000,5.07 terjual,Husna Jaya LedKab. Tangerang
jam masjid - jws digital p10 - jadwal sholat running text,Rp125.000,5.026 terjual,Toko As-Salam 21Kab. Bekasi
Software Aplikasi Pencatatan Keuangan Masjid & display jadwal sholat,Rp479.000,,DOMZYSTOREE66Tangerang
Jam Masjid Digital Jadwal Waktu Sholat Jws Tinggal Pasang P2.5,Rp385.000,5.04 terjual,CV. MEDIA DIGITAL TECHNOLOGYSukabumi
pcb jws jadwal sholat jam digital,Rp40.000,5.080+ terjual,MeteorNetKab. Jombang
jasma 5 versi standart - jam masjid tv - jam sholat tv - jadwal sholat tv - JWS TV - jam masjid waktu sholat pakai tv,Rp2.700.000,5.0100+ terjual,SAbdHA_projectKab. Magelang
Jam dan jadwal sholat running text,Rp600.000,5.05 terjual,Firdis StoreBandung
Kalender Dinding Kerja 2024 12 Halaman (SIKK 01) 32x48cm Jadwal Sholat,Rp8.250,4.990+ terjual,toko bintang kasihPasuruan
Jam Digital LED Display Dinding Otomatis Jadwal Sholat 5 Waktu Suara Adzan Mushola Masjid,Rp504.900Rp900.000,4.217 terjual,SuperSuryaJakarta Pusat
Jadwal waktu sholat auto tarkhim MP3 dengan LCD,Rp275.000,5.07 terjual,pino_shopKab. Bandung
JAM DIGITAL JADWAL SHOLAT MASJID TYPE P10 2P KH,Rp792.000Rp990.000,4.960+ terjual,Bamboo nanda art galleryTangerang Selatan
JAM Digital Jadwal Sholat Masjid running text P10 Ukuran 20 cm 100 cm,Rp1.050.000,5.04 terjual,ARF LED VARIASITangerang
Jam Digital LED Jadwal Sholat Mushola Masjid Adzan & Iqomah OTOMATIS,Rp510.000,4.830+ terjual,fan'sshopJakarta Utara
Wemos D1 Mini ESP8266 terisi firmware jadwal sholat Khalifah JWS ESP,Rp75.000,5.0500+ terjual,EteknoLABKab. Lampung Tengah
DZIKROUND Jam digital masjid jadwal sholat runningtexTFullcolour20X135,Rp2.900.000,5.013 terjual,DZIKROUNDKab. Sidoarjo
jadwal sholat v3 tv box offline,Rp1.050.000,5.04 terjual,Dunia DuinoBandung
TERMURAH..!!! PAPAN JADWAL SHOLAT MANUAL,Rp25.000,5.030+ terjual,toko ar'rasyidTangerang
REMOT JAM JADWAL SHOLAT,Rp100.000,5.03 terjual,Bamboo nanda art galleryTangerang Selatan
"kit modul jadwal sholat digital otomatis,hanya display jadwal saja ukuran 1 inch",Rp400.000,5.02 terjual,dacxtronikYogyakarta
Jam Digital LED Adzan Jam Jadwal Sholat 5 Waktu Otomatis Jam Al-Fajia,Rp488.000Rp500.000,5.06 terjual,yahfi storeJakarta Barat
jam digital masjid Jadwal sholat Running Text fullcolour P5 20cmx135cm,Rp2.900.000,4.73 terjual,dzikroundindonesiaSurabaya
"Jam Jadwal sholat, type jws p5 2p full color.suara tarhim,azan&murotal",Rp1.850.000,5.02 terjual,Bamboo nanda art galleryTangerang Selatan
JAM DIGITAL MASJID JAM JADWAL SHOLAT FULL COLOR RGB JWS P5 2X2P KH,Rp2.116.500Rp2.490.000,5.025 terjual,Bamboo nanda art galleryTangerang Selatan
Controller Jadwal Sholat 64x384 RGB,Rp600.000,6 terjual,KontritechKab. Bantul
TISERA - Jam Digital Jadwal Sholat Masjid - Jam Masjid 20x100 cm JWS,Rp735.000,4.53 terjual,Tisera TeknikKab. Tangerang
Hafla JWS Jadwal Sholat TV Digital,Rp2.000.000,5.026 terjual,KontritechKab. Bantul
Kalender kerja medium jadwal sholat MJ Tahun 2025 uk [ 42 × 48cm,Rp7.500,4.529 terjual,"Bintangjayatoy,sJakarta Utara"
"Jam Digital Jadwal Sholat Masjid, Running Text 45 cmx 150 cm - Hijau",Rp1.791.000Rp1.990.000,9 terjual,Bamboo nanda art galleryTangerang Selatan
Kit 7 Segment JWS dengan kontroler mini jadwal sholat digital - Merah,Rp1.100.000,100+ terjual,LuminixSalatiga
DZIKROUND FS3 Jam digital jadwal sholat running texT Fullcolour 20x100,Rp1.900.000,9 terjual,DZIKROUNDKab. Sidoarjo
JADWAL SHOLAT DIGITAL JWS RUNNING TEXT P10 SINGLE COLOR 16X128CM PX,Rp1.050.000,1 terjual,ANUGRAH LED KLATENKab. Klaten
Jam Adzan Digital LCD Jadwal Sholat Otomatis - 8 Pilihan Suara Adzan,Rp460.000,100+ terjual,DIGITAL GROSIRJakarta Pusat
Jam digital jadwal sholat + suara azan + tahrim + murotal 30 juz - Bingkai putih,Rp986.000Rp1.450.000,12 terjual,Bamboo nanda art galleryTangerang Selatan
mauQuta MQ-PK Pintu Kabah Jadwal Sholat Digital,Rp3.550.000,8 terjual,Mauquta BarokahKab. Sidoarjo
Jadwal Sholat Digital Jam Masjid Running Text P10 Warna Merah dan Hijau Ukuran 104 cm x 24 cm - Merah,Rp2.035.000,,Toko Jam Digital Masjid LEDBalikpapan
Dzikround FC27 Custom jadwal sholat Running Text ukuran 40cm x 230cm,Rp6.200.000,1 terjual,DZIKROUNDKab. Sidoarjo
JAM DIGITAL JADWAL SHOLAT MASJID. JWS B RUN - Pakai Nama,Rp3.051.000Rp3.390.000,10 terjual,Bamboo nanda art galleryTangerang Selatan
Controller jadwal sholat multiscan (JWSDS 12),Rp370.000,4.7100+ terjual,Ledstore OfficialJakarta Barat
JAM DIGITAL LED Jadwal Solat/Jam LED Mushola/Adzan&Iqomat+OTOMTIS,Rp585.000,4.970+ terjual,ZALFA SHOPSJakarta Barat
Remote Mauquta TQ-42-IQO Jam Jadwal Sholat,Rp185.000,4.860+ terjual,Mauquta BarokahKab. Sidoarjo
"kit /modul jadwal sholat digital jam digital 1,5 inch",Rp650.000,5.040+ terjual,dacxtronikYogyakarta
PCB Jadwal Sholat Jadwal Sholat Digital Wifi Esp8266 2 Baris,Rp15.500,5.0100+ terjual,Apik MediaKab. Blora
"Jam Masjid Jadwal Sholat Digital Ukuran 80 cm x 40 cm Tipe B Imsak Plus Running Text 30 cm Bisa Custom Nama Dan Gambar Desain - Tombol, Gold",Rp2.750.000,,Toko Jam Digital Masjid LEDBalikpapan
"Jam Digital Jadwal Sholat Runing Text RGB Full Color , JWS P5 2x3PKH - Tampa Murotal",Rp3.051.000Rp3.390.000,3 terjual,Bamboo nanda art galleryTangerang Selatan
"Jam Masjid Jadwal Sholat Digital Ukuran 115 cm x 65 cm Plus Running Text 30 cm Tipe D Bisa Custom Nama Dan Gambar Desain - Tombol, Gold",Rp3.465.000,,Toko Jam Digital Masjid LEDBalikpapan
jual jam jadwal sholat adzan digital update otomatis + running text,Rp2.460.000,1 terjual,prima electronicJakarta Barat
"mauQuta tauQoly TQ-08Q15 Jam Digital Jadwal Sholat - Mekkah Baru, Tanpa Packing",Rp3.025.000,,Mauquta BarokahKab. Sidoarjo
controler jam jadwal sholat analog p5 rgb,Rp400.000,5.03 terjual,LED display BEKASIBekasi
Jam Digital LED Display Dinding Otomatis Jadwal Sholat 5 Waktu Suara,Rp504.900Rp900.000,4.780+ terjual,Super Surya OfficialJakarta Pusat
Jam Dinding Digital Led Adzan 4622Y- Jam Masjid Jadwal Sholat,Rp460.000,4.8250+ terjual,DIGITAL GROSIRJakarta Pusat
[ Al-Ashr ] JWS LCD16x2 / Jadwal Sholat / Jam Masjid / Modul JWS,Rp342.000,,CamelllSurabaya
JAM MASJID JADWAL SHOLAT HIJAU,Rp720.000,4.927 terjual,RD-LEDKab. Ponorogo
jam jadwal sholat masjid Runinng tek Berjalan setting via android,Rp1.400.000,5.010 terjual,TOKO JAM MASJID TOELBandung
JADWAL SHOLAT ABADI,Rp28.000,5.03 terjual,toko ar'rasyidTangerang
PCB Jadwal Sholat Jadwal Sholat Digital Nodemcu Wemos D1 Mini 2 Baris,Rp89.000,5.0250+ terjual,Apik MediaKab. Blora
JWS Kit Jadwal Sholat 7segment Jam 1 inch paket dengan Remote Adaptor,Rp845.000,5.017 terjual,indo-wareSemarang
Jam Adzan Digital jadwal sholat Az 4009 + Iqomah (Ada remote),Rp585.000,3.75 terjual,KingbandrexJakarta Barat
"jam jadwal sholat digital running text / led besar 200x80cm, masjid",Rp5.900.000,,prima electronicJakarta Barat
"Jam Digital Jadwal Sholat Running Text RGB Full Color, JWS P5 2PKH - TAMPILAN JAM 1",Rp1.266.500Rp1.490.000,12 terjual,Bamboo nanda art galleryTangerang Selatan
"jam jadwal waktu sholat masjid, alarm, timer jeda iqomah otomat update",Rp1.400.000,4 terjual,prima electronicJakarta Barat
Controller Jam Waktu Sholat Jws Khalifah Jadwal Sholat Jam Masjid Running Text P5 RGB,Rp420.000,,sinar ledDepok
jadwal sholat otomatis tipe JOS 905 MR,Rp2.200.000,,prima electronicJakarta Barat
JAM DIGITAL JADWAL SHOLAT ELEKTRONIK / JAM DIGITAL  PERTANDA SHOLAT TQ-42-IQO,Rp550.000,,JavenJakarta Utara
JAM DIGITAL JADWAL SHOLAT TYPE JWS P5 RGB 3X6 HL.,Rp9.500.000,,Bamboo nanda art galleryTangerang Selatan
Jam Adzan Digital LCD Jadwal Sholat Otomatis - 8 Pilihan Suara Adzan,Rp460.000,5.040+ terjual,Digital EltroJakarta Pusat
Controller jadwal sholat JWSDS 11 hub75,Rp320.000,5.060+ terjual,Ledstore OfficialJakarta Barat
Jadwal Waktu Sholat JWS-Endi Kit Modul,Rp500.000,5.070+ terjual,shato-mediaKab. Bantul
RUNNING TEXT JADWAL SHOLAT OTOMATIS WIFI,Rp1.250.000,5.08 terjual,Surabaya running textSurabaya
Jam Adzan Digital jadwal sholat Az 4009 + Iqomah (Ada remote),Rp585.000,5.0100+ terjual,Digital EltroJakarta Pusat
Jadwal Sholat Papan Jadwal Shalat Manual Lengkap,Rp36.000,4.413 terjual,TOKO BUKU ISLAM JAKARTA UTARAJakarta Utara
Modul / Mesin Jadwal Sholat Dot Matrix P7,Rp600.000,4.77 terjual,Mataram KaryaYogyakarta
Jadwal Sholat Digital Running Text MQ-12-JAJ,Rp3.350.000,,mauquta.tauqolyJakarta Timur
Dzikround A1 jadwal sholat running text digital auto tartil,Rp1.350.000,1 terjual,DZIKROUNDKab. Sidoarjo
jam digital jadwal sholat + runningtex 78x38 kode 01,Rp2.350.000,,prima electronicJakarta Barat
Jam Adzan Digital Jadwal Sholat Otomatis & Suara Iqomah AZ 2012,Rp305.000,250+ terjual,DIGITAL GROSIRJakarta Pusat
jadwal sholat digital otomatis JOS 1606,Rp7.200.000,,prima electronicJakarta Barat
Jam Digital Adzan Jadwal Sholat Otomatis Suara Adzan & Iqomah AZ 2515,Rp400.000,90+ terjual,DIGITAL GROSIRJakarta Pusat
Jam Digital LED Jadwal Sholat Mushola Masjid Adzan & Iqomah OTOMATIS,Rp560.000,4.650+ terjual,halim92olshopJakarta Barat
Ada Source Code Aplikasi Web Display Informasi Masjid Jadwal Sholat,Rp180.000,1 terjual,kikirezarereSurabaya
Jadwal Sholat Digital Display TV,Rp350.000,4.57 terjual,Karya-Tronika TeknologiKab. Tabanan
DZIKROUND M3 GROSIR jam digital jadwal Sholat masjid Running Text,Rp1.850.000,4.913 terjual,dzikroundindonesiaSurabaya
Jam Adzan Digital LED Display Jadwal Sholat 5 Waktu Suara Otomatis,Rp501.228Rp900.000,4.824 terjual,WeWant Official StoreJakarta Pusat
