Produk,Harga,Sold,Nama Toko
Jam Adzan Digital LED Jadwal Sholat 5 Waktu Otomatis TNT 2021,Rp650.000,1 terjual,Frekuensi AmanJakarta Barat
Jam Dinding digital LED fitur Jadwal Sholat untuk masjid HIJAU,Rp432.500,,tarisaaa_storeeDenpasar
Poster Jadwal Harian Waktu Sholat wipe clean bisa ditulis dan dihapus,Rp13.900,5.04 terjual,Lentera Kecil OfficialBandung
Jadwal Sholat Digital Ukuran 95 cm x 55 cm. Bisa diganti Nama masjid,Rp1.500.000,4.940+ terjual,Jam Masjid Digital RTCBandung
Kontroller JWS Jadwal Sholat Wifi AUTO TARTIL MP3 Ukuran 2 Panel P10,Rp332.000,,Muh Tirta SyahraffaKab. Magetan
jasma 5 versi special edition - jam masjid tv - jam sholat tv - jadwal sholat tv - JWS TV - jam masjid waktu sholat pakai tv,Rp3.400.000,,SAbdHA_projectKab. Magelang
Jam Masjid-Jadwal Sholat Digital Masjid Mesjid-JS Shaffa 1.5- 120x60cm,Rp4.000.000,5.09 terjual,ARSATEC-Arsyad InstrumenKab. Sleman
Jam Adzan Digital LCD Jadwal Sholat Otomatis - 8 Pilihan Suara Adzan,Rp502.000,,Toko Baju SitiSurabaya
Controller JWS Murottal RGB LED MP3 Jam Masjid Jadwal Sholat Digital,Rp449.900,5.01 terjual,Elektron MartTangerang
Ready! Jam Masjid Digital Jadwal Sholat Running Text P10 Ukuran 30X142Cm,Rp2.410.000,,DAVIES CREATIVESSurabaya
"jam jadwal sholat digital running text / led besar 200x80cm, masjid",Rp5.900.000,,prima electronicJakarta Barat
"Jam Digital Jadwal Sholat Running Text RGB Full Color, JWS P5 2PKH - TAMPILAN JAM 1",Rp1.266.500Rp1.490.000,12 terjual,Bamboo nanda art galleryTangerang Selatan
"jam jadwal waktu sholat masjid, alarm, timer jeda iqomah otomat update",Rp1.400.000,4 terjual,prima electronicJakarta Barat
Controller Jam Waktu Sholat Jws Khalifah Jadwal Sholat Jam Masjid Running Text P5 RGB,Rp420.000,,sinar ledDepok
jadwal sholat otomatis tipe JOS 905 MR,Rp2.200.000,,prima electronicJakarta Barat
Jam AZ-2515 Adzan Clock Mini Jam Jadwal Sholat Digital Otomatis,Rp409.200,5.011 terjual,Ilham OLSHOPBekasi
LANGSUNG PRODUSEN jam masjid led | Jam Jadwal Sholat Otomatis,Rp964.000,,syamilunaSurakarta
Jadwal sholat running text 230x85cm Led Running Text abadi wifi plus tartil,Rp7.600.000,5.01 terjual,BonafidJakarta Timur
Jam Sholat Jam Masjid Jadwal Sholat Digital Imsyak CBI 80cm x 40cm,Rp1.400.000,5.05 terjual,Jam Masjid Digital RTCBandung
[ Al-Ashr ] Jwsstm P10Rgb / Jadwal Sholat / Jam Masjid / Modul Jws (Server) Kode 496,Rp290.000,,tech vision indJakarta Barat
Jadwal Sholat Running Text GPS Warna Merah Android,Rp999.500,5.030+ terjual,hksalatiga LEDSalatiga
Sale jadwal sholat digital running text jam masjid jam iqomah adzan musholla Low,Rp6.400.000,,Scar MartaJakarta Pusat
"Jam Digital Jadwal Sholat P10 Single/P10 RGB/P5 RGB, V4. Ukuran 30x78",Rp850.000,5.02 terjual,SamBerry PiKab. Sukoharjo
Jam Dinding digital LED fitur Jadwal Sholat untuk masjid HIJAU 04M4YZ4,Rp491.000,,TOKO YUSNIZARBekasi
mauQuta MQ-KBH Jam Jadwal Sholat Adzan Murottal,Rp825.000,5.080+ terjual,Mauquta BarokahKab. Sidoarjo
Dzikround A1 jadwal sholat running text digital auto tartil,Rp1.350.000,1 terjual,DZIKROUNDKab. Sidoarjo
jam digital jadwal sholat + runningtex 78x38 kode 01,Rp2.350.000,,prima electronicJakarta Barat
Jam Adzan Digital Jadwal Sholat Otomatis & Suara Iqomah AZ 2012,Rp305.000,250+ terjual,DIGITAL GROSIRJakarta Pusat
jadwal sholat digital otomatis JOS 1606,Rp7.200.000,,prima electronicJakarta Barat
Jam Digital Adzan Jadwal Sholat Otomatis Suara Adzan & Iqomah AZ 2515,Rp400.000,90+ terjual,DIGITAL GROSIRJakarta Pusat
memory card tartil jadwal sholat,Rp85.000,5.018 terjual,MeteorNetKab. Jombang
Jam Digital Adzan OTOMATIS Lengkap REMOT Jam adzan Jadwal Sholat 4636,Rp1.250.000,1 terjual,pushpitha shopJakarta Utara
Jam masjid Jam digital Jadwal sholat LED running text jadwal sholat masjid - Merah - Hijau - Biru - Putih,Rp800.000,,BAZAR TANI NUSANTARAKab. Bojonegoro
jam digital masjid rgb jadwal sholat digital otomatis p5 ukuran 100x20 cm,Rp1.775.000,5.016 terjual,Art elektronikKab.Ciamis
jam waktu sholat salat solat jadwal jadual digital elektronik otomatis,Rp1.150.000,5.04 terjual,Serba Ada Kudus-BandungKab. Bandung Barat
Jadwal Sholat Digital Jam Digital Sholat Jumbo,Rp7.800.000,,shato-mediaKab. Bantul
Mauquta Jam Jadwal Sholat Digital Hijau - MQ P10Q1 JSH,Rp1.570.000,5.01 terjual,Mauquta BarokahKab. Sidoarjo
modul controller jam jadwal sholat untuk 16x32,Rp255.000,4.116 terjual,EndiLedBekasi
"PROMO Running text jadwal sholat, jam digital masjid 100cm x 20cm",Rp1.750.000,1 terjual,syamilunaSurakarta
JNE Trucking. Jadwal Sholat Digital Imsyak. Jam Digital Sholat.,Rp1.125.000,5.03 terjual,Jam Masjid Digital RTCBandung
Jam masjid Jadwal sholat LED running text 130cm x 40cm merah mesjid,Rp1.760.000,5.04 terjual,BonafidJakarta Timur
TERMURAH Jam Jadwal Sholat Digital Masjid Timer Iqomah Besar,Rp2.699.000,5.01 terjual,Pabrik Jam MasjidSurakarta
"JAM DIGITAL JADWAL SHOLAT MASJID ADA LAPORAN SALDO, TYPE JWS P10 3P KH",Rp1.593.500,,pucontcellMedan
"Jam jadwal sholat TV. JWS TV. Jam masjid TV, Versi 2",Rp1.348.000,,Shop Riss 22Kab. Bandung
jadwal sholat digital masjid p10,Rp900.000,,Cahaya Led TgrKab. Tangerang
Jam masjid jadwal waktu sholat digital adzan iqomah running text teks,Rp2.100.000,5.01 terjual,muria rayaKab. Kudus
Jam Digital Adzan Jadwal Sholat Otomatis 4008,Rp550.000,5.06 terjual,digitalgrosirJakarta Pusat
jam sholat digital masjid 7 segmen Runningtext 8 jadwal syuruq dhuha,Rp2.600.000,5.05 terjual,TOKO JAM MASJID TOELBandung
Jadwal Sholat running text LED 400cm x 20cm,Rp2.900.000,4.01 terjual,BonafidJakarta Timur
Mesin Jadwal Sholat Digital Tipe AI,Rp700.000,5.08 terjual,Jam Masjid Digital RTCBandung
Kontroler Jam Jadwal Waktu Sholat JWS RGB 3 panel P5 - Non Tarti,Rp485.000,,Fauzia RifdaDepok
Buana - Az-2515 Adzan Clock Mini 25X1Cm Jam Jadwal Sholat Dital Otomatis,Rp364.500,,Buana Indah JamJakarta Barat
controler jam jadwal sholat p10 rgb jumbo 4x12 panel,Rp1.200.000,,LED display BEKASIBekasi
Jadwal Sholat Digital Jam Masjid Mushola Garansi,Rp1.799.000,5.01 terjual,Pabrik Jam MasjidSurakarta
Jam Digital jadwal Sholat 5 Waktu Otomatis LED Al Harameen HA 5152,Rp1.600.000,,Media Islamic OnlineBandung
Jadwal Waktu Sholat - Paket Module KIT-JWS-018,Rp1.225.000,4.960+ terjual,shato-mediaKab. Bantul
Jam Dinding digital LED fitur Jadwal Sholat untuk masjid PUTIH,Rp468.800,5.01 terjual,okisetiawan_ShopSurabaya
"Jadwal Sholat Digital 128x16cm ""BEEP"" Single Color",Rp2.100.000,1 terjual,Arrival Media ShopSurabaya
jam jadwal sholat abadi 128x16 cm,Rp1.200.000,5.07 terjual,Dunia DuinoBandung
jam jadwal solat digital mesjid,Rp1.550.000,4.812 terjual,cahaya jam familyBandung
Sae Jam Adzan Digital Led Otomatis Tnt2019. Jadwal Sholat,Rp860.000,,saebuyikMedan
Jadwal Sholat Digital Ukuran 115 cm x 65 cm. Al Hidayah,Rp1.800.000,5.01 terjual,Jam Masjid Digital RTCBandung
Jam Digital LED Jadwal Sholat 5 waktu Muusholla Masjid dan Cocok untuk hiasan Rumah,Rp900.000,,satang panjangKendari
READY STOCK!!! KALENDER AO722 - TAHUN 2025 (TANPA JADWAL SHOLAT),Rp651,,Percetakan Murah SBYSurabaya
Jadwal Sholat Digital,Rp1.750.000,,MAKMUR JAYA AJambi
"pusat jam masjid digital + waktu sholat alarm jeda iqomah, non runing",Rp1.600.000,3 terjual,prima electronicJakarta Barat
jam masjid waktu sholat digital running text jumbo timer iqomah,Rp9.800.000,1 terjual,toko jam masjid digitalJakarta Pusat
RUNNING TEXT JWS JADWAL SHALAT P10 MERAH HIJAU PUTIH 16 X 96 PIXEL - Hijau,Rp740.000,13 terjual,saudagardotidJakarta Timur
"jam masjid waktu sholat digital runing text, in android, timer iqomah",Rp3.600.000,,prima electronicJakarta Barat
Jadwal Sholat Digital Display TV,Rp350.000,7 terjual,Karya-Tronika TeknologiKab. Tabanan
jam digital jadwal shalat masjid ada laporan saldo,Rp3.950.000,,SALDO TEBE SEJAK 2015Jakarta Barat
Jadwal Shalat Digital Konek ke Layar TV - STD SWONLY,Rp569.050Rp599.000,11 terjual,gurucanggihCimahi
Jam Masjid Digital Running Tex 128x48cm + Timer Sholat + Alarm Iqomah,Rp5.800.000,,prima electronicJakarta Barat
JAM ADZAN+IQOMAH Otomatis Jam Sholat 5 Waktu SILVER Stainless 23x25 cm,Rp495.000Rp530.000,100+ terjual,Souvenia CenterJakarta Utara
jam jadwal sholat digital masjid + runningtext iqomah counter 110x50,Rp3.500.000,,prima electronicJakarta Barat
Benteng Digital Jadwal Sholat Digital Runing Text MQ-12-JAJ,Rp4.862.500,,Benteng DigitalSurabaya
Jam Masjid Jadwal Sholat Digital Imsyak 110cm x 55cm+Running text 30cm,Rp2.450.000,5.02 terjual,Jam Masjid Digital RTCBandung
JWS Kit Jadwal Sholat 7segment Jam 2.3inch paket dengan Remote Adaptor,Rp1.245.000,5.018 terjual,indo-wareSemarang
JADWAL SHOLAT,Rp25.000,5.01 terjual,toko ar'rasyidTangerang
Jadwal Sholat 1m x 20cm merah,Rp950.000,4.940+ terjual,BonafidJakarta Timur
Jam Dinding Jadwal Sholat Shalat Solat Islami Muslim Minimalis Kayu,Rp37.900Rp60.000,500+ terjual,Jam Karakter BandungKab. Bandung Barat
jam masjid digital waktu sholat sholat + timer adzan iqomah + alarm,Rp3.800.000,,prima electronicJakarta Barat
Jam Adzan Digital Jadwal Sholat Otomatis & Suara Iqomah AZ 2012,Rp305.000,8 terjual,digitalgrosirJakarta Pusat
Jam Masjid Waktu Sholat Digital 128x32cm + Timer Iqomah + Alarm,Rp4.800.000,,prima electronicJakarta Barat
Jam Digital Mesjid (Jadwal shalat digital),Rp1.300.000,,Cv. Hade TechKab. Garut
Jam Jadwal Sholat Digital Runningtext P10 Hijau Merah K3B1XHM,Rp1.550.000,5.04 terjual,Jam Digital P10Kab. Sidoarjo
Kontroller Jws Khalifah Jadwal Sholat Jam Masjid P10 SINGLE - 1 BARIS,Rp855.000,,Saben PropertyJakarta Selatan
Running Text (Jadwal Waktu Sholat) 20 x 132 cm,Rp2.950.000,,Bursa CCTV KediriKediri
PROMO Controller Jws Khalifah Jadwal Sholat Jam Masjid P5 RGB - 1 BARIS,Rp778.000,,lemarikacaalumuniumSurabaya
Dzikround FS4 Jam masjid digital jadwal sholat timer Fullcolour 20x130,Rp2.900.000,5.03 terjual,Dzikround StoreKab. Sleman
JAM DIGITAL JADWAL SHOLAT MASJID ADA RUNNING TEXT 100x20 cm,Rp1.250.000,,AYYALEDCCTVSukabumi
controller jam masjid jam jadwal sholat RGB,Rp320.000,5.04 terjual,DELTA ELECTROKab. Bandung
JADWAL SHOLAT RUNNINGTEXT INDOOR 100x20 [RED] K2217,Rp3.900.000,,Citra Utama MakassarMakassar
Kalender Dinding Lengkap tahun 2024 Lengkap Jadwal Sholat jakarta,Rp14.000,,on9-shopKab. Bandung Barat
JADWAL BACAAN SURAT SHOLAT FARDU,Rp6.400,5.040+ terjual,toko88onlineBogor
"pusat jam jadwal sholat adzan hari ini android, iqomah timer oleh haji",Rp2.000.000,2 terjual,prima electronicJakarta Barat
Jam Adzan Digital Jadwal Sholat Otomatis & Suara Iqomah AZ 2515,Rp400.000,60+ terjual,Digital EltroJakarta Pusat
"jadwal sholat digital masjid / mushola + alarm + timer iqomah, no text",Rp1.670.000,,prima electronicJakarta Barat
Jam Adzan Digital jadwal sholat Az 4009 + Iqomah (Ada remote),Rp585.000,100+ terjual,Digital EltroJakarta Pusat
Jam Digital Masjid Waktu Sholat Otomatis Timer  Jeda Adzan Iqomah,Rp1.495.000,,prima electronicJakarta Barat
Jadwal Sholat Digital Running Text Ukuran 104 cm x 24 cm. Jam Sholat,Rp1.200.000,5.02 terjual,Jam Masjid Digital RTCBandung
New Jam Digital Led Jadwal Solat/Jam Led Mushola/Adzan&Iqomat+Otomtis,Rp872.000,,pecah87Medan
Kontroller - Controller JWS Jadwal Waktu Sholat WIFI MP3 Versi Master,Rp300.000,4.412 terjual,Warna parabolaKab. Ponorogo
Controller Jws Khalifah Jadwal Sholat Jam Masjid P10 SINGLE - 2 BARIS,Rp660.000,,RramorJakarta Timur
JNE Trucking. Jadwal Sholat Digital. Jam Digital Sholat. 70 cm x 30 cm,Rp800.000,5.012 terjual,Jam Masjid Digital RTCBandung
Jadwal Sholat Digital Jam Masjid Digital Bisa Ganti Nama Masjid,Rp1.475.000,,AgenaStoreMedan
jadwal sholat digital 32x32 P5 indor,Rp1.500.000,,StarLed ElektronikSurabaya
Terbaru! Jam Sholat Digital Jam Sholat Masjid Jws P5 Rgb Jam Jadwal,Rp4.221.000,,CV AkalapSurabaya
DZIKROUND ORIGINAL PREMIUM C26 jam digital jadwal sholat Running text,Rp4.350.000,4.54 terjual,DZIKROUNDKab. Sidoarjo
JADWAL SHOLAT MP3 ANDROID-WIFI Controller M24W MONO COLOUR,Rp550.000,4.722 terjual,eltop electronicsSurabaya
Jam Adzan Digital Jadwal Sholat Otomatis & Suara Iqomah Az 2515,Rp400.000,50+ terjual,digitalgrosirJakarta Pusat
jam jadwal waktu sholat digital masjid + timer iqomah + runing text,Rp1.680.000,,prima electronicJakarta Barat
Jam Digital Masjid ( Jadwal Shalat),Rp1.100.000,,Cv. Hade TechKab. Garut
jadwal sholat iqomah counter,Rp1.650.000,,prima electronicJakarta Barat
Jam Adzan Digital Jadwal Sholat Otomatis & Suara Iqomah Az 2012,Rp305.000,30+ terjual,ARYADS321 SHOPJakarta Pusat
Jadwal Sholat Digital + Jeda Iqomah TauQoly TQ-05-QMH (48cmx21cm),Rp1.383.838,5.07 terjual,tauqolyabadiJakarta Timur
Jam Masjid Jadwal Sholat Digital Ukuran 115 cm x 35 cm Tipe CCD Minimalis Bisa Custom Nama Dan Gambar Desain,Rp1.759.998,,Toko Jam Digital Masjid LEDBalikpapan
JAM DIGITAL JADWAL SHOLAT MASJID 30 CMX110CM,Rp1.629.000,,triftrexxKab. Tasikmalaya
[READY] JAM MASJID RUNNING TEXT JADWAL SHOLAT RUNNING TEXT UKURAN 104 CM X 24 CM WARNA MERAH & HIJAU,Rp1.730.000,,Puncak Karya MarketBekasi
Jam Jadwal sholat full color warna type P5 2x3P full color,Rp3.141.000Rp3.490.000,5.04 terjual,Bamboo nanda art galleryTangerang Selatan
"jam masjid ( jam digital, jam iqomah, timer iqomah, jam jadwal sholat",Rp1.250.000,,syamilunaSurakarta
CETAK POSTER JADWAL SHOLAT DAN IMSAKIYAH RAMADHAN THUN INI,Rp18.000,5.03 terjual,Optima Media EduKab. Klaten
JAM JADWAL WAKTU SHOLAT P5 RGB 20X165CM,Rp1.700.000,5.09 terjual,RD-LEDKab. Ponorogo
Jadwal Sholat Running Text GPS Mix Warna Android,Rp1.099.000,5.013 terjual,hksalatiga LEDSalatiga
Jam masjid jam iqomah jadwal sholat digital mushola alarm sholat,Rp220.000,,ATJ LED IndonesiaKab. Bekasi
DS4 ALMIRA JADWAL SHOLAT Android WIFI (Support Qiangli SM16188),Rp375.000,,AFNANGHIBRAN1551Bandung
jadwal sholat digital jam digital sholat + alamat masjid runnigtext,Rp1.950.000,4.28 terjual,toko jam masjid digitalJakarta Pusat
DZIKROUND PREMIUM M5 jam digital jadwal sholat otomatis + Running text,Rp2.800.000,5.02 terjual,DZIKROUNDKab. Sidoarjo
led jadwal sholat digital jam masjid + running text ukuran 110cmx65cm,Rp3.800.000,5.02 terjual,ATJ LED IndonesiaKab. Bekasi
Jadwal Waktu Sholat Digital untuk masjid,Rp1.900.000,,Serba Ada Kudus-BandungKab. Bandung Barat
JAM DIGITAL JADWAL SHOLAT MASJID. JWS B RUN,Rp3.051.000Rp3.390.000,5.010 terjual,Bamboo nanda art galleryTangerang Selatan
Jam masjid Jadwal Sholat Digital Tipe C Imsak Klasik Ukuran 110 cm x 55 cm Bisa Custom Nama Masjid Dan Gambar Desain,Rp2.584.998,,Toko Jam Digital Masjid LEDBalikpapan
JADWAL SHOLAT DIGITAL RUNNING TEXT JWS P10 RGB FULL COLOR 20X100 CM,Rp1.050.000,5.05 terjual,MCD LED SPAREPARTJakarta Timur
Jadwal Sholat RGB 7 Warna 20x70Cm Wifi Seting via Android,Rp1.300.000,4.74 terjual,Sala3.NETSalatiga
MODUL KIT JADWAL SHOLAT SEVEN 7 SEGMENT 1.5 INCH DAN 1 INCH,Rp1.123.800,1 terjual,alik storeeJakarta Pusat
Stiker Jadwal Waktu Sholat JWS-01,Rp85.000,5.012 terjual,shato-mediaKab. Bantul
Jam masjid Jam digital Jadwal sholat LED running text jadwal sholat masjid - Merah - Hijau - Biru - Putih,Rp800.000,,TOKOSED14Kab. Bojonegoro
Jam Masjid Jadwal Sholat Digital Suara Adzan Bisa Ganti Nama Masjid,Rp1.250.000,5.010 terjual,Jam Masjid Digital RTCBandung
JAM JADWAL SHOLAT WiFi LAFADZ 20X164,Rp1.075.000,5.06 terjual,RD-LEDKab. Ponorogo
Al-Amin - Controller Jam Masjid Jadwal Sholat AS2075,Rp470.000,1 terjual,lolitamartiawukanBandung
Jam Masjid Jadwal Waktu Sholat Tipe B Minimalis Uk 70x40 Cm,Rp1.485.000,5.01 terjual,Toko Jam Digital Masjid LEDBalikpapan
TERMURAH Jam Dinding Jadwal Sholat Digital Masjid Timer Iqomah Mushola,Rp2.300.000,5.04 terjual,Pabrik Jam MasjidSurakarta
Jam Digital Jadwal Sholat Adzan Otomatis 4008,Rp550.000,5.019 terjual,ARYADS321 SHOPJakarta Pusat
Jadwal Sholat Running Text GPS 20x140cm Merah Android,Rp1.700.000,5.04 terjual,hksalatiga LEDSalatiga
Jadwal Sholat Digital jam masjid running text,Rp2.950.000,5.03 terjual,ATJ LED IndonesiaKab. Bekasi
RUNNING TEXT JADWAL WAKTU SHOLAT Uk. 20x100cm,Rp850.000,4 terjual,vanled pusat running text jws dan videotronKab. Tegal
Jadwal Sholat Running Text GPS 20x140cm Mix Warna Android,Rp1.950.000,5.05 terjual,hksalatiga LEDSalatiga
IC Atmega328 isi firmware jadwal sholat - Score Board - Antrian - Bell,Rp100.000,5.01rb+ terjual,EteknoLABKab. Lampung Tengah
Jadwal Sholat Digital TauQoly TQ-05-PP,Rp1.250.000,4.310 terjual,tauqolyabadiJakarta Timur
Jadwal Waktu Sholat JWS-01,Rp1.350.000Rp1.400.000,4.915 terjual,shato-mediaKab. Bantul
Jam Masjid Digital Waktu Sholat 128x32cm + Timer Iqomah + Alarm,Rp3.200.000,,prima electronicJakarta Barat
Jam Adzan Digital Jadwal Sholat Otomatis & Suara Iqomah Az 2325,Rp470.000,10 terjual,Digital EltroJakarta Pusat
jadwal sholat digital + jam adzan masjid + timer iqomah + runing text,Rp4.770.000,1 terjual,prima electronicJakarta Barat
Jam Adzan Digital Jadwal Sholat Otomatis & Suara Iqomah AZ 2012,Rp305.000,21 terjual,Digital EltroJakarta Pusat
jam jadwal sholat otomatis + alarm + timer iqomah / jam masjid,Rp1.099.000,,prima electronicJakarta Barat
