Produk,Harga,Sold,Nama Toko
jam masjid digital jadwal waktu sholat wilayah jakarta sekitar,Rp1.400.000,4.860+ terjual,toko jam masjid digitalJakarta Pusat
MINI PC Jam Masjid Jadwal Sholat DIGITAL SIGNAGE (TV LCD /LED EXCLUDE),Rp1.765.000,5.08 terjual,Raissa GadgetBekasi
Kontroller JWS jadwal sholat 3-6 panel panel p10 bisa manual iqomah,Rp250.000,5.060+ terjual,MeteorNetKab. Jombang
Source Code Jadwal Sholat Digital STB Android,Rp7.500.000,,Karya-Tronika TeknologiKab. Tabanan
Jadwal Sholat Digital Runing Text MQ-12-JAJ,Rp3.350.000,5.01 terjual,Listrik Sinar MentariJakarta Selatan
Taqwa Media Player- Jadwal Waktu Solat Digital,Rp845.000,4.829 terjual,shato-mediaKab. Bantul
jam sholat digital masjid 7 segmen led jadwal sholat bergantian,Rp600.000,5.04 terjual,TOKO JAM MASJID TOELBandung
[ Al-Ashr ] JWSSTM / Jadwal Sholat / Jam Masjid / Modul JWS (server),Rp246.000,,mitra-electroSurabaya
Kontroler JWS Jadwal Sholat WIFI P10 RGB Full Color,Rp332.500,5.05 terjual,FAN LED ReklameBandung
Kontroller jadwal sholat WIFI simple dan ekonomis - Tartil,Rp400.000,5.080+ terjual,EteknoLABKab. Lampung Tengah
Jadwal Sholat Digital Tipe Minimalis B Running Text,Rp1.750.000,5.02 terjual,Jam Masjid Digital RTCBandung
Jam Dinding Jadwal Sholat Shalat Solat Islami Minimalis Kayu Custom,Rp37.900Rp80.000,4.9100+ terjual,Jam Karakter BandungKab. Bandung Barat
Mauquta Tauqoly Jadwal Sholat Digital TQ-42-IQO MERAH,Rp1.800.000,1 terjual,Mauquta BarokahKab. Sidoarjo
jadwal waktu sholat masjid,Rp27.500,5.012 terjual,Toko Iqbal BJakarta Barat
Modul Kit Jadwal waktu Sholat Digital Seven 7 segment jumbo,Rp1.350.000,5.01 terjual,RivalledJakarta Utara
kit modul jadwal sholat jam 2.3 inch kalender jadwal 1.2 inch,Rp1.250.000,5.010 terjual,dacxtronikYogyakarta
JAM DIGITAL JADWAL SHOLAT MASJID FULL TYPE P5 3PKH,Rp2.400.000,5.05 terjual,Dunia_bingkai_fiber_tangerangKab. Tangerang
JAM Digital Jadwal Sholat Masjid running text P10 Ukuran 20 cm X135 CM,Rp1.000.000,1 terjual,ARF LED VARIASITangerang
Jam Digital Jadwal sholat Running Text uk. 20cm x 100 cm / jam masjid,Rp1.250.000Rp1.400.000,,Micro_TenKab. Klaten
Jam masjid Jadwal sholat LED running text 130cm x 20cm bisa tartil,Rp1.050.000,5.04 terjual,BonafidJakarta Timur
jadwal waktu sholat salat shalat solat digital,Rp988.888,5.030+ terjual,Dela martCimahi
Jadwal Sholat Digital Frame Hitam Ukuran 70cmx40cm Custom Nama&Gambar,Rp1.100.000,5.01 terjual,Jam Masjid Digital RTCBandung
JAM DIGITAL JADWAL SHOLAT. JAM SHOLAT MASJID. JWS P5 4P KH RGB/ 7WARNA,Rp3.030.500Rp3.190.000,4.98 terjual,Bamboo nanda art galleryTangerang Selatan
Jadwal Sholat Digital BJS 1505 Remote Control,Rp1.499.000,5.06 terjual,boj digital mediaKab. Tegal
Jam Digital LED Jam Azan Jadwal Sholat Otomatis Bentuk Kubah TNT 2021,Rp620.000Rp650.000,5.01 terjual,yahfi storeJakarta Barat
Jadwal sholat Digital Otomatis 70x30 cm,Rp1.200.000,5.01 terjual,Dacxtronic StoreYogyakarta
Papan jadwal Khatib masjid musholla LED sholat islam,Rp1.500.000,5.02 terjual,ATJ LED IndonesiaKab. Bekasi
jam digital jadwal sholat 20x68cm auto tartil,Rp1.449.000,,VODATECH PRINT & LEDKab. Sidoarjo
Jam Adzan Digital LCD Jadwal Sholat Otomatis Al-Fatiha Faj-106,Rp250.000,5.08 terjual,ElectroRoomJakarta Pusat
"Modul MP3 Plus Relay Auto Player Untuk Jadwal Sholat, Bel Sekolah DF",Rp180.000,1 terjual,Serba Ada Kudus-BandungKab. Bandung Barat
"pusat jam masjid digital + waktu sholat alarm jeda iqomah, non runing",Rp1.600.000,3 terjual,prima electronicJakarta Barat
jam masjid waktu sholat digital running text jumbo timer iqomah,Rp9.800.000,1 terjual,toko jam masjid digitalJakarta Pusat
RUNNING TEXT JWS JADWAL SHALAT P10 MERAH HIJAU PUTIH 16 X 96 PIXEL - Hijau,Rp740.000,13 terjual,saudagardotidJakarta Timur
"jam masjid waktu sholat digital runing text, in android, timer iqomah",Rp3.600.000,,prima electronicJakarta Barat
Jadwal Shalat Digital Konek ke Layar TV - STD SWONLY,Rp569.050Rp599.000,11 terjual,gurucanggihCimahi
jam digital jadwal shalat masjid ada laporan saldo,Rp3.950.000,,SALDO TEBE SEJAK 2015Jakarta Barat
Jam Masjid Digital Running Tex 128x48cm + Timer Sholat + Alarm Iqomah,Rp5.800.000,,prima electronicJakarta Barat
JAM ADZAN+IQOMAH Otomatis Jam Sholat 5 Waktu SILVER Stainless 23x25 cm,Rp495.000Rp530.000,100+ terjual,Souvenia CenterJakarta Utara
jam jadwal sholat digital masjid + runningtext iqomah counter 110x50,Rp3.500.000,,prima electronicJakarta Barat
Jam Dinding Jadwal Sholat Shalat Solat Islami Muslim Minimalis Kayu,Rp37.900Rp60.000,500+ terjual,Jam Karakter BandungKab. Bandung Barat
Jam Digital Jadwal Sholat Masjid,Rp1.092.500Rp1.150.000,4.930+ terjual,Bamboo nanda art galleryTangerang Selatan
jadwal Sholat Digital Imsyak Ukuran 110 cm x 55 cm.,Rp1.700.000,5.018 terjual,Jam Masjid Digital RTCBandung
Running Text Indoor Outdoor Masjid Jadwal Sholat Masjid JWS,Rp150.000,,ARS_ELECTRONICSMadiun
Kit modul jadwal sholat digital otomatis jam 1.5 inch dan running teks,Rp1.100.000,5.017 terjual,dacxtronikYogyakarta
Dijual PAPAN JADWAL SHOLAT JUMAT Berkualitas,Rp253.000,5.01 terjual,nanda storreJakarta Selatan
jam masjid digital waktu sholat sholat + timer adzan iqomah + alarm,Rp3.800.000,,prima electronicJakarta Barat
Jam Adzan Digital Jadwal Sholat Otomatis & Suara Iqomah AZ 2012,Rp305.000,8 terjual,digitalgrosirJakarta Pusat
Jam Masjid Waktu Sholat Digital 128x32cm + Timer Iqomah + Alarm,Rp4.800.000,,prima electronicJakarta Barat
Jam Digital Mesjid (Jadwal shalat digital),Rp1.300.000,,Cv. Hade TechKab. Garut
"pusat jam jadwal sholat adzan hari ini android, iqomah timer oleh haji",Rp2.000.000,2 terjual,prima electronicJakarta Barat
mauQuta MQ-05-KC Jam Jadwal Sholat Digital,Rp3.050.000,5.03 terjual,Mauquta BarokahKab. Sidoarjo
Jadwal Sholat Digital Jam Digital Sholat Gambar Mekkah,Rp800.000,4.960+ terjual,Jam Masjid Digital RTCBandung
Jam Masjid Jadwal Sholat LED Running Text Outdoor 20x100cm Digital JWS,Rp999.500,,SEKARAN SHOP INDONESIASemarang
kit modul jadwal sholat digital otomatis wifi android display jam 1.5 inch kalender jadwal 0.56 inch plus power supply,Rp650.000,5.06 terjual,dacxtronikYogyakarta
Jam masjid jadwal waktu sholat digital adzan iqomah running text,Rp3.250.000,5.01 terjual,muria rayaKab. Kudus
Taqwa TV Kontroller Jadwal Sholat TV,Rp600.000,4.815 terjual,shato-mediaKab. Bantul
controler jam jadwal sholat p5 rgb 2x5 special border,Rp600.000,,LED display BEKASIBekasi
Jadwal Sholat Digital TV Support Video Background,Rp500.000,4.512 terjual,Karya-Tronika TeknologiKab. Tabanan
Packing Kayu. Khusus pemesan jadwal Sholat. Tidak bisa dipesan terpisa,Rp20.000,5.090+ terjual,Jam Masjid Digital RTCBandung
Mauquta Tauqoly TQ-05-PP Jam Digital Jadwal Sholat Adzan Atau Tartil,Rp1.270.000,4.57 terjual,Mauquta BarokahKab. Sidoarjo
Jam Adzan Digital Jadwal Sholat Otomatis & Suara Iqomah AZ 2515,Rp400.000,60+ terjual,Digital EltroJakarta Pusat
"jadwal sholat digital masjid / mushola + alarm + timer iqomah, no text",Rp1.670.000,,prima electronicJakarta Barat
Jam Adzan Digital Jadwal Sholat Otomatis & Suara Iqomah Az 2515,Rp400.000,50+ terjual,digitalgrosirJakarta Pusat
Jam Digital Masjid Waktu Sholat Otomatis Timer  Jeda Adzan Iqomah,Rp1.495.000,,prima electronicJakarta Barat
Jam Adzan Digital jadwal sholat Az 4009 + Iqomah (Ada remote),Rp585.000,100+ terjual,Digital EltroJakarta Pusat
JAM DIGITAL MASJID - JADWAL WAKTU SHOLAT MENGGUNAKAN TV LED,Rp2.699.000,5.01 terjual,app webKab. Bandung
mauQuta MQ-JA Software Jadwal Sholat Digital,Rp950.000,,Mauquta BarokahKab. Sidoarjo
"Jam Digital Jadwal Sholat Masjid, Running Text 45 cmx 150 cm",Rp1.791.000Rp1.990.000,5.09 terjual,Bamboo nanda art galleryTangerang Selatan
JAM DIGITAL MASJID JAM JADWAL SHOLAT FULL COLOR RGB JWS UKURN 20 x 100,Rp1.600.000,,prima jaya komputer cctv & advertisingTasikmalaya
JAM ADZAN DIGITAL JADWAL SHOLAT OTOMATIS TYPE AZ4560,Rp1.500.000,5.011 terjual,DIGITAL GROSIRJakarta Pusat
jadwal sholat,Rp30.000,4.75 terjual,Reyhan bookJakarta Pusat
Kontroler Jam Jadwal Waktu Sholat JWS RGB 2x7 panel P5,Rp625.000,5.07 terjual,boj digital mediaKab. Tegal
Kalender Dinding Lengkap Jadwal Sholat Tahun 2023,Rp8.000,4.5100+ terjual,palagada idJakarta Barat
Memory microSD Khalifah JWS TV - software jadwal sholat TV,Rp240.000,5.0100+ terjual,Arin-TechKab. Lampung Tengah
"Jam Sholat Digital, Jadwal Waktu Sholat, Jam Masjid 1 Panel SLIM",Rp320.000,,BimaStore LedArtKab. Kudus
jam jadwal waktu sholat digital masjid + timer iqomah + runing text,Rp1.680.000,,prima electronicJakarta Barat
Jam Digital Masjid ( Jadwal Shalat),Rp1.100.000,,Cv. Hade TechKab. Garut
jadwal sholat iqomah counter,Rp1.650.000,,prima electronicJakarta Barat
Jam Adzan Digital Jadwal Sholat Otomatis & Suara Iqomah Az 2012,Rp305.000,30+ terjual,ARYADS321 SHOPJakarta Pusat
Jam Masjid Digital Waktu Sholat 128x32cm + Timer Iqomah + Alarm,Rp3.200.000,,prima electronicJakarta Barat
Jadwal Sholat Running Text GPS Warna Merah Android,Rp999.999,5.080+ terjual,Sala3.NETSalatiga
JAM DIGITAL JADWAL SHOLAT MASJID. JWS K,Rp1.390.000,5.070+ terjual,Bamboo nanda art galleryTangerang Selatan
Kalender 2023 Dinding Lengkap Jadwal Sholat Catatan Memo,Rp15.000,5.01 terjual,EgayStoreDepok
jam digital jadwal sholat P10 UKURAN JUMBO FULL COLOUR 7 WARNA,Rp2.800.000,5.012 terjual,TOKO JAM MASJID TOELBandung
"modul/kit jam digital otomatis jadwal sholat digital 1,8 inch",Rp850.000,5.022 terjual,dacxtronikYogyakarta
DZIKROUND M3 Jam Digital Jadwal Sholat Masjid Ukuran 20x100 Remot,Rp1.315.000,4.717 terjual,dzikroundindonesiaSurabaya
Kit jadwal sholat seven segmen ekonomis 1 in,Rp820.000,5.010 terjual,EndiLedBekasi
terbatas kalender dinding lengkap tahun 2024 jadwal sholat bahan hvs,Rp15.000,5.03 terjual,brunnmasrt storesKab. Bandung
"MODUL JADWAL SHOLAT MULTI SIZE 16X32,16X64,16X96",Rp299.999,4.329 terjual,MITRA HA-TECHMalang
"Software Display Informasi Running Teks dan Video, Jadwal Sholat",Rp95.000,5.03 terjual,Jual bibit murahKab. Purworejo
Paket DIY Jadwal sholat digital P4.75,Rp550.000,5.014 terjual,MeteorNetKab. Jombang
PANEL P10RGB audor Secen 1/8 Cocok untuk Raningtexk Dan jadwal sholat,Rp93.990,5.08 terjual,Zifana LEDSurabaya
Jam Jadwal Sholat RGB + mp3 tartil,Rp775.000,4.917 terjual,pino_shopKab. Bandung
running text jadwal sholat 3 panel harga murah,Rp800.000,,RAZQA SPORTKab. Kediri
Running Text LED Premium Bisa Untuk Outdoor dan Jadwal Sholat,Rp345.000,,Toko RaffazaBekasi
Jam Dinding Digital Adzan Jadwal Sholat Masjid Waktu Azan Bingkai 4636,Rp600.000,4.790+ terjual,Grosir ElektronikJakarta Barat
Controller Jadwal Sholat 32x256 [1x4 P4.75] [2x8 P10],Rp800.000,5.02 terjual,KontritechKab. Bantul
[TERMURAH] PAPAN JADWAL SHOLAT JUMAT,Rp193.000,,febr_iyantiBandung
Kit 7 Segment JWS dengan kontroler mini jadwal sholat digital,Rp1.100.000,5.0100+ terjual,LuminixSalatiga
kit modul jadwal sholat digital otomatis 1.5 inch plus control running,Rp700.000,5.05 terjual,dacxtronikYogyakarta
Kontroler Jam Jadwal Waktu Sholat JWS RGB 2x3 P5 T1,Rp330.000,5.09 terjual,boj digital mediaKab. Tegal
kalender 2024 dinding ulama habaib hijriyah jadwal sholat habib jawa,Rp35.000,5.03 terjual,ASSALAAM OLSHOP BKHAIRMalang
Jadwal Waktu Sholat - Paket Module KIT-JS01,Rp799.900,4.880+ terjual,shato-mediaKab. Bantul
Jam Jadwal waktu Sholat Masjid TV LED Otomatis Tanpa Internet Android,Rp3.749.000,5.07 terjual,Jasma Digital JakartaDepok
running text jadwal sholat jws wifi indoor outdoor full color anti air,Rp3.550.000,,Mifa Autonik OfficialKab. Tangerang
DZIKROUND M2 Jam Digital Jadwal Sholat masjid Ukuran 20x70 androiid,Rp990.000,5.02 terjual,dzikroundindonesiaSurabaya
Tipe GB. Jadwal Sholat Digital. Uk: 70 cm x 40 cm.Jam Digital Sholat,Rp900.000,4.88 terjual,Jam Masjid Digital RTCBandung
Modul controller jadwal sholat iqomah otomatis support p4.75 dan p7,Rp450.000,1 terjual,EndiLedBekasi
Jam Adzan Digital Led Jadwal Sholat Otomatis Kubah TNT 2021,Rp650.000,5.060+ terjual,DIGITAL GROSIRJakarta Pusat
Kontroler Jam Jadwal Waktu Sholat JWS RGB 4x2 panel P5 T2,Rp330.000,5.07 terjual,boj digital mediaKab. Tegal
"Jam Digital Jadwal Sholat P10 Single/P10 RGB/P5 RGB, V4. Ukuran 30x46",Rp475.000,5.01 terjual,SamBerry PiKab. Sukoharjo
"Running Text, Led Konter, Led Promo Hotel, Led Masjid, Jadwal Sholat",Rp2.485.000,,Rucxo ElektroJakarta Barat
Kalender Dinding 2025 Dwi Bulan Umum Jadwal Sholat,Rp20.000,5.02 terjual,masbagusBekasi
auto player murottal / adzan / mesin ngaji otomatis jadwal sholat,Rp1.250.000,,MikroHolikKab. Bantul
Unik Papan Jadwal Sholat Jumat Akrilik 60 x 80 cm Diskon,Rp835.000,,sujolikoJakarta Barat
Jam Adzan Digital Jadwal Sholat Otomatis & Suara Iqomah Az 2325,Rp470.000,10 terjual,Digital EltroJakarta Pusat
jadwal sholat digital + jam adzan masjid + timer iqomah + runing text,Rp4.770.000,1 terjual,prima electronicJakarta Barat
Jam Adzan Digital Jadwal Sholat Otomatis & Suara Iqomah AZ 2012,Rp305.000,21 terjual,Digital EltroJakarta Pusat
jam jadwal sholat otomatis + alarm + timer iqomah / jam masjid,Rp1.099.000,,prima electronicJakarta Barat
Jam Digital Adzan Jadwal Sholat Otomatis Dan Iqomah AZ 2515,Rp400.000,1 terjual,ARYADS321 SHOPJakarta Pusat
"Jam jadwal sholat TV. JWS TV. Jam masjid TV, Versi 2 - Paket 1",Rp1.800.000Rp2.000.000,100+ terjual,Bamboo nanda art galleryTangerang Selatan
JAM DIGITAL JADWAL SHOLAT TYPE JWS P5 RGB 3X6 HL.,Rp9.500.000,,Bamboo nanda art galleryTangerang Selatan
Kontroller Jws Khalifah Jadwal Sholat Jam Masjid P10 SINGLE - 1 BARIS,Rp185.000,250+ terjual,CV. MEDIA DIGITAL TECHNOLOGYSukabumi
Jam Masjid Jadwal Waktu Sholat Jws Tinggal Pasang P10 RGB - 1 BARIS,Rp810.000,24 terjual,CV. MEDIA DIGITAL TECHNOLOGYSukabumi
JAM DIGITAL JADWAL SHOLAT MASJID. JWS K,Rp1.390.000,70+ terjual,Bamboo nanda art galleryTangerang Selatan
Jadwal Sholat Digital Jam Masjid Ukuran 115cm x 35cm Tipe CCD Imsyak,Rp1.500.000,4.98 terjual,Jam Masjid Digital RTCBandung
jadwal sholat abadi 96x16,Rp1.000.000,5.04 terjual,Dunia DuinoBandung
Kalender Dinding tahun 2024 Lengkap Jadwal Sholat Bahan HVS WEO BC78,Rp9.900Rp15.000,5.030+ terjual,We_Store88Kab. Tangerang
JAM JADWAL WAKTU SHOLAT 20x100 Wifi Android,Rp700.000,5.070+ terjual,RD-LEDKab. Ponorogo
jam jadwal waktu sholat,Rp800.000,,DELTA ELECTROKab. Bandung
JAM DIGITAL JADWAL SHOLAT MASJID TYPE P10 2P KH,Rp792.000Rp990.000,60+ terjual,Bamboo nanda art galleryTangerang Selatan
Controller Jws Khalifah Jadwal Sholat Jam Masjid P10 SINGLE - 2 BARIS,Rp319.000,80+ terjual,CV. MEDIA DIGITAL TECHNOLOGYSukabumi
JWS TV Android - Display Jadwal Sholat Digital,Rp259.000,22 terjual,Karya-Tronika TeknologiKab. Tabanan
"Jadwal Sholat Digital Running Text Indoor Uk. 20X100 - Merah, Non Tartil",Rp700.000,30+ terjual,VanledKab. Tegal
MauQuta TV Plus Jadwal Sholat Digital TV - MQ TV Plus Pro,Rp3.450.000,1 terjual,Mauquta BarokahKab. Sidoarjo
JAM DIGITAL MASJID JADWAL SHOLAT LANGSUNG DARI PRODUSEN,Rp2.350.000,,syamilunaSurakarta
Jam Digital Masjid Jadwal Sholat Iqomah dan Running Text 20x70cm,Rp1.700.000,4.213 terjual,dzikroundindonesiaSurabaya
Jam Adzan Digital Jam Dinding Jadwal Sholat Otomatis & Suara Iqomah,Rp405.000,5.07 terjual,Frekuensi AmanJakarta Barat
Controller modul jam jadwal sholat 2 modul p10,Rp300.000,4.914 terjual,EndiLedBekasi
Paket Rakit Mandiri 3 Panel P5 RGB Jam Masjid / Jadwal Sholat Digital,Rp390.000,2 terjual,Pelangi RGBSurabaya
Tambahan Remote untuk jadwal sholat digital produk Kitdigitalku,Rp50.000,5.05 terjual,KitDigitalKuKab. Magelang
Jam Masjid Jadwal Waktu Sholat Jws Tinggal Pasang P10 Single - 2 BARIS,Rp2.046.000,5.03 terjual,CV. MEDIA DIGITAL TECHNOLOGYSukabumi
ESP32 terisi firmware jadwal sholat Khalifah JWS ESP,Rp250.000,5.0100+ terjual,EteknoLABKab. Lampung Tengah
jadwal jam sholat digital running text,Rp2.900.000,4.819 terjual,RTS mandiriBandung
jam masjid digital jadwal sholat running text ukuran 40cmx130cm GROSIR,Rp4.000.000,5.02 terjual,dzikroundindonesiaSurabaya
Jadwal Sholat Digital Android TV,Rp550.000,60+ terjual,Karya-Tronika TeknologiKab. Tabanan
mauQuta MQ-KBH Jam Jadwal Sholat Adzan Murottal - MQ 03 KBH,Rp825.000,80+ terjual,Mauquta BarokahKab. Sidoarjo
Jam Digital Jadwal Waktu Sholat Jws Lapadz Tinggal Pasang P5 - 2 BARIS,Rp2.348.500,13 terjual,CV. MEDIA DIGITAL TECHNOLOGYSukabumi
"JAM DIGITAL JADWAL SHOLAT MASJID ADA LAPORAN SALDO, TYPE JWS P10 3P KH",Rp967.500Rp1.290.000,100+ terjual,Bamboo nanda art galleryTangerang Selatan
Jadwal Sholat Digital Jam masjid Tipe B Imsak Klasik Ukuran 80 cm x 40 cm Bisa Custom Nama Dan Gambar - Tanpa Wifi,Rp1.979.998,,Toko Jam Digital Masjid LEDBalikpapan
Memory microSD Khalifah JWS TV - software jadwal sholat TV,Rp250.000,5.0100+ terjual,EteknoLABKab. Lampung Tengah
RUNNING TEXT JWS JADWAL SHOLAT JAM WAKTU SHOLAT JAM SHOLAT P5 RGB FULL COLOR 20X100CM 32x192pixel,Rp1.265.000,5.05 terjual,ANUGRAH LED KLATENKab. Klaten
"Jam Sholat , jadwal waktu sholat , jam masjid , jam digital murah",Rp600.000,5.02 terjual,SONI-LED-PUSATKab. Bantul
WLCMe! Kalender 2024 jumbo lengkap dengan jadwal Sholat bahan HVS 32 x 48 cm,Rp10.000,,Arif KhKab. Bandung
jam jadwal sholat digital android running text,Rp750.000,5.029 terjual,Nope shopJakarta Utara
Jam jadwal sholat digital + buzzer FIGURA,Rp599.999,4.825 terjual,Dela martCimahi
DZIKROUND PREMIUM M4 Jam Digital Jadwal sholat Otomatis + Running Text,Rp1.500.000,5.03 terjual,DZIKROUNDKab. Sidoarjo
Jadwal Sholat running Text. Ukuran 24 cm x 200 cm,Rp2.000.000,5.01 terjual,Jam Masjid Digital RTCBandung
jadwal Sholat Digital. Ada suara adzan. Bisa diganti Nama masjid.,Rp1.200.000,5.07 terjual,Jam Masjid Digital RTCBandung
Wemos D1 Mini ESP8266 terisi firmware jadwal sholat Khalifah JWS ESP,Rp75.000,5.040+ terjual,Arin-TechKab. Lampung Tengah
"Kontroller Jws Khalifah Jadwal Sholat Jam Masjid P10 RGB - 1 BARIS - 1X1 1PANEL, Kontroller Only",Rp198.500,90+ terjual,CV. MEDIA DIGITAL TECHNOLOGYSukabumi
Jam Masjid Jadwal Sholat Digital Ukuran 80 cm x 30 cm Tipe A Imsak Klasik Bisa Custom Nama Masjid Dan Gambar - Tanpa Wifi,Rp1.649.998,,Toko Jam Digital Masjid LEDBalikpapan
RUNNING TEXT JWS JADWAL SHOLAT JAM WAKTU SHOLAT JAM SHOLAT P5 RGB FULL COLOR 20X100CM 32x192pixel,Rp1.265.000,5 terjual,ANUGRAH LED KLATENKab. Klaten
"Jam Masjid Jadwal Sholat Digital Ukuran 70 cm x 40 cm Tipe B Minimalis Bisa Custom Nama Masjid Dan Gambar - Tombol, Gold",Rp1.209.998,,Toko Jam Digital Masjid LEDBalikpapan
JAM DIGITAL MASJID JAM JADWAL SHOLAT FULL COLOR JWS P5 5P KH RGB - Non Mp3+Adzan,Rp2.691.000Rp2.990.000,25 terjual,Bamboo nanda art galleryTangerang Selatan
TERMURAH.......!!! PAPAN JADWAL SHOLAT MANUAL 1,Rp25.000,,toko ar'rasyidTangerang
Modul Kit Jadwal Sholat Digital Otomatis JWS-02 jadwal 1 inch,Rp905.000,5.018 terjual,KitDigitalKuKab. Magelang
Jadwal Jam Sholat Digital 220 x 45cm P5 Full Colour,Rp8.500.000,5.02 terjual,DWALedTangerang
Jam Jadwal Sholat Alarm Adzan 5 Waktu murotal sebelum sholat otomatis,Rp1.233.600,5.011 terjual,VISIONE SPAREPARTKab. Banyumas
Jadwal Sholat Digital Jam Masjid Digital CB 70 cm x 40 cm,Rp1.050.000,5.016 terjual,Jam Masjid Digital RTCBandung
"Jam Digital Jadwal Sholat Masjid , runing text",Rp494.100Rp549.000,5.080+ terjual,Bamboo nanda art galleryTangerang Selatan
Jadwal Sholat LED running text 100cm x 20cm GPS wireless android hp,Rp810.000,5.018 terjual,BonafidJakarta Timur
jam sholat digital masjid jadwal imsak + syuruq setting menu tombol,Rp1.250.000,5.017 terjual,TOKO JAM MASJID TOELBandung
Kontroller jam digital & jadwal sholat 1-2 panel P10 - Manual Iqomah,Rp250.000,4.980+ terjual,MeteorNetKab. Jombang
JWS TV Jasma - Jam digital dan jadwal sholat lengkap alarm dan tarhim,Rp3.500.000,5.011 terjual,Jasma DigitalKab. Sleman
Jam Adzan Digital LCD Jadwal Sholat Otomatis Al-Fatiha Faj-106,Rp260.000,5.06 terjual,Digital EltroJakarta Pusat
controller jadwal sholat jws wifi p10 single color Multisize,Rp240.000,5.02 terjual,IDE TechnoBinjai
Jam Jadwal Sholat+Alarm Adzan 5 Waktu+murotal sebelum sholat otomatis,Rp850.000,5.050+ terjual,ARSATEC-Arsyad InstrumenKab. Sleman
Jadwal Sholat Digital Jam Masjid Digital Gambar Madinah Uk 70cm x 30cm,Rp950.000,5.016 terjual,Jam Masjid Digital RTCBandung
jadwal sholat digital masjid ukuran 35cm x 50cm,Rp1.760.000,,elektrik dan elektronikJakarta Barat
Mauquta MQ-KY Jam Digital Jadwal Sholat Adzan Auto Tartil Kaligrafi,Rp3.250.000,5.02 terjual,Mauquta BarokahKab. Sidoarjo
Kalender Dinding tahun 2024 Lengkap Jadwal Sholat Bahan HVS WEO BC78,Rp9.900Rp15.000,5.050+ terjual,warnamendutKab. Tangerang
"Stiker Jadwal Waktu Sholat JWS-018, JWS-M3",Rp165.000,5.014 terjual,shato-mediaKab. Bantul
Kit modul controler jws jadwal sholat digital,Rp400.000,5.013 terjual,TOKO JAM MASJID TOELBandung
Jam Digital Adzan OTOMATIS Lengkap REMOT Jam adzan Jadwal Sholat 4636,Rp720.000,5.01 terjual,fan'sshopJakarta Utara
JAM ADZAN DIGITAL JADWAL SHOLAT OTOMATIS AZ 2325,Rp470.000,5.029 terjual,DIGITAL GROSIRJakarta Pusat
Jam Digital Jam Masjid Jadwal Sholat Masjid P5 Full Color Pigura wifi,Rp4.500.000,,KHAIR LEDKab. Hulu Sungai Utara
[ Al-Ashr V2] JWS LCD16x2-V2 / Jadwal Sholat / Jam Masjid / Modul JWS,Rp260.000,5.05 terjual,Cakrawala Elektronika SurabayaSurabaya
PCB JWS P10 Arduino Nano Jadwal Sholat Running Text Konektor DMD P10,Rp22.500,5.050+ terjual,Digital apikKab. Semarang
jam sholat digital sudah ada waktu iqomah 33X73CM 5 jadwal,Rp827.000,5.01 terjual,mitratechBandungKab. Bandung
Mauquta Auto Tartil MQ33 + MQ-12-JAJ Jam Digital Jadwal Sholat,Rp8.078.000,,Safa Nayla LatieshaKab. Ponorogo
jadwal sholat digital masjid rgb full colour ukuran 35x20 cm Alarm,Rp800.000,4.928 terjual,Art elektronikKab.Ciamis
Controller Jam Jadwal Waktu Sholat JWS Single Colour,Rp200.000,5.015 terjual,boj digital mediaKab. Tegal
Papan Jadwal Petugas Sholat Jumat 0Ri 100%,Rp328.000,,The DumpsterJakarta Timur
Jadwal Waktu Sholat JWS-018,Rp1.860.000Rp1.900.000,4.54 terjual,shato-mediaKab. Bantul
Mainan Edukasi Pajangan Edukatif Kayu Jadwal Waktu Sholat APE TK PAUD,Rp55.000,5.02 terjual,MainanalfaqihKab. Kediri
Modul Controller Jam Jadwal Sholat untuk 16x96,Rp350.000,4.870+ terjual,EndiLedBekasi
Jadwal Waktu Sholat JWS-e2,Rp500.000,4.240+ terjual,shato-mediaKab. Bantul
Kontroler Jam Jadwal Waktu Sholat JWS RGB 4x2 panel P5 T3,Rp330.000,5.02 terjual,boj digital mediaKab. Tegal
running text jadwal sholat uk 132x20cm warna hijau wifi,Rp1.400.000,2 terjual,Surabaya running textSurabaya
Jadwal Sholat Digital Jam Masjid Tipe A Klasik Ukuran 70 cm x 30 cm Bisa Custom Nama Masjid Dan Gambar - Tanpa Wifi,Rp1.429.998,,Toko Jam Digital Masjid LEDBalikpapan
DZIKROUND PREMIUM M4 Jam Digital Jadwal sholat Otomatis + Running Text,Rp1.500.000,3 terjual,DZIKROUNDKab. Sidoarjo
Jam masjid Jadwal Sholat Digital Tipe B Klasik Ukuran 70 cm x 40 cm Bisa Custom Nama Masjid Dan Gambar - Tanpa Wifi,Rp1.704.998,,Toko Jam Digital Masjid LEDBalikpapan
"Jam Digital Jadwal Sholat Masjid , runing text - MERAH EMAS",Rp494.100Rp549.000,80+ terjual,Bamboo nanda art galleryTangerang Selatan
Jam Digital Masjid Jadwal Sholat 80cm x 30cm. Tipe A Imsak/Syuruq - Tanpa Wifi,Rp1.483.898,4 terjual,Toko Jam Digital Masjid LEDBalikpapan
JADWAL SHOLAT / JAM ADZAN DIGITAL OTOMATIS AZ-4009(Ada remote),Rp585.000,,ARYADS321 SHOPJakarta Pusat
Jam adzan digital jadwal sholat otomatis AZ 2325,Rp470.000,100+ terjual,digitalgrosirJakarta Pusat
JAM JADWAL SHOLAT digital otomatis full colour 135x22cm,Rp1.900.000,,VETRONIKSemarang
"Jam Adzan Digital LCD Jadwal Sholat Otomatis - 8 Pilihan Suara Adzan 115, 116",Rp555.750Rp585.000,,ARYADS321 SHOPJakarta Pusat
Jam masjid digital jadwal sholat otomatis jam sholat,Rp2.000.000,,VETRONIKSemarang
JAM DIGITAL LED Jadwal Sholat/Jam LED Mushola/Adzan&Iqomah,Rp470.000,4.422 terjual,printis jayaJakarta Barat
jadwal sholat digital masjid 110x50 runnigtext,Rp1.850.000,5.02 terjual,toko jam masjid digitalJakarta Pusat
JAM DIGITAL JADWAL SHOLAT MASJID. TYPE P10 4P KH. LAPORAN SALDO,Rp1.272.000Rp1.590.000,5.021 terjual,Bamboo nanda art galleryTangerang Selatan
Jam Digital Jadwal Sholat Warna MP3 Wifi Masjid JWS Murottal RGB LED,Rp999.000,5.09 terjual,Elektron MartTangerang
JAM DIGITAL MASJID JAM JADWAL SHOLAT FULL COLOR RGB JWS P5 4P KH,Rp2.241.000Rp2.490.000,5.018 terjual,Bamboo nanda art galleryTangerang Selatan
Jam Adzan Digital Jadwal Sholat Otomatis AZ-4008,Rp689.700,2 terjual,GLOBAL STORE ELEKTRONIKBekasi
JAM MASJID OTOMATIS jadwal sholat 100x50cm,Rp2.465.000,,VETRONIKSemarang
Jam Adzan Digital Jadwal Sholat Otomatis AZ-4008,Rp627.000,4 terjual,okeshop41Bekasi
Jadwal sholat digital running text p10 otomatis,Rp1.300.000,,VETRONIKSemarang
Jam AZ-2515 Adzan Clock Mini Jam Jadwal Sholat Digital Otomatis,Rp402.000,8 terjual,GLOBAL STORE ELEKTRONIKBekasi
Hiasan Dinding Peraga Pendidikan Edukatif JADWAL WAKTU SHOLAT,Rp40.774Rp42.920,3 terjual,centralplosoSurabaya
jam digital jadwal sholat seven segmen hijau emerald,Rp1.275.000,,RivalledJakarta Utara
Kontroler Jam Jadwal Waktu Sholat JWS RGB 2x6 panel P5,Rp500.000,5.03 terjual,boj digital mediaKab. Tegal
Modul jadwal sholat running text 32x128 via android,Rp385.000,4.46 terjual,EndiLedBekasi
JAM DIGITAL JADWAL SHOLAT MASJID RUNNING TEXT PETUGAS MASJID LAP.SALDO,Rp700.000,5.03 terjual,TOKO JAM MASJID TOELBandung
Jam masjid Jadwal sholat LED running text 200cm x 20cm hijau biru puti,Rp1.360.000,4.730+ terjual,BonafidJakarta Timur
Controller Jadwal Sholat HD W-60,Rp360.000,5.02 terjual,IHC_LedJakarta Barat
kalender 2023 kalender jawa kerja medium jadwal sholat 2023 A3 33x48,Rp8.900,5.02 terjual,ShirokumaOnlineSurabaya
Jam Masjid Digital Jadwal Sholat Digital Tipe B Syuruq  80cm x 40cm,Rp1.300.000,1 terjual,Jam Masjid Digital RTCBandung
Mauquta Tauqoly Jadwal Sholat Digital TQ-08-QMH,Rp2.075.000,4.01 terjual,Mauquta BarokahKab. Sidoarjo
Jam masjid jadwal sholat running text 100x20 cm p10,Rp1.300.000,,VETRONIKSemarang
Jam jadwal sholat full colour otomatis led p5 super halus,Rp3.350.000,2 terjual,VETRONIKSemarang
Jam masjid jadwal sholat otomatis akurat sesuai koordinat kota,Rp2.850.000,,VETRONIKSemarang
jam jadwal sholat 100x40 running text full colour,Rp2.500.000,,VETRONIKSemarang
Jadwal sholat otomatis digital running text p10 3 panel 100x20cm,Rp1.300.000,,VETRONIKSemarang
