Produk,Harga,Sold,Nama Toko
remote buat jam digital jadwal sholat jeda iqomah,Rp80.080,,NURSEHA SHOP ELEKTRONIK OFFICIALJakarta Barat
Jam Dinding Masjid Jadwal Waktu Sholat Jws Bingkai Tinggal Pasang P5,Rp1.115.000,5.02 terjual,CV. MEDIA DIGITAL TECHNOLOGYSukabumi
Jam Masjid Jadwal Sholat Digital Tipe CBI Running Text 80cm x 40cm,Rp2.050.000,,Jam Masjid Digital RTCBandung
"Jam Digital Jadwal Sholat P10 Single/P10 RGB/P5 RGB, V4. Ukuran 46x110",Rp1.600.000,5.01 terjual,SamBerry PiKab. Sukoharjo
Jam Adzan Digital Jadwal Sholat Otomatis TNT 2019,Rp585.000,5.028 terjual,digitalgrosirJakarta Pusat
Jam digital jadwal sholat p10 65x155 cm,Rp2.475.000Rp2.750.000,5.026 terjual,Bamboo nanda art galleryTangerang Selatan
"! PROMO Jam Masjid GPS, jadwal sholat digital satelit, in bluetooth HP",Rp2.400.000,4.88 terjual,toko jam masjid digitalJakarta Pusat
Jam Dinding Digital LED Jadwal Sholat Adzan musholah mesjid,Rp650.000,5.05 terjual,pushpitha shopJakarta Utara
KALENDER 2025 bulanan dengan jadwal sholat,Rp5.350,5.029 terjual,Agen murah kaJakarta Barat
Kontroler JWS Jadwal Sholat WIFI P2.5 RGB,Rp652.000,,dapilcuturKab. Tangerang
Jadwal Sholat Digital Jam Masjid Digital Ukuran 64X16 P5 Full Color,Rp2.200.000,,LED JeparaKab. Jepara
Jadwal sholat digital pigura,Rp800.000,5.02 terjual,MeteorNetKab. Jombang
running text jadwal sholat dan jam,Rp650.000,,Firdis StoreBandung
Jam Adzan Digital LCD Jadwal Sholat Otomatis - 8 Pilihan Suara Adzan,Rp460.000,5.030+ terjual,ARYADS321 SHOPJakarta Pusat
Mauquta MQ-08-JS Hijau Jam Digital Jadwal Sholat Runningtext Iqomah,Rp8.800.000,,Mauquta BarokahKab. Sidoarjo
NEW Al-Amin - Controller Jam Masjid Jadwal Sholat,Rp500.000,,afrie_shopSurabaya
Jadwal Sholat Rgb 40x200cm P5 Wifi Android,Rp6.500.000,5.01 terjual,hksalatiga LEDSalatiga
"Jam Digital Jadwal Sholat Running Text RGB,Full Color, JWS P5 3PKH",Rp1.576.800Rp2.190.000,5.018 terjual,Bamboo nanda art galleryTangerang Selatan
Auto Tartil dan tarhim sebelum waktu sholat dilengkapi dengan jadwal w,Rp695.000,1 terjual,GTZ TEKNIKKab. Jombang
AT24C64 khusus IC jadwal untuk Kit Jadwal Sholat Digital Kitdigitalku,Rp12.000,5.015 terjual,KitDigitalKuKab. Magelang
Paket DIY Jadwal sholat digital 3 panel P10 96x16,Rp675.000,5.010 terjual,MeteorNetKab. Jombang
Kalender Dinding Lengkap tahun 2024 Lengkap Jadwal Sholat jakarta,Rp15.000,,Barakallahh storeJakarta Barat
Jam Jadwal Sholat RGB 1 Panel - Paket Promo ramadhan,Rp390.000,4.910 terjual,pino_shopKab. Bandung
Kontroler Jam Jadwal Waktu Sholat JWS RGB 3x6 panel P5,Rp750.000,5.04 terjual,boj digital mediaKab. Tegal
Modul control jam jadwal sholat running text 4 panel,Rp480.000,2 terjual,Ganis Asih AtiKab. Cianjur
Terlaris Remote khusus jadwal sholat digital jam masjid adzan iqomah,Rp117.000,,Angel87Jakarta Barat
Jadwal Sholat Digital Jam Masjid Nurul Kibing 115cm x 35cm Tipe CCD,Rp1.500.000,5.01 terjual,Jam Masjid Digital RTCBandung
JAM DIGITAL JADWAL SHOLAT MASJID FULL COLOR RGB BESAR 46 CMX206CM,Rp4.810.700Rp6.590.000,5.09 terjual,Bamboo nanda art galleryTangerang Selatan
Jadwal Waktu Sholat - Paket Module KIT-JWS-M3,Rp1.655.900,4.850+ terjual,shato-mediaKab. Bantul
JADWAL SHOLAT DIGITAL RUNNING TEXT JWS P10 UKURAN 20X100 CM,Rp750.000,5.040+ terjual,MCD LED SPAREPARTJakarta Timur
JADWAL SHOLAT DIGITAL RUNNING TEXT JWS P5 RGB FULL COLOR 20x132 CM,Rp1.680.000,5.09 terjual,MCD LED SPAREPARTJakarta Timur
kit modul jadwal sholat digital otomatis wifi android display jam 1.8 inch kalender 0.8 inch dan jadwal 0.56 inch plus power supply,Rp750.000,1 terjual,dacxtronikYogyakarta
Jam digital jadwal sholat masjid running text 2 panel,Rp990.000,5.012 terjual,Bamboo nanda art galleryTangerang Selatan
Jam Digital Jadwal Waktu Sholat Jws Lapadz Tinggal Pasang P5 - 2 BARIS,Rp2.348.500,5.013 terjual,CV. MEDIA DIGITAL TECHNOLOGYSukabumi
Tipe A Minimalis. Jam Masjid Jadwal Sholat Digital Ukuran 70cm x 30cm,Rp1.209.996,4.827 terjual,Toko Jam Digital Masjid LEDBalikpapan
jam digital jadwal sholat mini series murah,Rp1.350.000,5.02 terjual,dacxtronikYogyakarta
[PROMO] JAM DIGITAL JADWAL SHOLAT RUNNING TEXT UKURAN 20CM X100CM / JAM SHOLAT MASJID,Rp2.195.000,,tokoduditeaKab. Banyuwangi
"JAM SHOLAT MASJID, JAM DIGITAL JADWAL SHOLAT, TYPE P10 RGB 4P KH",Rp1.791.000Rp1.990.000,5.09 terjual,Bamboo nanda art galleryTangerang Selatan
mauQuta MQBFL Jumbo Jam Digital Jadwal Sholat Adzan Tartil,Rp13.475.000,5.01 terjual,Mauquta BarokahKab. Sidoarjo
JADWAL SHOLAT LCD+MUROTTAL MP3,Rp850.000,5.01 terjual,elcons-wareKab. Banyumas
controler jam jadwal sholat p10 big multi size 3 panel /2x10 paanel,Rp200.000,3.73 terjual,LED display BEKASIBekasi
Jam jadwal sholat digital + buzzer,Rp788.888,5.018 terjual,Dela martCimahi
Jam Masjid Digital jadwal sholat running text,Rp900.000,5.04 terjual,VETRONIKSemarang
JWSD TIPE A-i (imsak) Jadwal Waktu Sholat Digital,Rp1.200.000,5.03 terjual,Dsilent ShopKab. Cianjur
Modul Kit Jadwal Sholat Seven Segmen Running Text,Rp890.500,,RivalledJakarta Utara
"Jam jadwal sholat TV. JWS TV. Jam masjid TV, Versi 2 - Paket 1",Rp1.800.000Rp2.000.000,100+ terjual,Bamboo nanda art galleryTangerang Selatan
JAM DIGITAL JADWAL SHOLAT TYPE JWS P5 RGB 3X6 HL.,Rp9.500.000,,Bamboo nanda art galleryTangerang Selatan
Kontroller Jws Khalifah Jadwal Sholat Jam Masjid P10 SINGLE - 1 BARIS,Rp185.000,250+ terjual,CV. MEDIA DIGITAL TECHNOLOGYSukabumi
Jam Masjid Jadwal Waktu Sholat Jws Tinggal Pasang P10 RGB - 1 BARIS,Rp810.000,24 terjual,CV. MEDIA DIGITAL TECHNOLOGYSukabumi
JAM DIGITAL JADWAL SHOLAT MASJID. JWS K,Rp1.390.000,70+ terjual,Bamboo nanda art galleryTangerang Selatan
Jam Adzan Digital Jadwal Sholat Otomatis AZ-4008,Rp689.700,5.02 terjual,GLOBAL STORE ELEKTRONIKBekasi
JAM DIGITAL JADWAL SHOLAT MASJID. JWS B,Rp2.190.000,5.022 terjual,Bamboo nanda art galleryTangerang Selatan
Remote jam masjid musholla jadwal sholat digital khusus,Rp85.500Rp90.000,5.06 terjual,ATJ LED INDONESIAKab. Bekasi
kontroller controller jws jadwal sholat multi panel,Rp250.000,4.88 terjual,DELTA ELECTROKab. Bandung
KIT JADWAL SHOLAT LCD+MUROTTAL MP3,Rp475.000,5.08 terjual,elcons-wareKab. Banyumas
JAM DIGITAL JADWAL SHOLAT MASJID TYPE P10 2P KH,Rp792.000Rp990.000,60+ terjual,Bamboo nanda art galleryTangerang Selatan
JWS TV Android - Display Jadwal Sholat Digital,Rp259.000,22 terjual,Karya-Tronika TeknologiKab. Tabanan
Controller Jws Khalifah Jadwal Sholat Jam Masjid P10 SINGLE - 2 BARIS,Rp319.000,80+ terjual,CV. MEDIA DIGITAL TECHNOLOGYSukabumi
"Jadwal Sholat Digital Running Text Indoor Uk. 20X100 - Merah, Non Tartil",Rp700.000,30+ terjual,VanledKab. Tegal
mauQuta MQ-KBH Jam Jadwal Sholat Adzan Murottal - MQ 03 KBH,Rp825.000,80+ terjual,Mauquta BarokahKab. Sidoarjo
Jadwal Sholat Digital & Timer Iqomah Running Text,Rp850.000,4.820 terjual,boj digital mediaKab. Tegal
running text  jam digital jadwal sholat 200 x 40cm P.5 full color RGB,Rp4.600.000,5.01 terjual,led-kebumen89Kab. Kebumen
Jadwal sholat running text 1.3meter x 20cm merah,Rp1.010.000,5.060+ terjual,BonafidJakarta Timur
DZIKROUND FC29 Jam Masjid digital jadwal sholat timer iqomah fullcolou,Rp7.000.000,5.01 terjual,DZIKROUNDKab. Sidoarjo
Jam Masjid Pelangi RGB P5 Tiga (20cm x 100cm) Jadwal Sholat Digital,Rp1.250.000,5.05 terjual,Pelangi RGBSurabaya
Jadwal Sholat Digital Masjid,Rp1.900.000,,SINAR TERANG GEMILANGBatam
Controller Jadwal Sholat RGB 32x192 [1x3 P5] [2x8 P10],Rp325.000,5.07 terjual,KontritechKab. Bantul
Jam Digital Adzan Jadwal Sholat Otomatis 4008,Rp550.000,4.8100+ terjual,Digital EltroJakarta Pusat
Jadwal Waktu Sholat - Paket Module KIT-JS01 TANPA SWITCHING,Rp759.900,4.960+ terjual,shato-mediaKab. Bantul
Jadwal Sholat Digital + Jeda Iqomah TauQoly TQ-05-QMH (48cmx21cm),Rp1.400.000,1 terjual,mauquta.tauqolyJakarta Timur
Jadwal Sholat Digital Android TV,Rp550.000,60+ terjual,Karya-Tronika TeknologiKab. Tabanan
MauQuta TV Plus Jadwal Sholat Digital TV - MQ TV Plus Pro,Rp3.450.000,1 terjual,Mauquta BarokahKab. Sidoarjo
"JAM DIGITAL JADWAL SHOLAT MASJID ADA LAPORAN SALDO, TYPE JWS P10 3P KH",Rp967.500Rp1.290.000,100+ terjual,Bamboo nanda art galleryTangerang Selatan
Jadwal Sholat Digital Jam masjid Tipe B Imsak Klasik Ukuran 80 cm x 40 cm Bisa Custom Nama Dan Gambar - Tanpa Wifi,Rp1.979.998,,Toko Jam Digital Masjid LEDBalikpapan
Jam Digital Jadwal Waktu Sholat Jws Lapadz Tinggal Pasang P5 - 2 BARIS,Rp2.348.500,13 terjual,CV. MEDIA DIGITAL TECHNOLOGYSukabumi
Kontroler JWS Jadwal Sholat WIFI P5 RGB,Rp365.000,5.019 terjual,FAN LED ReklameBandung
ESP32 terisi firmware jadwal sholat Khalifah JWS ESP,Rp150.000,5.030+ terjual,Arin-TechKab. Lampung Tengah
Jadwal Sholat LED RUNNING TEXT 1m x 20cm merah 100cm murah,Rp950.000,5.090+ terjual,BonafidJakarta Timur
Jadwal Waktu Sholat JWS-Endi Spesial Edition,Rp579.900,5.09 terjual,shato-mediaKab. Bantul
Jadwal Sholat Merah 40x260Cm Setting by Android,Rp4.500.000,5.01 terjual,Sala3.NETSalatiga
mauQuta MQ-AL Jam Digital Jadwal Sholat Runningtext Adzan Tartil,Rp5.250.000,5.01 terjual,Mauquta BarokahKab. Sidoarjo
Jam Digital LED Adzan Jam Jadwal Sholat 5 Waktu Otomatis Jam Al-Fajia,Rp505.000,5.08 terjual,Frekuensi AmanJakarta Barat
jadwal sholat digital 120x55 cm,Rp2.800.000,5.01 terjual,PRODUSEN JAM MASJID DIGITALSurakarta
MauQuta TV Plus Jadwal Sholat Digital TV,Rp3.450.000,1 terjual,Mauquta BarokahKab. Sidoarjo
"Jam Jadwal Sholat Digital Masjid Timer Adzan Iqomah ""Kecil 80 x 40 cm""",Rp1.799.000,4.919 terjual,Pabrik Jam MasjidSurakarta
Jam Masjid Jadwal Sholat Digital Ukuran 80 cm x 30 cm Tipe A Imsak Klasik Bisa Custom Nama Masjid Dan Gambar - Tanpa Wifi,Rp1.649.998,,Toko Jam Digital Masjid LEDBalikpapan
"Kontroller Jws Khalifah Jadwal Sholat Jam Masjid P10 RGB - 1 BARIS - 1X1 1PANEL, Kontroller Only",Rp198.500,90+ terjual,CV. MEDIA DIGITAL TECHNOLOGYSukabumi
"Jam Masjid Jadwal Sholat Digital Ukuran 70 cm x 40 cm Tipe B Minimalis Bisa Custom Nama Masjid Dan Gambar - Tombol, Gold",Rp1.209.998,,Toko Jam Digital Masjid LEDBalikpapan
RUNNING TEXT JWS JADWAL SHOLAT JAM WAKTU SHOLAT JAM SHOLAT P5 RGB FULL COLOR 20X100CM 32x192pixel,Rp1.265.000,5 terjual,ANUGRAH LED KLATENKab. Klaten
Jadwal Sholat Digital Jam Masjid Tipe A Klasik Ukuran 70 cm x 30 cm Bisa Custom Nama Masjid Dan Gambar - Tanpa Wifi,Rp1.429.998,,Toko Jam Digital Masjid LEDBalikpapan
Controller Jadwal Sholat HAFLA mp3,Rp650.000,5.04 terjual,KontritechKab. Bantul
Kontroller Jadwal sholat JWS RGB 2X4 Tipe B,Rp355.000,5.014 terjual,Micro_TenKab. Klaten
Jadwal Sholat Elektronik Jam Waktu Adzan Otomatis Solat Masjid JSE BIG,Rp10.300.000,,ELTECH onlineSurabaya
TERBARU ! ! KONTROLLER JWS P10 RGB KHALIFAH / CONTROLLER JADWAL SHOLAT RGB WIFI,Rp575.000,,storm shoppBatam
Jam jadwal sholat digital + buzzer,Rp599.999,5.018 terjual,Dela martCimahi
Cuci gudang DISPLAY JADWAL SHOLAT RUNNING TEXT 37 x 197 cm,Rp2.800.000,,NK ElektronicJakarta Barat
Jam Masjid Jadwal Waktu Sholat Digital Elektronik Otomatis Abadi Solat,Rp1.750.000,5.03 terjual,Serba Ada Kudus-BandungKab. Bandung Barat
Jadwal Sholat Elektronik Jam Waktu Adzan Otomatis Solat Masjid JSE MAN,Rp2.750.000,1 terjual,ELTECH onlineSurabaya
DZIKROUND FC3 jam digital masjid jadwal sholat 20x100 fullcolour,Rp1.600.000,5.03 terjual,DZIKROUNDKab. Sidoarjo
Mauquta Jam Digital Jadwal Sholat Runningtext MQ-12-JAJ Jam Arab,Rp3.700.000,1 terjual,Mauquta BarokahKab. Sidoarjo
Kontroler jadwal sholat digital P10 single color JWS Khalifah,Rp240.000,,MeteorNetKab. Jombang
JAM MASJID JADWAL WAKTU SHOLAT UKURAN 40X200CM KONEKSI Wifi,Rp1.900.000,5.05 terjual,RD-LEDKab. Ponorogo
Jadwal Waktu Sholat JWS-IEQi,Rp1.000.000,4.925 terjual,shato-mediaKab. Bantul
KALENDER DINDING 32CM X48CM 12 LBR ADA JADWAL SHOLAT CUSTOM NAMA TOKO,Rp8.259,,MPromosindo SurabayaSurabaya
Modul Kit Jadwal Sholat Digital Otomatis,Rp800.000,4.921 terjual,KitDigitalKuKab. Magelang
Jadwal sholat running text 2m meter x 40cm,Rp2.460.000,4.37 terjual,BonafidJakarta Timur
Jam Jadwal Pengingat Sholat Liniaji TQ-42-IQO Merah,Rp2.050.000,5.0100+ terjual,PT GALLERY MASJID INDONESIAJakarta Pusat
Mesin Jadwal Sholat Digital Tipe A Untuk ukuran 70cm x 30cm,Rp650.000,2 terjual,Jam Masjid Digital RTCBandung
LANGSUNG PRODUSEN jam digital masjid ukuran besar | Jam Jadwal Sholat Otomatis,Rp950.000,,syamilunaSurakarta
Jadwal Sholat Digital. Lampu Background. Klasik C Imsyak,Rp2.250.000,5.02 terjual,Jam Masjid Digital RTCBandung
Khusus Gojek Grab. jadwal Sholat Digital Jam Digital Sholat.,Rp1.000.000,5.04 terjual,Jam Masjid Digital RTCBandung
jam jadwal sholat /paket rakit/belajar 1 panel p5 rgb,Rp450.000,,LED display BEKASIBekasi
Jadwal sholat running text 140cm x 40cm wifi or bluetooth with GPS,Rp1.760.000,5.01 terjual,BonafidJakarta Timur
Mesin Jadwal Sholat Digital Tipe CCD,Rp900.000,5.01 terjual,Jam Masjid Digital RTCBandung
Kontroller JWSD 7 segment 1.8.1 - Jadwal Sholat Digital,Rp1.100.000,,ROKHIM_JWSKab. Grobogan
controller Jadwal sholat JWSDS 11lite v2,Rp280.000,5.01 terjual,Ledstore OfficialJakarta Barat
JADWAL SHOLAT ANDROID-WIFI Controller M26W MONO COLOUR,Rp550.000,4.640+ terjual,eltop electronicsSurabaya
Packing Kayu Jadwal Sholat/ Running Text. Tdk Dapat di beli terpisah.,Rp150.000,5.011 terjual,Jam Masjid Digital RTCBandung
Jadwal Sholat Digital Imsyak Ukuran 130 cm x 40 cm.,Rp2.100.000,5.01 terjual,Jam Masjid Digital RTCBandung
Jam Masjid Digital Jadwal Sholat Mushola Murah Garansi Resmi,Rp1.499.000,5.012 terjual,Pabrik Jam MasjidSurakarta
led running text Jadwal Sholat Besar 365cm x 40cm merah indoor outdoor,Rp4.950.000,1 terjual,BonafidJakarta Timur
Jam Masjid Jadwal Sholat Digital,Rp5.700.000,,MAKMUR JAYA AJambi
Jam Dinding Iqomah / Jadwal Sholat Al-Pigeons AZ 4560-5 Dimensi 60 cm,Rp1.393.900,,LapakJamShopBandung
led Jadwal Sholat dengan Murotal 100x20cm Volume dapat di atur via app,Rp860.000,5.01 terjual,BonafidJakarta Timur
Kontroller Jam Sholat TV - Jadwal Sholat TV - JWS TV - JWS Raspberry,Rp1.800.000,,Arin-TechKab. Lampung Tengah
JAM DIGITAL MASJID JAM JADWAL SHOLAT FULL COLOR JWS P5 5P KH RGB - Non Mp3+Adzan,Rp2.691.000Rp2.990.000,25 terjual,Bamboo nanda art galleryTangerang Selatan
Jam masjid Jadwal Sholat Digital Tipe B Klasik Ukuran 70 cm x 40 cm Bisa Custom Nama Masjid Dan Gambar - Tanpa Wifi,Rp1.704.998,,Toko Jam Digital Masjid LEDBalikpapan
DZIKROUND PREMIUM M4 Jam Digital Jadwal sholat Otomatis + Running Text,Rp1.500.000,3 terjual,DZIKROUNDKab. Sidoarjo
Jam Digital Masjid Jadwal Sholat 80cm x 30cm. Tipe A Imsak/Syuruq - Tanpa Wifi,Rp1.483.898,4 terjual,Toko Jam Digital Masjid LEDBalikpapan
Lampu led jadwal sholat 100x60cm,Rp4.000.000,,elektrik dan elektronikJakarta Barat
Jam Masjid Jadwal Waktu Sholat Tipe B Minimalis Uk 70x40 Cm - Hanya Tombol,Rp1.485.000,1 terjual,Toko Jam Digital Masjid LEDBalikpapan
"Jam Digital Jadwal Sholat Masjid , runing text - MERAH EMAS",Rp494.100Rp549.000,80+ terjual,Bamboo nanda art galleryTangerang Selatan
Jam Digital Jadwal Sholat 80 cm x 30 cm. Tipe A Imsak Klasik Adzan - Pakai Wifi,Rp2.034.998,1 terjual,Toko Jam Digital Masjid LEDBalikpapan
"Jam Jadwal sholat, type jws p5 2p full color.suara tarhim,azan&murotal",Rp1.850.000,2 terjual,Bamboo nanda art galleryTangerang Selatan
Tipe A Minimalis. Jam Masjid Jadwal Sholat Digital Ukuran 70cm x 30cm - Tanpa Wifi,Rp1.209.996,27 terjual,Toko Jam Digital Masjid LEDBalikpapan
Jadwal sholat running text 165cm x 40cm WIFI abadi,Rp2.200.000,5.02 terjual,BonafidJakarta Timur
MINI PC Jam Masjid DIGITAL Jadwal Sholat SIGNAGE (PAKET) (JABODETABEK),Rp3.777.000,5.06 terjual,Raissa GadgetBekasi
Kontroller Jadwal Sholat P10 Single Color As-salam JWS Assalam,Rp250.000,4.01 terjual,MeteorNetKab. Jombang
jadwal Sholat Digital Jam Digital Sholat. TIPE CA MADINAH,Rp950.000,5.04 terjual,Jam Masjid Digital RTCBandung
Jam digital jadwal sholat,Rp1.200.000,,Dacxtronic StoreYogyakarta
"JAM SHOLAT MASJID, JAM DIGITAL JADWAL SHOLAT, TYPE P10 RGB 4P KH - TAMPILAN 1",Rp1.791.000Rp1.990.000,9 terjual,Bamboo nanda art galleryTangerang Selatan
"jadwal waktu sholat, jam masjid digital waktu shalat GPS +timer iqomah",Rp1.200.000,,prima electronicJakarta Barat
Jadwal Sholat Digital Jam Masjid Digital Ukuran 96X32 P5 Full Color,Rp4.300.000,,LED JeparaKab. Jepara
jam masjid jadwal waktu sholat digital + timer iqomah + runing text,Rp1.200.000,8 terjual,prima electronicJakarta Barat
JAM DIGITAL JADWAL SHOLAT TYPE P10 3P RGB KH - Non Murotal.,Rp1.192.500Rp1.590.000,3 terjual,Bamboo nanda art galleryTangerang Selatan
Jadwal sholat digital jam 1.8 inch kalender jadwal 1 inch plus running,Rp1.250.000,5.03 terjual,dacxtronikYogyakarta
Jam Masjid TV Jadwal Sholat DIgital TV,Rp3.699.000,5.03 terjual,Jam Masjid Digital RTCBandung
Jam Kalender Digital Adzan/Jadwal Sholat LED,Rp450.000,,Fashion Muslim DuniaJakarta Barat
Jadwal Sholat Masjid GPS Runningtex 100x40 Premium + Setting HP,Rp2.650.000,5.03 terjual,toko jam masjid digitalJakarta Pusat
jam masjid digital+jadwal sholat digital +kaligrafi arab,Rp1.570.000,5.07 terjual,Grosirjamku1Tangerang Selatan
Jam Digital Masjid Jadwal Sholat Murah Garansi Resmi,Rp1.799.000,5.07 terjual,Pabrik Jam MasjidSurakarta
Mauquta Jam Digital Jadwal Sholat MQ-08-JS LEDMerah Runningtext Iqomah,Rp7.700.000,,Mauquta BarokahKab. Sidoarjo
kontroller jadwal sholat esp khalifah,Rp290.000,14 terjual,Pusat led displayKab. Pati
JAM DIGITAL LED Jadwal Solat/Jam LED Mushola/Adzan&Iqomat+OTOMTIS,Rp1.000.000,6 terjual,watch palaceMedan
PCB Arduino Nano JWS Jadwal Sholat RTC DS3231,Rp15.000,4.211 terjual,SipolJakarta Timur
controller Jadwal sholat JWS onbon wi fi,Rp650.000,,elektrik dan elektronikJakarta Barat
jam jadwal waktu sholat sholat digital + alarm + timer jeda iqomah,Rp1.400.000,1 terjual,prima electronicJakarta Barat
JAM DIGITAL JADWAL SHOLAT MASJID FULL COLOR RGB BESAR 46 CMX206CM - tampa murotal,Rp4.810.700Rp6.590.000,9 terjual,Bamboo nanda art galleryTangerang Selatan
Jadwal Sholat Digital Display TV,Rp350.000,7 terjual,Karya-Tronika TeknologiKab. Tabanan
Jam Digital Jadwal Sholat Masjid - Tampa Nama,Rp1.092.500Rp1.150.000,30+ terjual,Bamboo nanda art galleryTangerang Selatan
Module Wifi jadwal sholat aliza,Rp50.000,5.02 terjual,Sala3.NETSalatiga
Jadwal Sholat Digital. Jam Digital Sholat. Lampu Background. Klasik AB,Rp1.250.000,5.01 terjual,Jam Masjid Digital RTCBandung
Jadwal Waktu Sholat murotal sholawat tarhim sebelum sholat otomatis,Rp3.155.000,,Muhamad Rusli DarussalamKab. Ponorogo
CONTROLLER JWS - JADWAL WAKTU SHOLAT P10 SINGLE COLOR CUSTOM,Rp300.000,5.02 terjual,PRATAMAKOMPUTERPontianak
Controller Jadwal Sholat Modul P4.62 Dan P7 2 Panel,Rp265.000,5.01 terjual,RivalledJakarta Utara
Kalender Dinding Lengkap tahun 2023 Jadwal Sholat Bahan HVS 32x48cm,Rp7.500,,SAGA IDCimahi
Controller Jadwal Sholat 32x192 2x6 Panel P10,Rp365.000,4.911 terjual,KontritechKab. Bantul
"Jam jadwal sholat TV. JWS TV. Jam masjid TV, Versi 2",Rp1.372.000,,Toko Hermawan 88Tangerang Selatan
controller jadwal solat p10 4x1,Rp325.000,4.9750+ terjual,Dunia DuinoBandung
Jadwal sholat digital otomatis jam 1.8 inch kalender dan jadwal 1 inch,Rp900.000,5.03 terjual,dacxtronikYogyakarta
JADWAL SHOLAT DIGITAL RUNNING TEXT JWS P10 RGB FULL COLOR 20X100 CM - JWS ONLY,Rp1.050.000,5 terjual,MCD LED SPAREPARTJakarta Timur
Jam Jadwal sholat Masjid warna warni/Full color. - Tampa Mp3+Adzan,Rp792.100Rp890.000,13 terjual,Bamboo nanda art galleryTangerang Selatan
"jam jadwal waktu sholat digital, jeda adzan iqomah, led running text",Rp3.000.000,3 terjual,prima electronicJakarta Barat
"Jam Digital Jadwal Sholat Masjid, Running Text 45 cmx 150 cm - Hijau",Rp1.791.000Rp1.990.000,9 terjual,Bamboo nanda art galleryTangerang Selatan
mauQuta MQ-KFL Jam Jadwal Sholat Runningtext - Mekah - Emas,Rp3.600.000,6 terjual,Mauquta BarokahKab. Sidoarjo
Jadwal Sholat Digital Suara Adzan Ukuran 70cm x 40cm Tipe B,Rp1.300.000,5.01 terjual,Jam Masjid Digital RTCBandung
running text led jadwal sholat bisa order seperti yang di butuh,Rp850,,Mifa Autonik OfficialKab. Tangerang
LED Jadwal sholat running text 165 x 20cm wifi abadi putih hijau biru,Rp1.200.000,4.74 terjual,BonafidJakarta Timur
JADWAL SHOLAT DIGITAL RUNNING TEXT JWS P5 RGB FULL COLOR,Rp1.260.000,4.930+ terjual,MCD LED SPAREPARTJakarta Timur
Poster Laminasi Papan Jadwal Harian Waktu Sholat - bisa hapus tulis,Rp18.000,5.017 terjual,Optima Media EduKab. Klaten
Mesin Adzan Otomatis Jam Jadwal Sholat murotal sebelum sholat otomatis,Rp899.500,,VISIONE SPAREPARTKab. Banyumas
Jasma Versi Spesial Edition Jam Jadwal waktu Sholat Masjid TV LED,Rp5.179.000,,PT.SEJAHTERAABADI.Semarang
Jadwal Sholat Digital Abadi 120x60Cm Plus Running Text High Res,Rp4.000.000,5.02 terjual,Sala3.NETSalatiga
Jam Dinding Digital Adzan Jadwal Sholat Masjid Waktu Azan Bingkai 4535,Rp600.000,4.940+ terjual,Grosir ElektronikJakarta Barat
Servis Service Perbaikan Jadwal Sholat produk China segala kerusakan,Rp125.000,5.01 terjual,RivalledJakarta Utara
Jam Sholat Jam Masjid Jadwal Sholat Digital A Syuruq CAS 80cm x 30cm,Rp1.250.000,5.04 terjual,Jam Masjid Digital RTCBandung
Jadwal sholat running text 165cm x 20cm wifi abadi LED,Rp1.200.000,5.014 terjual,BonafidJakarta Timur
Jam Masjid Jam Jadwal Sholat digital Indoor P5 Fullcolor 20cm x 100cm,Rp1.260.000,4.68 terjual,VanledKab. Tegal
Jam Adzan Digital LCD Jadwal Sholat Otomatis Al-Fatiha Faj-118,Rp382.500Rp450.000,5.08 terjual,DIGITAL GROSIRJakarta Pusat
Jam Dinding Digital Adzan Jadwal Sholat Masjid Waktu Azan Bingkai 4636,Rp598.000Rp880.000,5.015 terjual,Lebih amanJakarta Barat
DZIKROUND FC26 Jam Digital Masjid Jadwal Sholat masjid Ukuran 40cmx200,Rp4.400.000,5.03 terjual,dzikroundindonesiaSurabaya
Controller Jws P5 Rgb Wifi / Kontroller Jadwal Dan Jam Sholat Mp3,Rp890.000,,riska kosmetik6
controler jadwal sholat p5 rgb mp3/tartil multi ukuran 1 smpe 4 panel,Rp420.000,5.0,LED display BEKASIBekasi
Jadwal Sholat Digital. Jam Digital Sholat. Lampu Background. Klasik B.,Rp1.500.000,5.01 terjual,Jam Masjid Digital RTCBandung
JADWAL SHOLAT WIS&WIB,Rp3.500.000,1 terjual,WARUNG-RADIO-ARDUINOMojokerto
Jadwal Waktu Sholat JWS-01Tartil,Rp1.333.990Rp1.400.000,5.026 terjual,shato-mediaKab. Bantul
JADWAL SHOLAT 20X135cm,Rp1.300.000,,EXFERIA LEDTangerang
JAM MASJID DIGITAL JAM ADZAN JADWAL SHOLAT CUSTOM NAMA 40 x 100 cm,Rp2.150.000,5.07 terjual,AWesome-StoreJakarta Utara
JAM DIGITAL MASJID / JADWAL SHOLAT NASJID,Rp2.967.000,,digidigi_storeBogor
"Kit modul jadwal sholat digital running jam 3"" jadwal 1.5"" hijau pure",Rp2.650.000,5.01 terjual,dacxtronikYogyakarta
Jam adzan digital jadwal sholat otomatis AZ 2325,Rp470.000,4.9100+ terjual,digitalgrosirJakarta Pusat
Jadwal Sholat Digital Tipe Imsyak Ukuran 115 cm x 65 cm,Rp2.000.000,5.05 terjual,Jam Masjid Digital RTCBandung
Controller Jadwal Sholat P5 RGB 2-6 Panel,Rp390.000,,Pelangi RGBSurabaya
Controller Jadwal Sholat Type Wifi UK 1 - 6 Panel P10 Mono Colour,Rp400.000,5.03 terjual,eltop electronicsSurabaya
controler jadwal sholat p5 rgb nontartil multi ukuran 1sampe 4 panel,Rp350.000,5.02 terjual,LED display BEKASIBekasi
"! PROMO! jam masjid GPS, jadwal sholat digital + running text + alarm",Rp1.110.000,5.020 terjual,toko jam masjid digitalJakarta Pusat
"Jam Digital Jadwal Sholat Running Text RGB Full Color, JWS P5 2PKH",Rp1.266.500Rp1.490.000,4.812 terjual,Bamboo nanda art galleryTangerang Selatan
Modul Panel LED P5 Indoor SMD RGB Full Color bisa untuk Jadwal Sholat,Rp306.800,,Sempurna ComunicationMedan
Jam Adzan Digital Jadwal Sholat Otomatis & Suara Iqomah AZ 2515,Rp400.000,4.960+ terjual,Digital EltroJakarta Pusat
Kontroller Jadwal Sholat Digital Rgb Full Color - Non Tartil,Rp559.000,,Delia PutriShopSamarinda
"Kontroller Jws Khalifah Jadwal Waktu Sholat Masjid P10 RGB - 2 BARIS - 2X4 8PANEL, +MP3 +RELAY",Rp550.000,30+ terjual,CV. MEDIA DIGITAL TECHNOLOGYSukabumi
DZIKROUND FS3 Jam digital jadwal sholat running texT Fullcolour 20x100,Rp1.900.000,9 terjual,DZIKROUNDKab. Sidoarjo
Jam Adzan Digital LCD Jadwal Sholat Otomatis - 8 Pilihan Suara Adzan,Rp460.000,100+ terjual,DIGITAL GROSIRJakarta Pusat
JADWAL SHOLAT DIGITAL JWS RUNNING TEXT P10 SINGLE COLOR 16X128CM PX,Rp1.050.000,1 terjual,ANUGRAH LED KLATENKab. Klaten
Kit 7 Segment JWS dengan kontroler mini jadwal sholat digital - Merah,Rp1.100.000,100+ terjual,LuminixSalatiga
Jam digital jadwal sholat + suara azan + tahrim + murotal 30 juz - Bingkai putih,Rp986.000Rp1.450.000,12 terjual,Bamboo nanda art galleryTangerang Selatan
mauQuta MQ-PK Pintu Kabah Jadwal Sholat Digital,Rp3.550.000,8 terjual,Mauquta BarokahKab. Sidoarjo
Jadwal Sholat Digital Jam Masjid Running Text P10 Warna Merah dan Hijau Ukuran 104 cm x 24 cm - Merah,Rp2.035.000,,Toko Jam Digital Masjid LEDBalikpapan
Dzikround FC27 Custom jadwal sholat Running Text ukuran 40cm x 230cm,Rp6.200.000,1 terjual,DZIKROUNDKab. Sidoarjo
JAM DIGITAL JADWAL SHOLAT MASJID. JWS B RUN - Pakai Nama,Rp3.051.000Rp3.390.000,10 terjual,Bamboo nanda art galleryTangerang Selatan
JADWAL SHOLAT RUNNING TEXT WIFI ANDROID 68*20 CM,Rp1.200.000,,Dee Sign Led ( Jember Led)Kab. Jember
Jam Adzan Digital Jadwal Sholat Otomatis  Suara Iqomah AZ 2012,Rp387.500,,adelaa_shopppSurabaya
CONTROLLER JADWAL SHOLAT P10 SINGLE COLOR,Rp230.000,5.015 terjual,Beone Suksestama OfficialSurabaya
Papan Jadwal Sholat untuk DKI Jakarta dan sekitatarnya,Rp25.000,,ShafindaKab. Jepara
jadwal sholat running text RGB 16x96,Rp2.000.000,5.03 terjual,LEDtrMalang
"Jam Masjid Jadwal Sholat Digital Ukuran 80 cm x 40 cm Tipe B Imsak Plus Running Text 30 cm Bisa Custom Nama Dan Gambar Desain - Tombol, Gold",Rp2.750.000,,Toko Jam Digital Masjid LEDBalikpapan
"Jam Digital Jadwal Sholat Runing Text RGB Full Color , JWS P5 2x3PKH - Tampa Murotal",Rp3.051.000Rp3.390.000,3 terjual,Bamboo nanda art galleryTangerang Selatan
"Jam Masjid Jadwal Sholat Digital Ukuran 115 cm x 65 cm Plus Running Text 30 cm Tipe D Bisa Custom Nama Dan Gambar Desain - Tombol, Gold",Rp3.465.000,,Toko Jam Digital Masjid LEDBalikpapan
jual jam jadwal sholat adzan digital update otomatis + running text,Rp2.460.000,1 terjual,prima electronicJakarta Barat
"mauQuta tauQoly TQ-08Q15 Jam Digital Jadwal Sholat - Mekkah Baru, Tanpa Packing",Rp3.025.000,,Mauquta BarokahKab. Sidoarjo
