Produk,Harga,Sold,Nama Toko
printer nomor mesin antrian autocutter v2,Rp3.154.000,,Ardistore938Depok
Mesin Antrian Dua Digit dengan Voice dan Printer,Rp2.599.000,5.030+ terjual,Sala3.NETSalatiga
Mesin Antrian Restauran Cafe Wireless Calling System 16 Pager Bel Mesin Panggil,Rp95.000,,HomeGaleriiJakarta Barat
Kontroller - Controller Mesin Antrian Sederhana 1 Panel P10,Rp180.000Rp200.000,5.06 terjual,bmzstoreKab. Sleman
Retekess wireless calling queuing system Mesin Antrian Vibrate 10 ch,Rp1.550.000,5.014 terjual,USUKMA-GROSIR-JKTJakarta Pusat
RETEKESS Wireless Calling System Restaurant Mesin Antrian 16 Pager - TD175,Rp1.030.900,,DiBudgetinJakarta Barat
Kios K Mesin Antrian Klinik/Puskesmas BPJS,Rp12.300.000,,atk semarangSemarang
Mesin Antrian 2 Layanan Single display dengan printer autocut,Rp5.100.000,5.03 terjual,Sala3.NETSalatiga
Mesin antri wireless 5 loket,Rp2.600.000,2 terjual,atmen storeKab. Temanggung
Wireless Calling System Restaurant Pager Mesin Antri Bel Panggil resto,Rp2.950.000,2 terjual,MG ElektronikJakarta Pusat
mesin antri 4 loket sederhana,Rp1.700.000,4 terjual,atmen storeKab. Temanggung
alat mesin antri panggil panggilan pemanggil Wireless Calling System Restaurant Mesin Antrian 10 Pager - Hitam,Rp2.014.042Rp2.055.145,,CMAG storeJakarta Barat
printer nomor mesin antri antrian,Rp1.200.000,30+ terjual,atmen storeKab. Temanggung
alat mesin antri panggil panggilan pemanggil Wireless Calling System Restaurant Mesin Antrian 10 Pager Coms store,Rp2.014.042Rp2.055.145,,Coms StoreJakarta Barat
Mesin antri wireless 2 loket,Rp1.550.000,10 terjual,atmen storeKab. Temanggung
Mesin antri dg nama 3 Loket,Rp2.300.000,1 terjual,atmen storeKab. Temanggung
printer tiket antri antrian autocutter,Rp1.750.000,30+ terjual,atmen storeKab. Temanggung
mesin antri LED 4 loket 4 layanan,Rp1.450.000,3 terjual,atmen storeKab. Temanggung
Tambahan display untuk mesin antrian 3 digit,Rp1.000.000,5.07 terjual,Sala3.NETSalatiga
Mesin Antrian 6 Loket Wiralles,Rp25.800.000,,VETRONIKSemarang
Printer Thermal Mesin Antrian dua loket,Rp1.340.000,4.950+ terjual,Sala3.NETSalatiga
mesin antrian hemat wireless plus tiketing,Rp1.500.000,5.03 terjual,Dunia DuinoBandung
MESIN KIOSK ANTRIAN | KIOSK LAYANAN MANDIRI | MESIN ANJUNGAN TERIMA PERMINTAAN CUSTOM,Rp2.500.000,,intimultisolusiJakarta Utara
mesin antri wireless komputer 4 loket,Rp2.400.000,2 terjual,atmen storeKab. Temanggung
Mesin antri display 2 loket sederhana,Rp1.050.000,11 terjual,atmen storeKab. Temanggung
mesin antri wireless komputer 7 loket,Rp3.450.000,1 terjual,atmen storeKab. Temanggung
printer tiket antrian antri ada jam,Rp1.000.000,20 terjual,atmen storeKab. Temanggung
MESIN ANTRIAN BPJS ONLINE PLUS SCANNER DAN SOFTWARE BCOMPBIZ BASIC,Rp15.000.000,,BCOMP MAKASSARMakassar
Calling Sistem Type SU-68Z Mesin pemanggil antrian Tombol restoran,Rp2.083.000Rp2.244.000,4.540+ terjual,T4ShoppingTangerang
Printer Mesin Antrian Auto Cut Satu Set dengan Meja Anjungan Printer,Rp3.600.000,5.06 terjual,Sala3.NETSalatiga
PRINTER THERMAL KASIR MESIN ANTRIAN 58MM [AUTOCUTTER/USB/RJ11] C90E,Rp570.000,,SMART STORE SOLUTIONKab. Sleman
mesin antrian 1 loket sederhana,Rp1.100.000,5.01 terjual,atmen storeKab. Temanggung
Mesin antrian kel binong,Rp19.000.000,1 terjual,cv rdv indo printKab. Sumedang
Digital Signage 22 19 17 Inchi Mesin Antrian Custome Touch-Non-screen,Rp35.999.999,,SmartdisplayJakarta Barat
Paket Mesin antrian 1 loket lengkap,Rp2.450.000,5.02 terjual,QaytechCimahi
16 In 1 Wireless Calling System Mesin Tunggu Antrian Bel Pager Wireles,Rp2.827.110,,Hommey_idJakarta Barat
"Harga Mesin Antrian Puskesmas, Mesin Antrian Pasien SIAP PAKAI Paket 1",Rp15.000.000,,Pradana KomputerJakarta Utara
Display Tambahan untuk Mesin Antrian 1 loket Wireless bel ting tong,Rp750.000,5.05 terjual,MAESTRO LEDSurabaya
Mesin Antrian 1 Loket wiraless,Rp11.899.000,,VETRONIKSemarang
Box Kiosk Mesin Antrian BPJS,Rp3.500.000,,Indotech Media VisionSemarang
Mesin Kiosk Kasir Mesin Antrian Touchscreen 21 inch SSD 128GB,Rp5.300.000,,Comzone OnlineJakarta Pusat
PACKING KAYU MESIN ANTRIAN,Rp400.000,5.014 terjual,ARTHASAVANADIGITALKab. Bekasi
mesin antrian p10 wireless,Rp2.200.000,2 terjual,Cipta Media TeknologiKab. Badung
Wireless Calling Receiver System LED Mesin Antrian Speaker - T114,Rp351.500,,BELIKIJakarta Barat
Mesin Antrian Wireless Multimedia Versi Portable,Rp7.500.000,,Sala3.NETSalatiga
tombol panggil mesin antrian (wireless),Rp300.000,5.020 terjual,Cipta Media TeknologiKab. Badung
MESIN ANTRIAN BEL CAFE RESTORAN 20 PAGER WIRELESS CALLING SYSTEM QUEUE ALARM 3 CALL MODE 200MAH - QC8200,Rp939.400,,Makmur SaputraBogor
Kabel Mesin Antrian,Rp10.000,5.030+ terjual,Sala3.NETSalatiga
Paket mesin antrian 3 loket dan printer,Rp2.250.000,5.01 terjual,LMbeautycare BandungCimahi
Pager Restaurant 10 Pager Mesin Antrian Wireless Calling System Restaurant Wireless Calling Restaurant Bel Wireless Restoran Pager Wireless Bel Mesin Panggil Restaurant Alarm Antrian Cafe Restoran Wireless Call Queue Paging System,Rp1.355.000Rp1.740.000,4 terjual,Abata Garden ToolsJakarta Barat
Mesin Antrian Restoran - 1 Transmitter / Charging Base - 20 Pager,Rp2.980.000,5.04 terjual,USUKMA-GROSIR-JKTJakarta Pusat
Wireless Calling System Receiver Pager Mesin Antrian BLACK,Rp68.500,,Dunia Home ApplianceBandung
Printer Thermal Mesin Antrian Best,Rp1.702.000,,DEPO DUTA PERKAKASJakarta Barat
Tambahan Display belakang mesin antrian,Rp900.000,5.04 terjual,Sala3.NETSalatiga
Mesin Antrian Wireless 3 Layanan (3 display ) dg printer Auto Cut,Rp8.000.000,1 terjual,Sala3.NETSalatiga
Mesin Antrian 20 Pager Wireless Calling System Restaurant  Caffee Re,Rp2.100.000Rp2.300.000,,tokoteknologiBandung
Wireless Calling System Receiver Pager Mesin Antrian 1 PCS 3 Mode Indikator Panggilan,Rp71.400Rp142.800,,Afika SmarthomeJakarta Barat
Controller kontroler Mesin antrian 1 loket,Rp500.000,5.04 terjual,QaytechCimahi
mesin antrian wireless TV androMedia,Rp250.000,5.07 terjual,Dunia DuinoBandung
Mesin antrian wireless 1 loket,Rp1.200.000,5.0100+ terjual,atmen storeKab. Temanggung
SOFTWARE APLIKASI MESIN ANTRIAN PERCETAKAN PRINTING,Rp1.299.000,,ArtNesia - Seni & Kerajinan KayuBandung
Kios K Mesin Antrian 19 Inch Touchscreen Display Camera dan Printer Inkjet,Rp17.850.000,,cv rdv indo printKab. Sumedang
Wireless Calling System Restaurant 16 Pager mesin antrian restoran,Rp1.246.405Rp1.550.800,5.010 terjual,EnggalTelasBekasi
RTKS Wireless Calling System Receiver Pager Mesin Antrian for CTP302,Rp69.900,,MinimusincBandung
Mesin nomor antrian 1 loket sederhana Wireless System,Rp950.000,1 terjual,LMbeautycare BandungCimahi
MESIN ANTRIAN FULL PEMASANGAN,Rp19.999.000,5.06 terjual,Bcompbiz Digital TeknologiBogor
Mesin Antrian 3 digit Dengan Voice dan Printer,Rp3.100.000,25 terjual,Sala3.NETSalatiga
Mesin antrian wireless 2 loket 1 tombol,Rp1.350.000,5.03 terjual,atmen storeKab. Temanggung
Bel Restoran Wireless 20 Nomor Antrian Wireless 20 Pager Wireless Mesin Antrian Queue Alarm Calling System Resto Cafe,Rp2.999.000Rp3.503.700,,Abata Garden ToolsJakarta Barat
Codeshop Kertas Thermal 80x150 mm Black Receipt Struk Mesin Antrian Parkir Bank Perkantoran,Rp74.000,,CODESHOP SURABAYA BARATSurabaya
Digital Signage 19 22 17 Inchi Mesin Antrian Custome Built In Touch,Rp45.999.999,,algotechJakarta Barat
Mesin Antrian 2 Layanan dengan display LED dan printer,Rp3.400.000,5.030+ terjual,Sala3.NETSalatiga
Wireless Calling System 16 Pager Bel Mesin Panggil Restaurant Mesin Antrian RTKS,Rp1.095.000,5.09 terjual,HomeGaleriiJakarta Barat
Wireless Calling System Restaurant Mesin Antrian 10 Pager - TD103,Rp2.273.300,,BELIKIJakarta Barat
Software Mesin Antrian Bank BRI,Rp3.500.000,5.01 terjual,atk semarangSemarang
Wireless Calling System Mesin Antrian Cafe Restoran 10Call Pager Alarm,Rp1.500.000,,Viracode OfficialSurabaya
"Mesin Panggil Antrian Restoran Cafe, 20 Pager Vibrate PROMICK CPS-T112",Rp2.950.000,5.01 terjual,MG ElektronikJakarta Pusat
Wireless Calling System Restaurant Mesin Antrian 10 Pager Hitam TD174 RETEKESS,Rp1.095.000,1 terjual,JLSMarketJakarta Barat
PAGER RESTORAN ANTRIAN WIRELESS 16 CALL MESIN ANTRIAN ALARM CAFE,Rp1.269.000,,ERA ELEKTRONIKA MANDIRIKab. Sleman
Iware Wireless Calling System Mesin Antrian Restauran Caffe Shop 10 Pager Alarm 3 Mode Q10M,Rp1.500.000Rp3.250.000,,TokoITOnlineSurabaya
Paket Mesin Antrian Basic,Rp20.600.000,5.01 terjual,Duta ITMVisionKab. Bogor
wireless calling system Mesin Antrian Cafe Restoran 20 16 10 channels,Rp1.899.000,,fathir-all shopBekasi
"Kiosk touchscreen 17"" mesin antrian anjungan terjangkau tanpa software",Rp9.449.000,6 terjual,Ologis Official StoreJakarta Selatan
Mesin antrian display 1 loket sederhana,Rp850.000,100+ terjual,atmen storeKab. Temanggung
"Mesin Antrian Puskesmas Kiosk touchscreen 17"" Terjangkau komplit",Rp17.760.000,8 terjual,Ologis Official StoreJakarta Selatan
Mesin antrian wireless 2 Loket logo,Rp2.600.000,5 terjual,atmen storeKab. Temanggung
"Mesin Antrian Kiosk touchscreen 17"" mesin antrian anjungan",Rp20.800.000,9 terjual,Ologis Official StoreJakarta Selatan
Mesin Antrian Touchscreen Digital 2 loket,Rp19.499.000,,VETRONIKSemarang
Wireless Calling System Receiver Pager Mesin Antrian  - TD157,Rp63.900,,Kilo BravoJakarta Barat
Wireless Calling System Restaurant Mesin Antrian 16 Pager (BLACK),Rp1.245.580,2 terjual,Berdikari Jaya 61Semarang
SOFTWARE APLIKASI MESIN ANTRIAN IMIGRASI,Rp1.420.000,,ArtNesia - Seni & Kerajinan KayuBandung
Box Mesin Antrian Casing Kiosk dengan Monitor Touchscreen 17 dan 19 in,Rp7.000.000,5.010 terjual,Ologis Official StoreJakarta Selatan
Mesin antrian wireless 2LED 4 Loket,Rp2.900.000,3 terjual,atmen storeKab. Temanggung
"Mesin Antrian Kantor Pajak Kiosk touchscreen 17"" Terjangkau komplit",Rp17.760.000,1 terjual,Ologis Official StoreJakarta Selatan
mesin antrian bank,Rp14.000.000,,cv rdv indo printKab. Sumedang
PAKET MESIN ANTRIAN RUMAH SAKIT/PUSKESMAS/KLINIK JKN BPJS,Rp12.890.000,,PROLABELSurabaya
"Kiosk Touchscreen 19"" Mesin Antrian Anjungan Mandiri Murah",Rp9.449.000,,Ologis Official StoreJakarta Selatan
Digital Signage 19 17 22 Inchi Mesin Antrian Custome Touch-Non-screen,Rp30.999.999,,SmartdisplayJakarta Barat
Kiosk Mesin Antrian Puskesmas Klinik RS 17 Inch,Rp12.500.000,5.01 terjual,BMSITSTORESemarang
READY STOCK Wireless Calling System Restaurant Mesin Antrian 16 Pager - CTP301,Rp1.347.000,,Mefrisss StoreKab. Bekasi
printer nomor mesin antrian autocutter,Rp1.700.000,5.012 terjual,atmen storeKab. Temanggung
mesin antrian multimedia pesanan pa Mar,Rp13.000.000,5.02 terjual,Dunia DuinoBandung
Mesin Antrian Restoran 1 Mesin 16 Pager praktis Harga paling Ekonomis,Rp1.490.000,5.030+ terjual,EtalaseBelanja StoreJakarta Pusat
Mesin Antrian Wireless V4 3 Layanan dengan printer Auto Cutter Stand,Rp6.900.000,5.01 terjual,Sala3.NETSalatiga
Mesin Antrian sederhana bel ting tong Next Call dan Recall,Rp650.000,5.040+ terjual,MAESTRO LEDSurabaya
RETEKESS Wireless Calling System Restaurant Mesin Antrian 20 Pager - T116,Rp1.482.900,1 terjual,DiBudgetinJakarta Barat
mesin antrian 2 loket 2 layanan non printer PAKET HEMAT,Rp1.750.000,5.01 terjual,Dunia DuinoBandung
PAKET MESIN ANTRIAN RS/KANTOR/PUSKESMAS/INSTANSI TOUCHSCREEN FREE APLIKASI BERGARANSI LANGSUNG KIRIM,Rp17.500.000,,PROLABELSurabaya
tombol panggil loket mesin antrian,Rp220.000,15 terjual,atmen storeKab. Temanggung
Wireless Calling System Restaurant Pager Mesin Antrian - Full Set,Rp1.316.500Rp1.880.600,1 terjual,Socko GrosirJakarta Barat
mesin antrian bank dll,Rp23.000.000,,cv rdv indo printKab. Sumedang
Pager Restoran Cafe Mesin Antrian Wireless Calling System 10 Channels - Hitam,Rp1.682.010Rp1.699.000,,CMAG storeJakarta Barat
Mesin antrian display 1 loket sederhana,Rp850.000,4.9100+ terjual,atmen storeKab. Temanggung
Mesin Antrian Bel Cafe Restoran 10 Pager Wireless Calling System Queue Alarm - T119,Rp1.841.200,,Buzper OfficialJakarta Barat
[KN AUDIO] BERKUALITAS WIRELESS CALLING QUEUE PAGING SYSTEM PAGER RESTORAN MESIN ANTRIAN 16 PAGER HITAM CTP302 RTKS,Rp1.799.000,,KN audioMedan
Mesin antrian 19 inch touchscreen,Rp10.200.000,,prima jaya komputer cctv & advertisingTasikmalaya
Printer Mesin Antrian Hig Speed Auto Cut,Rp2.700.000,,Genos_idJakarta Barat
Mesin Antrian Bel Cafe Restoran 16 Pager Wireless Calling System Queue Alarm - CTP301,Rp1.366.900,,Buzper OfficialJakarta Barat
Unit Pager Saja Buat Tambahan Mesin Antrian Restoran Promick CPS-T112,Rp150.000,5.021 terjual,USUKMA-GROSIR-JKTJakarta Pusat
MESIN ANTRIAN PUSKESMAS KLINIK JKN BPJS TIDAK TERMASUK TV,Rp16.000.000,,BCOMP MAKASSARMakassar
Tombol Mesin Antrian Sala3.Net,Rp300.000,4.925 terjual,Sala3.NETSalatiga
Mesin Antrian Wireless LED Full Color 2 Layanan,Rp4.200.000,5.01 terjual,Sala3.NETSalatiga
MESIN KASIR KIOSK POS STANDING SELF SERVICE | POSBANK KOREA BIGPOS TL2150,Rp42.400.000,,AGMTechJakarta Utara
MESIN ABSENSI A3,Rp49.000Rp239.000,23 terjual,Keissha ShopJakarta Timur
Wireless Calling System Pager Restaurant 10 Pager Pemanggil Antrian Pengunjung Alat Panggil Resto,Rp2.391.000,,Daily-MallTangerang
Pita / Tinta Mesin Absensi Krisbow MT-6100N,Rp70.000,250+ terjual,MSI KomputerJakarta Pusat
Pita / Tinta Mesin Absensi Krisbow MT6100,Rp70.000,12 terjual,MSI KomputerJakarta Pusat
Wireless Calling System Restaurant Mesin Antrian 20 Pager Merah TD163 RETEKESS,Rp2.495.000,,JLSMarketJakarta Barat
mesin antrian kiosk custom plat besi 160x45,Rp15.500.000,,Giliantz EnterpriseBandung
RTKS Set Mesin Antrian Wireless Calling System Cafe Bar Resto rumah Sakit Restauran 16 Pager - CTP301,Rp1.200.000Rp2.500.000,1 terjual,Kawthar_StoreIDJakarta Barat
Mesin Antrian Design Modern (Box Only),Rp3.850.000,5.01 terjual,PROLABELSurabaya
Bel Pemanggil Antrian Untuk Tamu Pelanggan Wireless Calling System Restaurant Mesin Antrian 16 Pager,Rp2.098.900,,katiyem shopJakarta Barat
Bel Panggil Mesin Antrian Call Waiting System Pager Paging Sistem,Rp1.525.000,5.05 terjual,MG ElektronikJakarta Pusat
Mesin Antrian Slim / Kiosk Antrian Slim / Mesin Antrian Mini,Rp9.000.000,5.01 terjual,ArtNesia - Seni & Kerajinan KayuBandung
Kertas Struk Thermal 80x140 mm 80x140mm Mesin Antrian Tiket Parkir,Rp78.000,10 terjual,Barcode Official StoreJakarta Pusat
mesin antrian anjungan kios lengkap,Rp26.600.000,2 terjual,zulpadli multi solusiSurabaya
Mesin Antrian Restoran 1 Mesin 16 Pager Praktis Harga Hemat TD157,Rp1.790.000,5.02 terjual,AUVICOMMJakarta Pusat
NEW MESIN ANTRIAN WIRELESS 1 LOKET [TERBARU[TERLARIS[ORIGINAL[ASLI],Rp2.160.000,,Toko Makmur Mart14Denpasar
KERTAS THERMALL ROLL OTANI 80X80 MM HITAM MESIN ANTRIAN TIKET PARKIR,Rp16.000,5.08 terjual,Gando StoreBandung
Mesin Antrian Wireless 2 Layanan 2 digit dengan printer,Rp3.300.000,5.02 terjual,Sala3.NETSalatiga
Wireless Calling Waiting System Mesin Antrian Restaurant Page Clinic,Rp2.753.100,,R-KingJakarta Barat
Jual Printer Antrian 2 lokot Nomor Mesin Antrian Limited,Rp1.645.800,5.0,"hidayatun, tokoSurabaya"
( 1 DUS ) KERTAS THERMAL 80 X 80 mm PRINTER MESIN ANTRIAN TIKET PARKIR,Rp915.000,1 terjual,Barcode Official StoreJakarta Pusat
Paket Mesin Antrian Basic,Rp15.000.000,2 terjual,ITMulticompBogor
Retekess TD158 Wireless Calling System Mesin Antrian Model Bulat Getar,Rp1.690.000,1 terjual,USUKMA-GROSIR-JKTJakarta Pusat
PAGER RESTORAN ANTRIAN WIRELESS 16 CALL MESIN ANTRIAN ALARM CAFE,Rp1.269.000,1 terjual,SMART STORE SOLUTIONKab. Sleman
Mesin Antrian Pager Restoran Resto Bell Wireless Call Queue System,Rp1.650.000Rp2.500.000,5.011 terjual,W goodsJakarta Barat
Mesin Antrian 2 Loket Wireless (tanpa kabel) + Display Loket,Rp11.330.000,5.06 terjual,LuminixSalatiga
Wireless Calling System Receiver Pager Mesin Antrian 1 PCS - CTP301,Rp66.640,,SlaluAdaStockJakarta Barat
Wireless Calling System Restaurant Pager Mesin Antrian,Rp1.316.500Rp1.880.600,5.01 terjual,Socko GrosirJakarta Barat
Stock Ready Box Mesin Antrian Casing Kiosk 17 Dan 19 In Terlaris,Rp4.409.000,,ALDIMEBBandung
"Khusus Hari Ini | Aplikasi Antrian Online, Softre Mesin Antrian Bank, Puskesmas, Dll",Rp4.425.000,,CV AkalapSurabaya
Mesin Antrian Bel Cafe Restoran 20 Pager Wireless Calling System Queue Alarm - SU68G,Rp2.391.800,,Buzper OfficialJakarta Barat
Mesin Antrian Bel Cafe Restoran Retekess 10 Pager Wireless Calling System Queue Alarm - TD159,Rp6.747.800,,Buzper OfficialJakarta Barat
Printer tiket mesin antrian Auto Cutter 6 tombol,Rp2.100.000,5.03 terjual,MAESTRO LEDSurabaya
Stock Ready Mesin Antrian Dua Digit Dengan Voice Terlaris,Rp3.544.000,,ALDIMEBBandung
Stock Ready Mesin Antrian Wireless Versi Basic Terlaris,Rp3.191.000,,ALDIMEBBandung
Mesin Antrian Bank BJB BRI Mandiri BNI BPR,Rp21.000.000,,BMSITSTORESemarang
Mesin Antrian 3 Digit Wireless 1 Layanan lengkap dg printer Auto Cut,Rp4.100.000,5.04 terjual,Sala3.NETSalatiga
"Kios antrian touchscreen 17"" mesin antrian promo",Rp9.200.000,,prima jaya komputer cctv & advertisingTasikmalaya
PAGER RESTORAN ANTRIAN WIRELESS 16 CALL MESIN ANTRIAN ALARM CAFE,Rp1.269.000,,Little Aster OfficialKab. Sleman
Wireless Calling System Restaurant Mesin Antrean 20 Pager Antrian Pengunjung,Rp2.450.000Rp3.500.000,5.02 terjual,WATCHFORYOU OfficialBandung
Mesin Antrian 3 Loket Wireless + Display Loket + Survey Kepuasan,Rp22.850.000,1 terjual,LuminixSalatiga
AMC Wireless Calling Paging System Mesin Antrian Food Court Restoran,Rp1.599.000,90+ terjual,amc_shopJakarta Utara
kiosk mesin antrian puskesmas klinik rumah sakit,Rp3.500.000,1 terjual,BMSITSTORESemarang
Mesin Antrian Puskesmas Sistem Aplikasi Puskesmas Terbaru,Rp9.990.000,,ArtNesia - Seni & Kerajinan KayuBandung
Wireless Calling System Restaurant Mesin Antrian 20 Pager,Rp3.846.500,,HomeProdukOnlineJakarta Utara
Mesin Antrian 1 Layanan Display LED dengan printer thermal Wireless,Rp3.100.000,5.050+ terjual,Sala3.NETSalatiga
lemari mesin antrian box kiosk display,Rp2.700.000,4.03 terjual,cv rdv indo printKab. Sumedang
Mesin Antrian Lengkap 4 Loket Murah,Rp39.050.000,,mesinantrianMalang
Calling System Resto Wireless 20 Antrian Wireless 3 Mode Panggilan 20 Pager Wireless Bel Restoran Wireless Alarm Cafe Restoran Queue Alarm Mesin Antrian,Rp3.785.000Rp4.502.750,,Abata Garden ToolsJakarta Barat
software mesin antrian 1 layanan,Rp100.000,,zulpadli multi solusiSurabaya
Wireless Calling System Restaurant Pager -  Mesin Antrian Alarm Cafe - 10 Pcs,Rp1.500.000Rp1.950.000,50+ terjual,Barcodia IndonesiaJakarta Pusat
Mesin Antrian Bundling 19 Inch,Rp30.000.000,1 terjual,BMSITSTORESemarang
Wireless Calling System Iware Q10 Mesin Antrian Cafe Restoran 10Call Pager Alarm isi 10 Pcs,Rp1.500.000Rp1.900.000,2 terjual,Barcodia IndonesiaJakarta Pusat
"Kiosk touchscreen 17"" mesin antrian anjungan murah promo terbatas",Rp9.449.000,30+ terjual,Ologis Official StoreJakarta Selatan
"CUSTOM BOX KIOSK, MESIN ANTRIAN, ANJUNGAN, DIGITAL SIGNAGE MURAH",Rp2.799.000,17 terjual,ARTHASAVANADIGITALKab. Bekasi
kiosk mesin antrian eletronik,Rp14.000.000,,Giliantz EnterpriseBandung
Calling System Restoran/Wireless Calling System Mesin Antrian Restoran,Rp6.841.330,,radinkayaJakarta Barat
Mesin antrian remote 2LED 2 Loket,Rp2.200.000,5.06 terjual,atmen storeKab. Temanggung
Wireless Calling System Restaurant Mesin Antrian 20 Pager,Rp4.497.320,,OnePortalJakarta Barat
Wireless Calling System Mesin Antrian Pager Alarm Restoran Cafe,Rp1.386.700Rp1.823.400,2 terjual,Socko GrosirJakarta Barat
RTKS Wireless Calling System Restaurant Mesin Antrian 10 Pager,Rp1.499.900,,TOSERBA BANDUNG ONLINESHOPBandung
MESIN ANTRIAN BPJS ONLINE PLUS SCANNER PLUS SOFTWARE BCOMPBIZ BASIC,Rp15.000.000,,BCOMP MAKASSARMakassar
Mesin Antrian Wireless Versi Basic,Rp2.645.000,,jayabaya tokoSurabaya
mesin nomor antrian,Rp1.269.900,,indahhh_shoppJakarta Pusat
Printer Antrian Mesin Antrian Versi 4 100% Original,Rp1.751.000,,Kuncung115Jakarta Barat
Retekess TD158 Wireless Guest Paging Calling System Mesin Antrian,Rp1.690.000,,USUKMA-GROSIR-JKTJakarta Pusat
Kiosk Mesin Antrian Puskesmas Klinik RS 17 Inch,Rp12.500.000,1 terjual,BMSITSTORESemarang
Mesin Antrian Multimedia Full Wireless dengan Display Signage 10 Loket,Rp35.500.000,2 terjual,LuminixSalatiga
Wireless Calling System Restaurant Mesin Antrian 30 Pager,Rp3.409.700,,HomeProdukOnlineJakarta Utara
Mesin Antrian Selfkiosk iMin Crane 32 inch dental printer 80 mm,Rp31.099.000,,iMin Official StoreJakarta Utara
Mesin Antrian 2 Digit Wireless Dengan Voice,Rp1.600.000,5.010 terjual,Sala3.NETSalatiga
Mesin Bel Antrian Restoran Pemanggil Customer Pelayan Rumah Sakit Cafe Wireless Calling System 10 Pager,Rp1.790.000Rp2.708.900,,CV PERKAKAS JAYAJakarta Barat
Mesin Antrian 3 Digit Wireless plus keypad,Rp2.300.000,5.07 terjual,Sala3.NETSalatiga
Mesin Antrian 20 Pager Wireless Calling System Restaurant,Rp2.490.000,,TAFFHOME STOREJakarta Barat
Printer Antrian Mesin Antrian Versi 4,Rp1.685.000,,Elektron Shop 11Surabaya
Mesin Panggilan Antrian Speaker Wireless Calling System LED Display,Rp601.100Rp1.320.000,,Maslinda StoreJakarta Barat
Mesin Antrian 2 Digit Wireless Dengan Voice Tombol Keypad,Rp1.800.000,5.02 terjual,Sala3.NETSalatiga
Mesin Antrian Wireless Bel Cafe Restoran 20 Pager Calling System Queue Alarm - TD167F,Rp3.834.500,5.01 terjual,Buzper OfficialJakarta Barat
Speaker untuk mesin antrian,Rp600.000,5.03 terjual,QaytechCimahi
Printer tiket mesin antrian Auto Cutter,Rp1.950.000,5.020 terjual,MAESTRO LEDSurabaya
Wireless Calling System Restaurant Mesin Antrian 16 Pager,Rp1.512.000Rp1.890.000,,HomeProdukOnlineJakarta Utara
Mesin Antrian 19 Inch,Rp12.000.000,1 terjual,BMSITSTORESemarang
Mesin Antrian System / Antrian Mesin System,Rp2.875.000,60+ terjual,touchindoJakarta Utara
Wireless Calling System Mesin Antrian Cafe Restoran Termurah Terlaris,Rp1.290.000,250+ terjual,EtalaseBelanja StoreJakarta Pusat
Kios K Mesin Antrian Digital 19 Inch Touchscreen Display,Rp13.380.000,,BMSITSTORESemarang
Wireless Calling System Restaurant Mesin Antrian 20 Pager,Rp1.825.000,,BaserbaJKTJakarta Barat
Mesin Antrian LED dengan Loket dan Custom Tampilan,Rp4.500.000,5.05 terjual,Sala3.NETSalatiga
Mesin Antrian 2 Digit Wireless Dengan Voice dan Printer Auto Cutter,Rp3.600.000,5.013 terjual,Sala3.NETSalatiga
RETEKESS Wireless Calling System Restaurant Mesin Antrian 10 Pager - TD158,Rp1.256.900,,DiBudgetinJakarta Barat
Mesin Antrian Puskesmas Wanaraja,Rp1.800.000,5.06 terjual,avelektroKab. Malang
Wireless Calling System Restaurant Mesin Antrian 20 Pager Cokelat T116 RETEKESS,Rp1.475.000,,JLSMarketJakarta Barat
Printer Thermal Mesin Antrian,Rp1.829.817,,Belanjaku_SiniDepok
Mesin Antrian Wireless 3 Layanan 2 digit dengan printer,Rp3.600.000,5.01 terjual,Sala3.NETSalatiga
RETEKESS Smart Box Wireless Calling System Mesin Antrian 20 Pager - TD167S,Rp917.900,,DiBudgetinJakarta Barat
Pager Mesin Antrian Restaurant Wireless Calling System Receiver,Rp79.999,,OnePortalJakarta Barat
PAKET MESIN ANTRIAN PELAYANAN PUBLIK PAKET KHUSUS,Rp16.000.000,,BCOMP MAKASSARMakassar
Kios K Mesin Antrian Klinik/Puskesmas BPJS,Rp12.300.000,,BMSITSTORESemarang
Mesin Antrian Sistem AMQS VER. 6,Rp7.500.000,,Intermedia Safety CenterManado
Mesin Antrian P10 sederhana bel ting tong Next Call dan Recall,Rp725.000,5.04 terjual,MAESTRO LEDSurabaya
1 DUS - KERTAS THERMAL OTANI 80 X 80 BLACK MESIN ANTRIAN TIKET PARKIR,Rp710.000,5.01 terjual,CODESHOP SURABAYA TIMURSurabaya
Wireless Calling System Restaurant Mesin Antrian 20 Pager - TD163,Rp2.499.400,,BELIKIJakarta Barat
Wireless Calling System Restaurant Mesin Antrian 10 Pager - TD174,Rp1.029.900,,KasiSolusiJakarta Barat
Wireless Calling System Restaurant Mesin Antrian 20 Pager - TD163,Rp2.499.500,,KasiSolusiJakarta Barat
Wireless Calling System Restaurant Mesin Antrian 10 Pager - TD164,Rp1.142.900,,KasiSolusiJakarta Barat
Mesin Antrian Restoran cafe TD157 Popular Wireless Guest Paging System,Rp1.490.000,5.08 terjual,MG ElektronikJakarta Pusat
PAGER ANTRIAN RESTORAN WIRELESS 16 CALL MESIN ANTRIAN ALARM CAFE,Rp1.269.000,,PrinterIndonesiaKab. Sleman
Kertas Thermal Roll Otani 80 X 80 Mm Hitam Mesin Antrian Tiket Parkir Tbk,Rp98.000,,Merry_ChristmasKab. Badung
Wireless Calling System Restaurant Mesin Antrian 10 Pager - TD174,Rp1.029.800,,BELIKIJakarta Barat
Wireless Calling System Restaurant Mesin Antrian 10 Pager - TD164,Rp1.142.800,,BELIKIJakarta Barat
Wireless Calling System Restaurant Mesin Antrian 16 Pager,Rp1.369.900,,Upin Ipin MallJakarta Barat
Wireless Calling System Restaurant Mesin Antrian 16 Pager - TD175,Rp1.029.900,,KasiSolusiJakarta Barat
Paket mesin antrian + 2 tombol panggil + printer tiket,Rp5.200.000,5.08 terjual,Cipta Media TeknologiKab. Badung
RTKS Wireless Calling System Restaurant Mesin Antrian 20 Pager -,Rp1.921.239,,klik niagaJakarta Barat
Mesin Antrian Bel Cafe Restoran 10 Pager Wireless Calling System Queue Alarm 3 Call Mode 200mAh - LFTZ44,Rp1.711.900,,DuboraJakarta Barat
Mesin Antrian Bank 17inch custom design,Rp23.000.000,,rdvindoprintBekasi
"BISA SPK! Kiosk touchscreen 17"" mesin antrian anjungan terjangkau tanpa software",Rp18.300.640,,carramel pediaYogyakarta
Wireless Calling System Restaurant Mesin Antrian 20 Pager - T111,Rp1.595.100,,KasiSolusiJakarta Barat
Wireless Calling System Restaurant Mesin Antrian 20 Pager - TD183,Rp2.688.200,,KasiSolusiJakarta Barat
Wireless Calling System Restaurant Mesin Antrian 10 Pager - TD177,Rp1.256.000,,KasiSolusiJakarta Barat
RTKS Wireless Calling System Receiver Pager Mesin Antrian 1 PCS - LFTZ44,Rp144.860,,TAFFHOME STOREJakarta Barat
Wireless Calling System Restaurant Rumah Makan Mesin Antrian Panggil 10 Pcs Pager,Rp1.950.000Rp2.932.500,,HomeProdukOnlineJakarta Utara
MESIN ANTRIAN TOMBOL,Rp15.000.000,,BMSITSTORESemarang
printer karcis nomor mesin antrian custom,Rp1.100.000,30+ terjual,atmen storeKab. Temanggung
Kios K Mesin Antrian Klinik/Puskesmas BPJS,Rp12.300.000,,BMSITSTORESemarang
Mesin Antrian System Satpas SIM Custom,Rp55.000.000,,Shareefa_JA GaleryDepok
MESIN ANTRIAN SEKOLAH 17 INCH TOUCHSCREEN,Rp14.900.000,,BMSITSTORESemarang
Wireless Calling System Restaurant Pager - Mesin Antrian Alarm Cafe - RP02A,Rp2.499.000,30+ terjual,axelposJakarta Pusat
Mesin Antrian Kios K BPJS,Rp21.500.000,,BMSITSTORESemarang
Kios K Mesin Antrian Double Printer + TAP NFC,Rp23.000.000,,banking equipmentSemarang
