Produk,Harga,Sold,Nama Toko
AMC Wireless Calling Paging System Mesin Antrian Food Court Restoran,Rp1.599.000,90+ terjual,amc_shopJakarta Utara
Mesin Antrian 3 Loket Wireless + Display Loket + Survey Kepuasan,Rp22.850.000,1 terjual,LuminixSalatiga
kiosk mesin antrian puskesmas klinik rumah sakit,Rp3.500.000,1 terjual,BMSITSTORESemarang
Mesin Antrian Puskesmas Sistem Aplikasi Puskesmas Terbaru,Rp9.990.000,,ArtNesia - Seni & Kerajinan KayuBandung
Wireless Calling System Restaurant Mesin Antrian 20 Pager,Rp3.846.500,,HomeProdukOnlineJakarta Utara
Printer Antrian Mesin Antrian Versi 4,Rp1.100.000,4.990+ terjual,Sala3.NETSalatiga
Wireless Calling System Restaurant Mesin Antrian 16 Pager - CTP301,Rp1.020.400,5.0100+ terjual,DiBudgetinJakarta Barat
Wireless Calling System Restaurant Mesin Panggil Antrian 16 Pager Queue Bell Call Alarm Bel Cafe Restoran,Rp1.095.000,4.9250+ terjual,GadgetSpeakerTangerang Selatan
Mesin Antrian Bel Cafe Restoran 20 Pager Wireless Calling System Queue Alarm 3 Call Mode 200mAh - QC8200,Rp73.500,5.01 terjual,DuboraJakarta Barat
Wireless Calling System Restaurant Pager -  Mesin Antrian Alarm Cafe,Rp1.500.000Rp1.950.000,4.650+ terjual,Barcodia IndonesiaJakarta Pusat
Wireless Calling System Restaurant Pager -  Mesin Antrian Alarm Cafe - 10 Pcs,Rp1.500.000Rp1.950.000,50+ terjual,Barcodia IndonesiaJakarta Pusat
Mesin Antrian Bundling 19 Inch,Rp30.000.000,1 terjual,BMSITSTORESemarang
Wireless Calling System Iware Q10 Mesin Antrian Cafe Restoran 10Call Pager Alarm isi 10 Pcs,Rp1.500.000Rp1.900.000,2 terjual,Barcodia IndonesiaJakarta Pusat
"Kiosk touchscreen 17"" mesin antrian anjungan murah promo terbatas",Rp9.449.000,30+ terjual,Ologis Official StoreJakarta Selatan
"CUSTOM BOX KIOSK, MESIN ANTRIAN, ANJUNGAN, DIGITAL SIGNAGE MURAH",Rp2.799.000,17 terjual,ARTHASAVANADIGITALKab. Bekasi
KERTAS THERMAL ROLL OTANI 80 X 80 MM ( BIRU ) - MESIN ANTRIAN & PARKIR,Rp12.700,4.9250+ terjual,Barcode Official StoreJakarta Pusat
Mesin Antrian Wireless Versi Basic,Rp1.099.000,5.030+ terjual,Sala3.NETSalatiga
"Software Antrian, Mesin Antrian Terbaru Support Webcam",Rp1.440.000Rp1.800.000,5.06 terjual,ArtNesia - Seni & Kerajinan KayuBandung
( 1 DUS ) KERTAS THERMAL OTANI 80 X 80 ( BIRU ) MESIN ANTRIAN & PARKIR,Rp750.000,5.027 terjual,Barcode Official StoreJakarta Pusat
PAKET MESIN ANTRIAN TOUCHSCREEN PAKET BASIC,Rp15.999.000,5.050+ terjual,Bcompbiz Digital TeknologiBogor
Wireless Calling System Restaurant Mesin Antrian 20 Pager - RTKS SU-68G,Rp1.750.100,5.013 terjual,DiBudgetinJakarta Barat
KERTAS THERMAL ROLL OTANI 80 X 80 MM HITAM MESIN ANTRIAN TIKET PARKIR,Rp12.700,4.910rb+ terjual,Barcode Official StoreJakarta Pusat
Mesin Antrian Dua Digit dengan Voice,Rp1.600.000,5.011 terjual,Sala3.NETSalatiga
Bell Alarm Wireless Calling Restaurant Mesin Antrian 11 Pager SU-668,Rp1.799.000,4.727 terjual,Astra FotoJakarta Pusat
Mesin Antrian Wireless 2 Digit Full Set dengan voice dan printer,Rp2.600.000,4.830+ terjual,Sala3.NETSalatiga
Retekess TD158 Wireless Guest Paging Calling System Mesin Antrian,Rp1.690.000,,USUKMA-GROSIR-JKTJakarta Pusat
Kiosk Mesin Antrian Puskesmas Klinik RS 17 Inch,Rp12.500.000,1 terjual,BMSITSTORESemarang
Mesin Antrian Multimedia Full Wireless dengan Display Signage 10 Loket,Rp35.500.000,2 terjual,LuminixSalatiga
Wireless Calling System Restaurant Mesin Antrian 30 Pager,Rp3.409.700,,HomeProdukOnlineJakarta Utara
Mesin Antrian Selfkiosk iMin Crane 32 inch dental printer 80 mm,Rp31.099.000,,iMin Official StoreJakarta Utara
Wireless Calling System Receiver Pager Mesin Antrian 1 PCS - CTP301,Rp62.800,4.940+ terjual,DiBudgetinJakarta Barat
Box Mesin Antrian Casing Kiosk 17 dan 19 in,Rp2.699.000,5.017 terjual,Ologis Industri CoatingKab. Bogor
Printer Thermal Mesin Antrian,Rp1.180.000,4.9100+ terjual,Sala3.NETSalatiga
Wireless Calling System Restaurant Pager - Mesin Antrian Alarm Cafe,Rp2.499.000,4.930+ terjual,axelposSurabaya
Mesin antrian 1 loket tanpa printer Wireless Qaytech,Rp950.000,4.990+ terjual,QaytechCimahi
MESIN ANTRIAN BPJS ONLINE PLUS SCANNER PLUS SOFTWARE BCOMPBIZ BASIC,Rp13.999.000,5.011 terjual,Bcompbiz Digital TeknologiBogor
Iware Wireless Calling System Mesin Antrian Restauran Caffe Shop 10 Pager Alarm 3 Mode Q10M,Rp1.500.000Rp2.000.000,,Iware Official Store
Mesin antrian semarang,Rp4.500.000,5.01 terjual,banking equipmentSemarang
Pager Antrian 10/16 Units Wireless Calling System Restaurant Mesin Antrian 10/16 Pager 100% ORI [EasySeller],Rp899.000,4 terjual,Easy Seller IDJakarta Barat
Wireless Calling System Restaurant Mesin Antrian Restoran 16 Pager Cafe,Rp969.000,5.02 terjual,Doge ShopJakarta Pusat
Wireless Calling System Restaurant Mesin Antrian 16 Pager,Rp1.512.000Rp1.890.000,,HomeProdukOnlineJakarta Utara
Mesin Antrian System / Antrian Mesin System,Rp2.875.000,60+ terjual,touchindoJakarta Utara
Mesin Antrian 19 Inch,Rp12.000.000,1 terjual,BMSITSTORESemarang
Wireless Calling System Mesin Antrian Cafe Restoran Termurah Terlaris,Rp1.290.000,250+ terjual,EtalaseBelanja StoreJakarta Pusat
Kios K Mesin Antrian Digital 19 Inch Touchscreen Display,Rp13.380.000,,BMSITSTORESemarang
AMC Additinal Pager Wireless Calling Paging System Mesin Antrian Food Court Restoran,Rp100.000,5.015 terjual,amc_shopJakarta Utara
"CUSTOM BOX KIOSK, MESIN ANTRIAN, ANJUNGAN, DIGITAL SIGNAGE MURAH",Rp2.799.000,5.017 terjual,ARTHASAVANADIGITALKab. Bekasi
KERTAS ROLL THERMAL 80 X 140 - 80X140 MM | MESIN ANTRIAN TIKET PARKIR,Rp78.000,4.8100+ terjual,Barcode Official StoreJakarta Pusat
Mesin Antrian 1 loket voice announcer Next Call dan Recall,Rp690.000,5.070+ terjual,MAESTRO LEDSurabaya
Wireless Calling System Restaurant Restoran Cafe Alat Mesin Antrian,Rp1.050.000,5.015 terjual,aksesoris-iPhoneBandung
"MESIN ANTRIAN, APLIKASI MESIN ANTRIAN LENGKAP",Rp2.000.000,,sala3-collectionKab. Bogor
1 DUS - KERTAS THERMAL OTANI 80 X 80 HITAM MESIN ANTRIAN TIKET PARKIR,Rp750.000,4.960+ terjual,Barcode Official StoreJakarta Pusat
Mesin Antrian Alarm Antrian Kasir Wireless Calling System Restaurant Mesin Antrian 16 Pager - CTP301 - Black,Rp1.223.320Rp1.799.000,5.013 terjual,tokoteknologiBandung
Mesin Antrian Restoran - Retekess TD157 - 1 Mesin 16 Pager,Rp1.490.000,5.090+ terjual,SG ElektronikJakarta Pusat
kiosk mesin antrian puskesmas klinik rumah sakit,Rp3.500.000,1 terjual,BMSITSTORESemarang
Printer Tiket Antrian Mesin Karcis Antrian Mesin Antrian,Rp1.099.000,5.05 terjual,TentronikSurabaya
Mesin Antrian OLOGIS Kiosk Anjungan Touchscreen Tipe Minimalis,Rp8.749.000,5.01 terjual,Ologis Official StoreJakarta Selatan
Bel Alarm Meja Restoran Mesin Antrian Wireless Bell Calling System Restaurant Receiver Pager (1 PCS),Rp77.300,,Ghani Gadget StoreJakarta Barat
Mesin Antrian Sistem Antrian Sederhana Android,Rp800.000,5.026 terjual,SAHITRONBandung
Mesin Antrian Voice Announcer Lengkap Keypad + Speaker,Rp1.100.000,5.014 terjual,MAESTRO LEDSurabaya
Wireless Calling System Restaurant Mesin Antrian Cafe Restoran Pager Alarm Panggil Customer,Rp1.450.000Rp2.000.000,1 terjual,WATCHFORYOU OfficialBandung
"Kiosk touchscreen 17"" mesin antrian anjungan murah promo terbatas",Rp9.449.000,4.830+ terjual,Ologis Official StoreJakarta Selatan
Controller Mesin Antrian Voice Announcer + Keypad,Rp570.000,5.01 terjual,MAESTRO LEDSurabaya
KIOSK ANJUNGAN MESIN ANTRIAN TERBARU BERKUALITAS 24 INCI,Rp6.600.000,1 terjual,Kios BarcodeBekasi
"Mesin Antrian Kiosk Touchscreen 19"" Terjangkau",Rp10.449.000,5.02 terjual,Ologis Official StoreJakarta Selatan
20Call Mesin Antrian Wireless pager System Utk Alarm restoran/cafe,Rp2.499.000,5.06 terjual,Barcodia IndonesiaJakarta Pusat
Mesin Antrian Multimedia Full Wireless Simple dan PowerFull,Rp6.500.000,5.018 terjual,Sala3.NETSalatiga
mesin nomor antrian,Rp999.888,4.9100+ terjual,Aneka Led KomponenKab. Brebes
Tombol Mesin Antrian Versi 3 Sala3NET Wireless,Rp500.000,5.022 terjual,Sala3.NETSalatiga
"Mesin Antrian murah WIRELESS, 1 layanan, bersuara",Rp800.000,5.03 terjual,Cipta Media TeknologiKab. Badung
Wireless Calling System LED Display Mesin Antrian Restoran Speaker - C34 Pro,Rp350.900,5.08 terjual,DiBudgetinJakarta Barat
Wireless Calling System Mesin Antrian Cafe Restoran Termurah Terlaris,Rp1.290.000,5.0250+ terjual,EtalaseBelanja StoreJakarta Pusat
Mesin Antrian / Printer KIOSK / anjungan / Tiket Antrian,Rp898.000,5.012 terjual,SEKTOR LEDTangerang Selatan
Alarm Cafe Wireless Calling Restaurant Mesin Antrian 20 Pager SU-68G,Rp1.850.000,5.02 terjual,Astra FotoJakarta Pusat
Mesin Pemanggil Antrian Customer Calling System SU68Z Isi 20 Remote,Rp2.083.000Rp2.240.000,5.04 terjual,Smart ProductTangerang
printer karcis nomor mesin antrian custom,Rp1.100.000,5.030+ terjual,atmen storeKab. Temanggung
Mesin Pemanggil Antrian Loket Wireless LED Display 3 FULLSET Speaker Calling System,Rp765.000,,SHOP PUTULBekasi
paket lengkap Mesin Antrian 19 inch Rumah Sakit,Rp45.000.000,,Aditya Display AbadiKab. Tangerang
"Mesin Antrian Online BPJS, Consolebox antrian BPJS",Rp14.000.000,5.02 terjual,Hidayat4DZMedan
mesin antrian touchscreen,Rp7.000.000,,id computer banyuwangiKab. Banyuwangi
Wireless Calling System Restaurant Rumah Makan Mesin Antrian Panggil 10 Pcs Pager,Rp1.950.000Rp2.932.500,,HomeProdukOnlineJakarta Utara
MESIN ANTRIAN TOMBOL,Rp15.000.000,,BMSITSTORESemarang
printer karcis nomor mesin antrian custom,Rp1.100.000,30+ terjual,atmen storeKab. Temanggung
Kios K Mesin Antrian Klinik/Puskesmas BPJS,Rp12.300.000,,BMSITSTORESemarang
Mesin Antrian System Satpas SIM Custom,Rp55.000.000,,Shareefa_JA GaleryDepok
MESIN ANTRIAN SEKOLAH 17 INCH TOUCHSCREEN,Rp14.900.000,,BMSITSTORESemarang
Wireless Calling System Restaurant Pager - Mesin Antrian Alarm Cafe - RP02A,Rp2.499.000,30+ terjual,axelposJakarta Pusat
Mesin Antrian Kios K BPJS,Rp21.500.000,,BMSITSTORESemarang
Kios K Mesin Antrian Double Printer + TAP NFC,Rp23.000.000,,banking equipmentSemarang
MESIN ANTRIAN ONLINE BANKING ALL IN,Rp35.000.000,,BMSITSTORESemarang
"Wireless Calling System Restaurant Mesin Antrian 20 Pager/10 Pager Enkoder Learning Coding (AM) Buzzer, Flash, dan Vibration",Rp1.497.544,5.01 terjual,Tas VisionJakarta Barat
MESIN ANTRIAN PUSKESMAS KLINIK JKN BPJS TIDAK TERMASUK TV,Rp12.990.000,4.813 terjual,Bcompbiz Digital TeknologiBogor
Mesin Antrian 3 Digit Wireless 1 Layanan dengan voice,Rp2.200.000,5.020 terjual,Sala3.NETSalatiga
Box mesin Antrian BPJS,Rp3.500.000,,Indotech Media VisionSemarang
Mesin Antrian Multimedia Full Wireless dengan Display Signage 10 Loket,Rp35.500.000,2 terjual,LuminixSalatiga
Wireless Calling System Restaurant Mesin Panggil Antrian 10 Pcs Pager,Rp5.612.700,,HomeProdukOnlineJakarta Utara
MESIN ANTRIAN PELAYANAN CUSTOM DESIGN,Rp25.000.000,,BMSITSTORESemarang
16In1 Wireless Calling System Restaurant Pager Mesin Antrian Restoran,Rp1.388.000,6 terjual,Momen HatiTangerang
MESIN ANTRIAN PELAYANAN DAN SOFTWARE CUSTOM,Rp17.500.000,,BMSITSTORESemarang
Wireless Calling System Restaurant Pager - Mesin Antrian Alarm Cafe Iware Q10M,Rp1.500.000Rp2.000.000,,axelposJakarta Pusat
Tombol Mesin Antrian Versi 3 Full Wireless Terbaru,Rp755.000,,Active toko agung best official 9Jakarta Selatan
Pager Mesin Antrian Wireless Calling System Receiver - CTP302,Rp64.000,,WarunkNgonlineJakarta Barat
PAKET MESIN ANTRIAN PELAYANAN PUBLIK PAKET KHUSUS,Rp13.999.000,5.010 terjual,Bcompbiz Digital TeknologiBogor
Printer Mesin Antrian Auto Cut High Speed Versi 2 Sala3.NET,Rp2.300.000,5.040+ terjual,Sala3.NETSalatiga
Mesin Antrian Bank Bri,Rp26.000.000,,Indotech Media VisionSemarang
"Mesin Antrian Murah Touchscreen 17"" Anjungan Mandiri Promo Terbatas",Rp9.449.000,4.818 terjual,Ologis Official StoreJakarta Selatan
Mesin Antrian Restoran Wireless Calling System 10 16 18 20 30 Pager Call Bel Panggil Kasir Cafe Jarak Jauh,Rp1.451.200,1 terjual,LARYZ STOREJakarta Barat
RTKS Wireless Calling System Receiver Pager Mesin Antrian - CTP302,Rp80.000,,Astra FotoJakarta Pusat
"Mesin Antrian Puskesmas Kiosk Touchscreen 17""Komplit",Rp24.865.000,,amayatokoTangerang
"Aplikasi Antrian Online, Software Mesin Antrian Bank, Puskesmas, dll",Rp2.400.000Rp3.000.000,5.014 terjual,ArtNesia - Seni & Kerajinan KayuBandung
Mesin Antrian Puskesmas 19 Inch,Rp12.000.000,1 terjual,BMSITSTORESemarang
"Mesin Antrian Murah Touchscreen 17"" Anjungan Mandiri Promo Terbatas",Rp9.449.000,18 terjual,Ologis Official StoreJakarta Selatan
MESIN ANTRIAN BANK  DAN SOFTWARE CUSTOM,Rp15.000.000,,BMSITSTORESemarang
Wireless Calling System Restaurant Mesin Antrian 10 Pager,Rp2.654.300,,HomeProdukOnlineJakarta Utara
Standing Box Kios K Mesin Antrian,Rp3.200.000,1 terjual,BMSITSTORESemarang
KERTAS THERMAL ROLL OTANI 80 X 65 M HITAM MESIN ANTRIAN TIKET PARKIR,Rp12.700,5.060+ terjual,Barcode Official StoreJakarta Pusat
Mesin Antrian Selfkiosk iMin Crane 32 inch dental printer 80 mm,Rp31.099.000,,iMin Official StoreJakarta Utara
SOFTWARE MESIN ANTRIAN CUSTOM UNLIMITED,Rp500.000,5.06 terjual,kutauyangkumauKab. Sumedang
16Call Mesin Antrian Wireless calling System Pager Alarm restoran/cafe,Rp1.299.000,4.9100+ terjual,FunToys711Cimahi
Wireless Calling System Iware Q10 Mesin Antrian Cafe Restoran 10Call Pager Alarm isi 10 Pcs,Rp1.500.000Rp1.900.000,5.02 terjual,Barcodia IndonesiaJakarta Pusat
Mesin Antrian Touchscreen WaitMate (Sudah Termasuk Pajak),Rp29.970.000,,WaitHub (Formerly AntriQue)Bandung
mesin antrian - nomor antrian multimedia hemat,Rp2.000.000,5.02 terjual,Dunia DuinoBandung
PAKET MESIN ANTRIAN TOUCHSCREEN BEST SELLER,Rp9.250.000,,prima jaya komputer cctv & advertisingTasikmalaya
Printer Tiket Antrian Mesin Karcis Antrian Mesin Antrian Auto Cutter,Rp2.099.000,5.03 terjual,TentronikSurabaya
Iware Pager Wireless Calling System Mesin Antrian Restauran Caffe Shop 10 Pager Alarm 3 Mode Q10M,Rp1.500.000,1 terjual,astikomDenpasar
Mesin Antrian Rumah Sakit Paket BPJS,Rp19.500.000,,banking equipmentSemarang
MESIN ANTRIAN MINI MODEL TOMBOL SEMI MULTIMEDIA,Rp11.500.000,,BMSITSTORESemarang
Wireless Calling System Restaurant Mesin Antrian 10 Pcs Pager,Rp2.551.500,,HomeProdukOnlineJakarta Utara
Mesin Antrian Bpjs 17 Inch Computer,Rp13.000.000,,BMSITSTORESemarang
Mesin Antrian Bel Cafe Restoran 20 Pager Wireless Calling System Queue Alarm - SU68G,Rp2.391.800,,Buzper OfficialJakarta Barat
Pager Mesin Antrian Receiver Bel Cafe Restoran Wireless Calling Queuing System - SU668,Rp195.800,,Buzper OfficialJakarta Barat
Wireless Calling Call Waiting System Restaurant Mesin Tunggu Antrian Bel Panggil Customer Pembeli Pengunjung Restoran Cafe Toko Kantor Bank Rumah Makan 16 Pager,Rp1.350.000Rp1.605.500,5.03 terjual,IstoreproJakarta Barat
Retekess TD158 Wireless Guest Paging Calling System Mesin Antrian,Rp1.690.000,5.01 terjual,MG ElektronikJakarta Pusat
RETEKESS Wireless Calling System Restaurant Mesin Antrian 20 Pager - TD172,Rp1.369.900,,DiBudgetinJakarta Barat
Mesin Antrian 1 loket Wireless bel ting tong,Rp1.100.000,5.021 terjual,MAESTRO LEDSurabaya
box mesin antrian,Rp6.050.000,4.53 terjual,banking equipmentSemarang
Kontrol Mesin Antrian Custom,Rp600.000,,romtechKab. Kebumen
box mesin antrian,Rp3.000.000,4.01 terjual,atk semarangSemarang
Mesin Antrian Wireless dengan printer auto cut,Rp4.500.000,4.921 terjual,Sala3.NETSalatiga
Mesin Antrian Puskesmas 19 Inch,Rp12.000.000,5.01 terjual,BMSITSTORESemarang
Iware Wireless Calling System Mesin Antrian Restauran Caffe Shop 10 Pager Alarm 3 Mode Q10M,Rp1.450.000Rp3.250.000,5.02 terjual,AUTO BARCODESurabaya
Mesin Antrian 4 Loket Full Wireless dengan Printer auto Cutter,Rp5.400.000,5.04 terjual,Sala3.NETSalatiga
Stock Ready Printer Antrian Mesin Antrian Versi 4 Terlaris,Rp1.698.000,,ALDIMEBBandung
Mesin Antrian Bel Cafe Restoran 16 Pager Wireless Calling System Queue Alarm 3 Call Mode 250mAh - CTP301,Rp1.464.700,,DuboraJakarta Barat
Mesin Antrian Puskesmas 1 Layanan,Rp10.500.000,5.05 terjual,avelektroKab. Malang
Wireless Calling System Receiver Pager 1 PCS Mesin Antrian for CTP302 - TD157,Rp64.000,2 terjual,DiBudgetinJakarta Barat
Mesin antrian Multi loket tanpa printer Wireless Qaytech,Rp1.150.000,5.03 terjual,QaytechCimahi
KERTAS THERMAL ROLL CODESHOP 80 X 80 MM HITAM MESIN ANTRIAN PARKIR,Rp15.000,5.04 terjual,CODESHOP SURABAYA TIMURSurabaya
MESIN ANTRIAN BANK WIRELESS BUTTON,Rp18.000.000,5.04 terjual,ITMulticompBogor
"Mesin Antrian Kiosk touchscreen 19"" Terjangkau Komplit",Rp21.000.000,5.011 terjual,Ologis Official StoreJakarta Selatan
Iware Q10M Wireless Calling System Mesin Antrian Restauran Cafe Shop 10 Pager Alarm 3 Mode Q10M,Rp1.450.000Rp3.365.000,,MALANG POSMalang
Tombol Mesin Antrian Sala3.Net include baterai,Rp400.000,5.017 terjual,Sala3.NETSalatiga
Calling System Restaurant Wireless Pager Mesin Antrian Alarm Cafe shop,Rp2.499.000,5.030+ terjual,Iware Official StoreSurabaya
Paket Mesin antrian 1 loket Wireless QAYTECH,Rp1.950.000,5.019 terjual,QaytechCimahi
KERTAS ROLL THERMAL OTANI 80X140 MM - MESIN ANTRIAN UNTUK MESIN ATM,Rp57.000,4.940+ terjual,CODESHOP SURABAYA BARATSurabaya
kiosk mesin antrian core i3,Rp12.500.000,4.810 terjual,ITMulticompBogor
Wireless Calling System Receiver Pager Panggilan Mesin Antrian Kasir Pemanggil 1 PCS - Taffware RTKS LFTZ44,Rp77.900,,BudgetGadgetJakarta Barat
"Kiosk touchscreen 17"" mesin antrian anjungan terjangkau tanpa software",Rp9.449.000,5.06 terjual,Ologis Official StoreJakarta Selatan
Wireless Calling System Restaurant Rumah Makan Mesin Antrian Panggil 10 Pcs Pager Set,Rp2.050.000Rp2.932.500,1 terjual,HomeProdukOnlineJakarta Utara
Kios K Mesin Antrian Digital 24 inch Touchscreen Display Model Potrait,Rp22.990.000,,rdvindoprintBekasi
Wireless Calling System Receiver Pager Bell Mesin Antrian Bel Alarm Meja Restoran (1 PCS),Rp95.100,,Ghani Gadget StoreJakarta Barat
Wireless Calling System Restaurant Mesin Antrian 10 Pager RETEKESS T116A,Rp1.450.000,2 terjual,K.T SHOPSurabaya
Wireless Calling System LED Display Mesin Antrian Speaker - C34 Pro,Rp465.500,,importermurahJakarta Barat
KERTAS ROLL THERMAL 80 X 140 - 80X140 MM | MESIN ANTRIAN TIKET PARKIR,Rp57.000,5.02 terjual,CODESHOP SURABAYA BARATSurabaya
Custom scoreboard | mesin antrian | led display,Rp1.600.000,4.023 terjual,QaytechCimahi
KIOS K MESIN ANTRIAN BPJS LENGKAP,Rp13.500.000,,BMSITSTORESemarang
Display Mesin Antrian Otomatis 7 Segment,Rp2.400.000,,prima electronicJakarta Barat
Mesin Antrian Rumah Sakit BPJS,Rp13.900.000,,BMSITSTORESemarang
Wireless Calling System Restaurant Rumah Makan Mesin Antrian Panggil 10 Pcs Pager Set - Set 10Rec,Rp2.050.000Rp2.932.500,1 terjual,HomeProdukOnlineJakarta Utara
MESIN ANTRIAN MODEL TOMBOL SEMI MULTIMEDIA,Rp18.500.000,,BMSITSTORESemarang
MESIN ANTRIAN MODEL TOMBOL SEMI MULTIMEDIA,Rp22.000.000,,banking equipmentSemarang
Mesin Antrian Bank BJB BRI Mandiri BNI BPR,Rp21.000.000,,BMSITSTORESemarang
mesin antrian restoran kafe Wireless Calling System Restaurant Mesin Antrian 10 Pager - SU-68G-10 - Black,Rp1.506.700,,Azkindo PratamaBekasi
"Kios K Mesin Antrian Digital 21,5 Inch Touchscreen",Rp17.500.000,,BMSITSTORESemarang
MESIN ANTRIAN SEKOLAH 17 INCH TOUCHSCREEN,Rp19.000.000,,banking equipmentSemarang
RTKS Wireless Calling System Restaurant Mesin Antrian 16 Pager hitam,Rp1.225.000,5.04 terjual,kuinginbeliYogyakarta
Mesin Antrian Rumah Sakit BPJS,Rp13.900.000,5.02 terjual,cv rdv indo printKab. Sumedang
RETEKESS Wireless Calling System Restaurant Mesin Antrian 16 Pager - TD157 RTKS Bel Restoran,Rp1.599.000,,Astra FotoJakarta Pusat
Calling System Restaurant Wireless Pager Mesin Antrian Alarm Cafe shop,Rp2.499.000,5.018 terjual,Iware Store SurabayaSurabaya
Wireless Calling System Restaurant Mesin Antrian 16 Pager Hitam CTP301 RTKS,Rp995.000,2 terjual,JLSMarketJakarta Barat
box mesin antrian android kiosk,Rp4.000.000,,BMSITSTORESemarang
Wireless  Bel Calling System Restaurant Rumah Makan Cafe Mesin Antrian 10 Pager,Rp2.855.700,,HomeProdukOnlineJakarta Utara
Kios K Mesin Antrian Double Printer + TAP NFC,Rp19.300.000,,BMSITSTORESemarang
Wireless Calling System LED Display Mesin Antrian Speaker,Rp920.000Rp1.150.000,,HomeProdukOnlineJakarta Utara
Kios K Mesin Antrian Double Printer + TAP NFC Custom,Rp19.300.000,,BMSITSTORESemarang
Wireless Calling System Restaurant Mesin Antrian 16 Pager - CTP302,Rp1.023.200,10 terjual,DiBudgetinJakarta Barat
Mesin Antrian Bel Cafe Restoran 10 Pager Wireless Calling System Alarm 2 Call Mode 300mAh - TD164,Rp1.644.300,,DuboraJakarta Barat
tombol angka mesin antrian dan bel otomatis,Rp12.000,5.01 terjual,atmen storeKab. Temanggung
printer nomor mesin antri antrian,Rp1.200.000,4.930+ terjual,atmen storeKab. Temanggung
Alat Pemanggil Antrian Restoran / Bel pemanggil pelanggan Wireless Calling System Mesin Restaurant,Rp1.385.000Rp3.700.000,5.015 terjual,Hary KnightKab. Bogor
Mesin Antrian Blueprint ECO 58D ( USB + BT + RJ11 ) Printer Bluetooth Thermal Kasir Struk ECO58D,Rp357.000,,Sadar Jaya MajuSurakarta
Mesin Antrian Restoran / Resto Cafe Sharkpos RP20A Guest Paging Kasir,Rp2.235.000Rp3.250.000,5.01 terjual,AUTO BARCODESurabaya
Jual Mesin Antrian Box - Harga Box Alat Antrian,Rp4.200.000,,Pradana KomputerJakarta Utara
Mesin Antrian InterActive Multimedia Queue System Touch Screen V.6,Rp6.270.000,,InterActive Official StoreSurabaya
Wireless Calling System Restaurant Mesin Antrian 10 Pager - TD158,Rp1.255.900,,BELIKIJakarta Barat
Mesin Antrian System / Antrian Mesin System 3 Display 1 keypad Call,Rp7.250.000,1 terjual,touchindoJakarta Utara
Mesin Antrian Design Modern (Box Only),Rp3.850.000,1 terjual,PROLABELSurabaya
Mesin Antrian System Layar Display Tanpa Keypad,Rp2.050.000,,touchindoJakarta Utara
Mesin Antrian Cafe Bar PUB Distro Pujasera Pager Restoran CPS-T112,Rp2.980.000,1 terjual,USUKMA-GROSIR-JKTJakarta Pusat
Printer Thermal Mesin Antrian,Rp1.180.000,100+ terjual,Sala3.NETSalatiga
Mesin Antrian KIOSK Standar Touchscreen Pajak/Layanan Publik/Puskesmas,Rp11.500.000,,ArtNesia - Seni & Kerajinan KayuBandung
Mesin Antrian Restoran - Popular Wireless Guest Paging System,Rp1.490.000,4.940+ terjual,USUKMA-GROSIR-JKTJakarta Pusat
kiosk mesin antrian 17 inch,Rp7.800.000,,Absterghost StoreBekasi
"mesin antrian wireless hanya papanya saja tidak ada kelengkapan apa2, belum di coba, harga gambling tanpa garansi, abaikan gambar terakhir",Rp215.000,,etnic-cellYogyakarta
Mesin Antrian Bel Cafe Restoran 20 Pager Wireless Calling System Queue Alarm - QC8200,Rp2.147.800,1 terjual,Buzper OfficialJakarta Barat
Alarm Antrian Alat Panggil Antrian Pesanan Restoran Cafe Wireless Calling System Restaurant Mesin Antrian,Rp1.384.200,,Upin Ipin MallJakarta Barat
Wireless Calling System Receiver Pager Mesin Antrian - TD157,Rp63.900,,CENTRAL KITJakarta Barat
Mesin Antrian Digital Dengan Kamera Barcode Dan Fingerprint Kios K,Rp13.800.000,,rdvindoprintBekasi
MESIN NOMOR ANTRIAN OTOMATIS,Rp1.200.000,5.02 terjual,EndiLedBekasi
( 1 DUS ) KERTAS THERMAL 80 X 80 MM MESIN ANTRIAN TIKET PARKIR EPSON,Rp750.000,5.011 terjual,Barcode Official StoreJakarta Pusat
Mesin Antrian Pager Wireless Calling System Restaurant - 10 Pager,Rp1.690.000,,TAFFHOME STOREJakarta Barat
Console Box Mesin Antrian BPJS,Rp11.000.000,,cv rdv indo printKab. Sumedang
Wireless Calling System LED Mesin Nomor Antrian Speaker Keypad - TD101,Rp1.393.520,,OnePortalJakarta Barat
box mesin antrian,Rp6.050.000,3 terjual,banking equipmentSemarang
kontrol printer tiket mesin antrian antri,Rp800.000,1 terjual,atmen storeKab. Temanggung
"Mesin antrian BPJS Puskesmas, Klinik, RS Bisa custom",Rp12.000.000,,Hidayat4DZMedan
KERTAS ROLL THERMAL 80 X 80 mm - PRINTER MESIN ANTRIAN TIKET PARKIR,Rp18.500,4.7100+ terjual,Barcode Official StoreJakarta Pusat
RTKS Wireless Calling System Receiver Pager Mesin Antrian - SU-668,Rp179.400Rp243.600,,Bahira01Jakarta Barat
Wireless Calling System Receiver Pager Mesin Antrian  - TD157,Rp64.000,,VersklaJakarta Barat
mesin nomor antrian 2 LOKET,Rp1.135.000,4.928 terjual,Aneka Led KomponenKab. Brebes
KERTAS ROLL THERMAL 80x140 mm | MESIN ANTRIAN TIKET PARKIR THERMAROL,Rp78.000,5.011 terjual,CODESHOP SURABAYA BARATSurabaya
Printer Mesin Antrian 3 Layanan,Rp1.340.000,5.030+ terjual,Sala3.NETSalatiga
Mesin Antrian Restoran 10 Pager Wireless Calling System Restaurant,Rp1.599.999,,OnePortalJakarta Barat
tombol mesin antrian Wireless Qaytech,Rp195.000,5.08 terjual,QaytechCimahi
Mesin Antrian 19 Inch,Rp12.000.000,5.01 terjual,BMSITSTORESemarang
"COVER MESIN ANJUNGAN, KIOSK, ANTRIAN MURAH BERKUALITAS (BISA CUSTOM)",Rp4.500.000,5.03 terjual,ARTHASAVANADIGITALKab. Bekasi
Wireless Calling System Restaurant Pager - Mesin Antrian Alarm Cafe Iware Q10M,Rp1.500.000Rp2.000.000,,axelposSurabaya
Mesin Antrian Wireless dengan panggilan suara manusia dan display LED,Rp2.200.000,5.06 terjual,Sala3.NETSalatiga
Software Mesin Antrian,Rp500.000,4.74 terjual,Ologis Official StoreJakarta Selatan
MESIN ANTRIAN MULTIMEDIA TANPA TV,Rp14.000.000,,BCOMP MAKASSARMakassar
IWARE Mesin Antrian Alarm Cafe shop RP-20A Wireless Calling System,Rp2.499.000,1 terjual,ATI OFFICIAL STORESurabaya
tiket mesin antrian 1 loket + data serial,Rp2.999.999,1 terjual,Dunia DuinoBandung
YOUTHINK Wireless Calling System Restaurant Mesin Antrian 20 Pager,Rp1.849.900,,MinimusincBandung
Printer Tiket mesin Antrian auto cutter,Rp3.200.000,5.013 terjual,Cipta Media TeknologiKab. Badung
Mesin Kios Antrian,Rp4.000.000,,MediatamaMedan
Wireless Calling System Restaurant Mesin Antrian 10 Pager - LFTZ44,Rp1.170.100,1 terjual,DiBudgetinJakarta Barat
Mesin Antrian Bel Cafe Restoran 10 Pager Wireless Calling System Alarm 3 Call Mode 360mAh - SU68G10,Rp1.480.000,,DuboraJakarta Barat
Mesin antrian system suara,Rp1.450.000,,EndiLedBekasi
Mesin Alat Antrian Ekonomis – Harga Sangat Murah,Rp1.500.000,,MesinAntrianPekanbaruPekanbaru
MESIN ANTRIAN SEKOLAH 19 INCH TOUCHSCREEN,Rp15.250.000,,atk semarangSemarang
Pengeras Suara Dengan Speaker Ganda Sistem Panggilan Nirkabel 3-4 Digit Tampilan LED Untuk Menunggu Antri Mesin Antrian Restoran Kantor Pelayanan dll Sound Amplifier With Dual Speakers 3-4 Digit Wireless Calling System Led Display For Restaurant Waiting,Rp528.500,,ZileniumJakarta Barat
Digital Signage 17 19 22 Inchi Mesin Antrian Custome Touch-Non-screen,Rp28.999.999,,SmartdisplayJakarta Barat
