Produk,Harga,Sold,Nama Toko
Stock Ready Box Mesin Antrian Casing Kiosk 17 Dan 19 In Terlaris,Rp4.559.000,,warungonline_officeBandar Lampung
Mesin Antrian Wireless Bel Cafe Restoran 20 Pager Calling System Queue Alarm - T116,Rp1.994.500,,Buzper OfficialJakarta Barat
Wireless Calling System Restaurant Mesin Antrian 16 Pager - CTP301,Rp1.019.300,,BELIKIJakarta Barat
Mesin Antrian Bel Cafe Restoran 20 Pager Wireless Calling System Queue Alarm - TD172,Rp1.841.200,,Buzper OfficialJakarta Barat
Mesin antrian wireless 2LED 4 Loket,Rp2.900.000,3 terjual,atmen storeKab. Temanggung
"Mesin Antrian Kantor Pajak Kiosk touchscreen 17"" Terjangkau komplit",Rp17.760.000,1 terjual,Ologis Official StoreJakarta Selatan
mesin antrian bank,Rp14.000.000,,cv rdv indo printKab. Sumedang
PAKET MESIN ANTRIAN RUMAH SAKIT/PUSKESMAS/KLINIK JKN BPJS,Rp12.890.000,,PROLABELSurabaya
"Kiosk Touchscreen 19"" Mesin Antrian Anjungan Mandiri Murah",Rp9.449.000,,Ologis Official StoreJakarta Selatan
Mesin Alarm Antrian Wireless Restoran Kios Cafe Pager Calling System,Rp1.900.000,,TOKO OLIOJakarta Barat
Restaurant Paging System Iware Q10M-Mesin Antrian Alarm Cafe Restraurant-10 Pager Alarm 3 Mode,Rp1.400.000,,ANDALAS COMPUTER ACCSurakarta
Wireless Calling System Restaurant Mesin Antrian 16 Pager Cafe Restoran Modern Sistem Alarm Dapat Terhubung hingga 998 Pager Bertahan 20 Jam RTKS  CTP301,Rp980.000,,Tas VisionJakarta Barat
RTKS Wireless Calling System Restaurant Mesin Antrian Cafe Coffee Shop 11 Pager - SU-668,Rp1.850.000,,Bawah TanggaJakarta Barat
PAKET MESIN ANTRIAN PELAYANAN KESEHATAN,Rp13.999.000,5.07 terjual,Bcompbiz Digital TeknologiBogor
Mesin Antrian Wireless Calling System Restaurant 16 Pager - CTP301,Rp1.439.000Rp1.788.000,,Mitra Sarana NusaBekasi
Foodcourt Paging System Calling Guest food court pager Sharkpos RP20A / Mesin Antrian Restoran,Rp2.235.000Rp5.900.000,,TokoITOnlineSurabaya
Mesin Antrian Bel Cafe Restoran 20 Pager Wireless Calling System Queue Alarm - TD183,Rp3.630.600,,Buzper OfficialJakarta Barat
Wireless Calling System Receiver Pager Mesin Antrian 1 PCS - CTP301,Rp60.600,,BELIKIJakarta Barat
lemari mesin antrian plat besi custom,Rp8.250.000,5.01 terjual,cv rdv indo printKab. Sumedang
PAKET MESIN ANTRIAN RS/KANTOR/PUSKESMAS/INSTANSI TOUCHSCREEN FREE APLIKASI BERGARANSI LANGSUNG KIRIM,Rp17.500.000,,PROLABELSurabaya
tombol panggil loket mesin antrian,Rp220.000,15 terjual,atmen storeKab. Temanggung
Wireless Calling System Restaurant Pager Mesin Antrian - Full Set,Rp1.316.500Rp1.880.600,1 terjual,Socko GrosirJakarta Barat
mesin antrian bank dll,Rp23.000.000,,cv rdv indo printKab. Sumedang
Pager Restoran Cafe Mesin Antrian Wireless Calling System 10 Channels - Hitam,Rp1.682.010Rp1.699.000,,CMAG storeJakarta Barat
mesin kiosk antrian custom plat besi 150x45,Rp14.500.000,,Giliantz EnterpriseBandung
MESIN ANTRIAN TOUCHSCREEN LAYANAN BANK,Rp23.000.000,,BMSITSTORESemarang
Wireless Calling System LED Display Mesin Antrian Speaker,Rp599.900,,TOSERBA BANDUNG ONLINESHOPBandung
MESIN ANTRIAN BANK,Rp13.999.000,5.02 terjual,Bcompbiz Digital TeknologiBogor
Sistem Mesin Antrian Wireless 1 console,Rp2.700.000,,2R Hardware & ElectronicSurabaya
Mesin Antrian 3 Loket wiralles Digital,Rp16.200.000,,VETRONIKSemarang
Alat Antrian Pesanan Makanan Restoran Wireless Call System Mesin Panggil Antrian Pager Pemanggil Konsumen,Rp1.499.000,,SAKO SAVORJakarta Barat
Mesin Alat Antrian LED Display dengan Speaker / Wireless Calling System 3 & 4 Digit with Remote ORIGINAL,Rp545.800,,Ghani Gadget StoreJakarta Barat
"Mesin Antrian Bank, Pajak, Puskesmas, Profesional",Rp38.500.000,,Datascrip Service CenterJakarta Utara
Mesin Antrian Komputer TouchScreen Minimalis Best,Rp32.170.000,,HARDWARE HOODJakarta Timur
MESIN KASIR KIOSK POS STANDING SELF SERVICE | POSBANK KOREA BIGPOS TL2150,Rp42.400.000,,AGMTechJakarta Utara
MESIN ABSENSI A3,Rp49.000Rp239.000,23 terjual,Keissha ShopJakarta Timur
Wireless Calling System Pager Restaurant 10 Pager Pemanggil Antrian Pengunjung Alat Panggil Resto,Rp2.391.000,,Daily-MallTangerang
Pita / Tinta Mesin Absensi Krisbow MT-6100N,Rp70.000,250+ terjual,MSI KomputerJakarta Pusat
Pita / Tinta Mesin Absensi Krisbow MT6100,Rp70.000,12 terjual,MSI KomputerJakarta Pusat
Printer tiket antrian mesin antrian,Rp1.350.000,5.01 terjual,pusat_jadwal_sholatKab. Sidoarjo
Mesin Antrian Bundling 19 Inch,Rp30.000.000,5.01 terjual,BMSITSTORESemarang
KERTAS THERMAL ROLL CODESHOP 80 X 80 MM - MESIN ANTRIAN & PARKIR,Rp15.000,1 terjual,CODESHOP SURABAYA TIMURSurabaya
Mesin Antrian Bel Cafe Restoran 10 Pager Wireless Calling System Alarm - TD164,Rp1.534.500,,Buzper OfficialJakarta Barat
Wireless Calling System Restaurant Pager - Mesin Antrian Alarm Cafe,Rp2.495.000,,Viracode OfficialSurabaya
mmc nada bel otomatis atau mesin antrian,Rp70.000,5.01 terjual,atmen storeKab. Temanggung
Wireless Calling System Restaurant Mesin Antrian 20 Pager - TD163,Rp3.599.999,,OnePortalJakarta Barat
Mesin Antrian Nomor Display Queue Number Calling System Order Caller QMS Management Mesin Nomor Antrian Restoran Cafe Resepsonis,Rp497.100,,Gudang Grosir Import MurahJakarta Barat
Wireless Calling System Restaurant Mesin Antrian 16 Pager,Rp1.299.900,,TOSERBA BANDUNG ONLINESHOPBandung
Wireless Calling System LED Display Mesin Antrian Speaker - C34 Pro Warna Hitam Jumlah Angka 4 Digit,Rp628.000,,ZileniumJakarta Barat
RTKS Wireless Calling System Receiver Pager Mesin Antrian for CTP302 - TD157 Baterai Plastik Alarm Bell,Rp73.800,,Dolca IDJakarta Barat
Kios K Mesin Antrian Digital Dengan Kamera Barcode Dan Fingerprint,Rp23.000.000,,banking equipmentSemarang
RTKS Wireless Calling System Restaurant Mesin Antrian 16 Pager alat panggilan resto pelanggan pengunjung pesanan kasir nomor - CTP301 - Black,Rp1.300.000,,MyHanifahSemarang
Wireless Calling System Restaurant Mesin Antrian 10 Pager - TD156,Rp2.273.400,,KasiSolusiJakarta Barat
Mesin antrian LED dua sisi 1 loket,Rp1.200.000,5.03 terjual,atmen storeKab. Temanggung
PAKET MESIN ANTRIAN PUSKESMAS HEMAT,Rp12.798.900,,Zabuza 1704Jakarta Barat
Mesin Antrian Wireless Paket 1 - Solusi Sederhana untuk Rumah Makan & Kafe,Rp950.000,,Zetronic - Mesin Antrian dan Kiosk AntrianBandung
Paket Kios K Mesin Antrian Sekolah 19 Inch,Rp15.250.000,,rdvindoprintBekasi
mesin antrian wireless komputer 2 loket,Rp1.700.000,5.02 terjual,atmen storeKab. Temanggung
mesin antrian wireless komputer 5 loket,Rp2.750.000,5.03 terjual,atmen storeKab. Temanggung
WIRELESS CALLING LED MESIN ANTRIAN SPEAKER BANK RESTO DOKTER KANTOR,Rp999.900Rp1.500.000,,ZoMi Official ShopBandung
Kiosk - 19 inch Mesin Antrian Windows,Rp12.000.000,,LED-Display-DigitalJakarta Barat
RTKS Wireless Calling System Receiver Pager Mesin Antrian for CTP302 - TD157,Rp60.500,,OwllivesJakarta Barat
"Mesin Antrian BPJS, PUSKESMAS, KLINIK, APOTEK Terlaris...!!!",Rp11.500.000,,DSI Deluxe CCTVKab. Kudus
Wireless Caller Buzzer Pager Cafeshop Restaurant Rumah Makan Mesin Panggil Antrian 16 Pager - CTP301 - Black,Rp1.480.000,,AhatechSemarang
Wireless Calling System Restaurant Mesin Antrian 20 Pager Biru TD167F RETEKESS,Rp2.875.000,,JLSMarketJakarta Barat
Wireless Calling Waiting System Mesin Tunggu Antrian Bel 16 Pager Wireless Pemanggil Antrian Restaurant Queue System Bergaransi 1 Bulan,Rp1.050.000,,TRUSTED SELLERSJakarta Barat
Retekess TD158 Wireless Calling System Mesin Antrian Model Bulat,Rp1.690.000,,CVG StoresJakarta Pusat
Mesin Antrian Wirelesss 4 layanan Dengan Printer Auto Cut,Rp5.700.000,,Sala3.NETSalatiga
kabel tombol loket mesin antrian,Rp10.000,5.0100+ terjual,atmen storeKab. Temanggung
Paket Mesin Antrian Digital 17 Inch Non TKDN + Software + Packing Kayu,Rp17.325.000,5.01 terjual,BcompbizBogor
MESIN ANTRIAN WIRELESS VERSI BASIC,Rp3.081.000,,DigitallElektronikCimahi
TERLARIS CONTROLLER MESIN ANTRIAN TING TONG + KEYPAD TERLARIS,Rp750.000,,rcvapestoreBekasi
Mesin panggil karcis antrian alat antri display antrian wireless,Rp1.000.000,5.01 terjual,Stufi MediaKab. Banyumas
PRINTER THERMAL KASIR EP200II MESIN ANTRIAN 80MM [AUTOCUTTER/USB/RJ11],Rp774.000,,GOLDEN NIRWANA 57Kab. Sleman
